screenName,text,created,id
fhollande,"J’étais ce matin à Molenbeek pour l’exposition de @CartooningPeace, lauréate de @LaFrancesengage, avec… https://t.co/T5pW1hXSUp",2017-11-20 16:11:44,932642627006189568
fhollande,"Il y a deux ans, l’horreur frappait notre pays. 130 morts et plus de 300 blessés, toutes victimes d’une idéologie d… https://t.co/jjvAHbrvuV",2017-11-13 13:02:19,930058243312881665
fhollande,Avec Jack Ralite s'éteint une grande voix qui portait loin et qui emportait bien au-delà de sa famille politique. H… https://t.co/T0d0uDDvQC,2017-11-12 18:17:08,929775080716029952
fhollande,J’ai rencontré « Les casques blancs syriens » pour faire un point sur l’évolution de la situation en Syrie depuis n… https://t.co/zFIlahZNlI,2017-11-07 16:40:22,927938790848593920
fhollande,"Ce qui m’anime aujourd’hui : créer de l’utilité sociale en accélérant l’innovation, et ainsi donner du sens au progrès.",2017-11-07 13:13:28,927886723807371265
fhollande,Le numérique a donné aux entrepreneurs d’intérêt général une dimension jusque-là inconnue à leur projets de solidarité.,2017-11-07 13:08:19,927885427025088516
fhollande,"La transition écologique a suscité des initiatives dans l’économie circulaire, des énergies renouvelables et des économies d’énergie.",2017-11-07 13:07:56,927885327804575744
fhollande,Les structures de financement d’inspiration coopérative et mutualiste ont pu servir de cadre au Crowdfunding.,2017-11-07 13:07:39,927885259361935360
fhollande,Les entreprises d’insertion ont pu offrir à des personnes éloignées du marché du travail des activités utiles et formatrices.,2017-11-07 13:07:23,927885190587961344
fhollande,Je veux insister aujourd’hui sur l’enjeu représenté par le numérique dans le développement de l’économie sociale et solidaire.,2017-11-07 13:05:40,927884757136011265
fhollande,Le défi pour les Etats c’est donc d’accélérer la diffusion des innovations et d’en maitriser les conséquences sur nos sociétés.,2017-11-07 13:04:57,927884576957063168
fhollande,"Votre rôle, et même votre intérêt, est que la révolution numérique ne laisse personne de côté.",2017-11-07 13:02:03,927883847278186498
fhollande,Notre objectif doit être d’éviter que la fracture numérique ne dégénère en fracture sociale.,2017-11-07 13:01:45,927883772594450432
fhollande,Le champ d’application des technologies liées à l’intelligence artificielle est de plus en plus vaste.,2017-11-07 13:01:25,927883688364228608
fhollande,"En 2017, les start-up françaises ont levé près de 4 milliard d’euros.",2017-11-07 13:00:32,927883466959740928
fhollande,Jamais autant de start-up n’ont vu le jour dans notre pays : 1500 sont créées chaque année.,2017-11-07 13:00:07,927883362093666304
fhollande,Je suis fier que la France et l’industrie française y soient fortement représentés.,2017-11-07 12:59:46,927883272633356289
fhollande,"Aujourd’hui, j’ai pu rencontrer parmi les plus grands entrepreneurs de la planète.",2017-11-07 12:59:27,927883194589958144
fhollande,Je suis très heureux de participer à l’édition 2017 du #WebSummit.,2017-11-07 12:58:38,927882987215183872
fhollande,"RT @helloasso: « Mieux accompagner les associations dans leur prise en main du numérique, c’est primordial pour l’engagement citoyen » conv…",2017-11-07 11:03:15,927853952556814336
fhollande,Début de l’échange au sujet du mouvement #SocialGood. https://t.co/hzd38yMYjR,2017-11-07 11:02:42,927853812462833664
fhollande,Visite de l’espace #FrenchTech au #WebSummit. https://t.co/1RCMfG5uiJ,2017-11-07 09:56:37,927837184505401344
fhollande,RT @Xavier_Bettel: Content de revoir @fhollande pour une promenade nocturne à #Lisbonne et discuter des projets d'avenir #websummit2017 htt…,2017-11-06 21:08:58,927643996033355777
fhollande,Visite nocturne de Lisbonne avec @Xavier_Bettel https://t.co/FZ7gzUWxOV,2017-11-06 19:34:19,927620178384490496
fhollande,"Déjeuner avec @antoniocostapm à Lisbonne, avant mon intervention demain au @WebSummit  https://t.co/KZTkNqjwem",2017-11-06 13:28:12,927528041550671872
fhollande,En Corée du Sud avec Ban Ki-moon et le Premier ministre Lee Nak-yeon pour le World Knowledge Forum. https://t.co/bynAHKzmv8,2017-10-16 22:54:55,920060516034367489
fhollande,J'adresse toutes mes félicitations à @AAzoulay qui va promouvoir la culture et l'éducation dans le monde. https://t.co/waOz5S6t3Q,2017-10-13 17:43:36,918895006638854146
fhollande,#LaFrancesengage https://t.co/W7FqbNxJpv,2017-10-13 15:07:49,918855801065885697
fhollande,"De la France à l’espace, voici le drapeau  et l’Accord de Paris que @Thom_astro avait emportés avec lui dans l’IS… https://t.co/w6xwCdFKqG",2017-10-05 16:04:09,915970874926407682
fhollande,Toutes mes pensées et ma solidarité pour les deux victimes de l'attaque à Marseille. Notre vigilance doit rester maximale.,2017-10-01 15:12:53,914508423382884352
fhollande,"Terrible drame à Mexico, 32 ans après le séisme meurtrier de 1985. J'exprime toute ma solidarité au peuple mexicain. ",2017-09-20 06:46:51,910394809034174464
fhollande,"Avec la disparition de Fred Moore, la France perd une personnalité dont le dévouement à son pays était indéfectible. https://t.co/vPNHMNGhOY",2017-09-18 10:26:35,909725330818179072
fhollande,"Je me réjouis du retour de Loup Bureau parmi les siens, après une interminable attente. ➡️ https://t.co/15Vg778LYg",2017-09-17 08:51:21,909338976938536960
fhollande,Je ressens de la fierté et une certaine impatience. #Paris2024 est une chance pour plusieurs générations.  &gt;&gt; https://t.co/chQwQw0Mi0,2017-09-13 18:35:08,908036337726566400
fhollande,"Avec la disparition de Pierre Bergé, je perds un ami. &gt;&gt;&gt; https://t.co/pVBVeF8IgS",2017-09-08 10:02:11,906095312816795648
fhollande,J'exprime ma solidarité et j'adresse mes pensées à toutes les personnes touchées par l'ouragan #Irma,2017-09-07 16:02:11,905823523188420609
fhollande,"RT @franceinfo: François Hollande prend la tête de La France s'engage et ne va """"""""pas utiliser une fondation à des fins politiques"""""""" https://t…",2017-09-05 18:19:46,905133367653490690
fhollande,"Je viens de prendre la présidence de @LaFrancesengage. La cohésion sociale et nationale ont été, et seront, toujours au coeur de mon action.",2017-09-05 17:30:28,905120961019686912
fhollande,Toute ma solidarité aux victimes de l'attentat de Barcelone. &gt;&gt;&gt; https://t.co/kJEstE5Bjy,2017-08-17 19:04:21,898259218972540928
fhollande,Nicole Bricq était une passionnée. https://t.co/uYRFYYrpNk,2017-08-06 17:11:06,894244453485096960
fhollande,Max Gallo aimait la France et donc son Histoire. En toutes choses il mettait de la dignité.,2017-07-19 18:56:31,887748001514520576
fhollande,"Simone Veil a incarné la dignité, le courage et la droiture.  La France perd une de ses grandes consciences. &gt;&gt;&gt; https://t.co/gB7igtHkHP",2017-06-30 09:21:18,880717871688634368
fhollande,"Le peuple britannique est attaqué, il saura montrer sa détermination sans faille. Les Français sont à ses côtés, nous sommes tous concernés.",2017-06-04 07:03:46,871261175408971776
fhollande,"Bon retour sur Terre @Thom_astro, les Français sont fiers de vous avoir accompagné tous ces mois autour de notre si belle et fragile planète",2017-06-02 16:20:33,870676519928160257
fhollande,"L'#AccorddeParis s'inscrit dans le temps long, celui des générations futures. @realDonaldTrump a renoncé à l'avenir, pas les États-Unis !",2017-06-01 21:46:12,870396085973512192
fhollande,"Tout mon soutien aux victimes de cet effroyable attentat et au peuple britannique.Ces lâches ont visé la jeunesse, symbole de notre liberté.",2017-05-23 07:30:44,866919308135456768
fhollande,"Merci à tous pour vos nombreux messages de soutien, ils me vont droit au coeur, ainsi qu'aux miens.",2017-05-19 11:37:38,865531893906677764
fhollande,Merci ! ❤️ https://t.co/4jJGQg0Q3q,2017-05-15 06:18:40,864002070206173184
fhollande,C'est ce que vous ferez et je vous accompagnerai toujours,2017-05-14 09:57:48,863694830144303104
fhollande,"Une nouvelle page s'ouvre avec un nouveau président et vous devez être dans un esprit de réussite, de réussite de notre pays",2017-05-14 09:57:14,863694684635508736
fhollande,"Chers amis, je suis venu vous dire ces mots simples que sont la fierté, la reconnaissance et la bienveillance",2017-05-14 09:56:34,863694520348758016
fhollande,Je n'ai cessé durant 5 ans de donner la priorité à la jeunesse et c'est vers elle qu'il faut toujours se tourner,2017-05-14 09:55:19,863694203045519361
fhollande,Je vous appelle à inventer l'avenir que vous devez présenter à notre peuple. Le pays a besoin de vous et aura toujours besoin de vous,2017-05-14 09:54:32,863694007884533760
fhollande,"Il est tellement plus simple de regarder, de contester, de déplorer, sans jamais mettre les mains dans le moteur qui fait avancer le pays",2017-05-14 09:52:27,863693482191355904
fhollande,"Quand un de nos compatriotes commence à douter de ce qu'est la démocratie, nous devons aller le chercher, le convaincre",2017-05-14 09:51:06,863693141580414976
fhollande,Il n'y a pas pire menace que celle qui verrait notre pays douter de la démocratie,2017-05-14 09:50:06,863692890307870720
fhollande,"La politique, c'est d'être utile à ceux que l'on sait être en difficulté",2017-05-14 09:49:49,863692819508076545
fhollande,"Je ne doute pas que ce que des générations ont fait, répondant au nom de socialisme, durera et perdurera",2017-05-14 09:48:41,863692533410406400
fhollande,Mais l'Histoire retiendra que c'est nous qui avons fait le mariage pour tous,2017-05-14 09:46:56,863692091972608001
fhollande,"Je ne vais pas vous accabler de tout ce que nous avons fait, cela prendrait trop de temps, cela prendrait 5 ans",2017-05-14 09:46:16,863691927337574400
fhollande,Ce sont toujours des socialistes qui ont fait en sorte que le pays reprenne espoir lorsqu'il doutait,2017-05-14 09:45:17,863691680536338434
fhollande,C'est toujours à la gauche qu'il appartient de faire avancer le progrès social et de permettre le redressement économique,2017-05-14 09:44:37,863691509408817152
fhollande,"Nous avons cette satisfaction, je laisse un pays dans un état bien meilleur que celui que j'ai trouvé",2017-05-14 09:43:25,863691209109258240
fhollande,Nous avons fait en sorte de signer un accord historique sur le climat,2017-05-14 09:43:05,863691124694597632
fhollande,"Nous, la France, avons fait tout ce que nous pouvions pour que la Grèce reste dans l'Europe",2017-05-14 09:42:05,863690872902135808
fhollande,Nous avons vécu des crises et là encore nous avons tenons bon. La France est restée la France,2017-05-14 09:40:59,863690598557011969
fhollande,J'ai veillé à ce que notre pays puisse tenir bon dans ces circonstances. C'est ma fierté que d'y être parvenu,2017-05-14 09:40:26,863690458869968896
fhollande,J'ai exercé pendant 5 ans la Présidence de la République dans des épreuves terribles qui ont saisi notre pays de stupeur,2017-05-14 09:39:37,863690253361721344
fhollande,Nous devons être exemplaires dans l'action et unis dans le mouvement,2017-05-14 09:39:22,863690188454866944
fhollande,"Diriger la France est une lourde responsabilité que vous, militants, devez mesurer",2017-05-14 09:37:34,863689736979968000
fhollande,"Diriger la France est une responsabilité immense, notre pays est regardé partout dans le monde comme le pays de la liberté et du progrès",2017-05-14 09:36:03,863689355680002048
fhollande,"Sans vous, je n'aurais jamais eu la chance de gouverner la France",2017-05-14 09:35:09,863689130198388736
fhollande,"Je suis lié à vous comme vous êtes liés à moi, par notre histoire commune",2017-05-14 09:34:38,863688999801675776
fhollande,"Je voulais revenir ici, rue de Solférino, pour retrouver des souvenirs, des visages",2017-05-14 09:34:20,863688923834437632
fhollande,J’ai appelé @EmmanuelMacron pour le féliciter chaleureusement pour son élection. Je lui ai exprimé tous mes vœux de réussite pour notre pays,2017-05-07 18:31:15,861287329650151424
fhollande,"Aujourd'hui, la Nation toute entière exprime sa profonde gratitude et sa reconnaissance au capitaine Xavier Jugelé.",2017-04-25 10:12:47,856813231251353600
fhollande,La mobilisation s'impose mais aussi la clarté des choix. Je voterai @EmmanuelMacron.,2017-04-24 14:57:00,856522367325138945
fhollande,Mes pensées vont à la famille du policier tué et aux proches des blessés. Un hommage national sera rendu.,2017-04-20 21:32:00,855172221756735489
fhollande,On annonce un record d'embauches en 2017. Je laisserai à mon successeur un pays en bien meilleur état que celui que… https://t.co/XSmpyhqpab,2017-04-20 11:54:02,855026769245741056
fhollande,"Dire les erreurs du passé, car elles sont autant d'alertes chaque fois que l'inconscience et l'indifférence nous me… https://t.co/krhmCwxNqm",2017-04-16 10:24:44,853554744446656512
fhollande,"En Syrie, """"""""il faut saisir les fautes de l'adversaire"""""""" @lemondefr https://t.co/9cJJOBPBx5",2017-04-12 17:51:05,852217523462340608
fhollande,La France n'oublie pas que durant les deux guerres mondiales le Canada a été à ses côtés pour défendre son indépendance et sa liberté.,2017-04-09 15:49:37,851099789320216578
fhollande,"J'ai appris avec consternation l’attentat odieux qui a frappé, ce matin l'Egypte, et qui a fait de nombreuses victi… https://t.co/fspRUR9o7s",2017-04-09 10:50:54,851024617158430720
fhollande,La France exprime sa sympathie et sa solidarité aux familles des victimes de Stockholm et à tous les Suédois.,2017-04-07 16:30:24,850385277281587201
fhollande,"La France, avec ses partenaires, va prendre toutes les initiatives pour relancer le processus de transition politique en #Syrie",2017-04-07 09:17:06,850276234076356609
fhollande,"Mes sincères condoléances à la famille, aux amis et aux frères d'armes du soldat tué au Mali dans l'accomplissement de sa mission.",2017-04-06 09:01:43,849909974205702144
fhollande,Je salue l’accord trouvé par les organisations syndicales et patronales sur une nouvelle convention de l’assurance chômage.,2017-03-29 05:34:09,846958637658619904
fhollande,"Si l'on veut que le monde change, il faut que l'Europe soit forte et que la France prenne toute sa part dans cette Europe-là. #EU60 #Rome",2017-03-25 12:44:50,845617472111808513
fhollande,J'ai adressé mes condoléances à Theresa MAY à la suite de l’attaque qui a endeuillé le Royaume-Uni aujourd'hui.,2017-03-22 19:32:28,844632892353495045
fhollande,"Aujourd’hui, la France est plus forte qu’il y a cinq ans. Retrouvez le bilan du quinquennat : https://t.co/bMaPSCbzmG",2017-03-22 11:43:48,844514947056861184
fhollande,"Sur proposition du Premier Ministre @BCazeneuve, j'ai nommé @MatthiasFekl Ministre de l'Intérieur.",2017-03-21 17:18:39,844236825564725249
fhollande,"Henri Emmanuelli était un homme droit. Socialiste de cœur, de raison et d'action, il n'a jamais transigé avec ses idées et ses principes.",2017-03-21 11:34:24,844150195260702720
fhollande,"Aujourd'hui, ma fierté est de pouvoir remettre à mon successeur un pays plus fort, plus digne, plus soudé, plus cohérent qu'en 2012 #Crolles",2017-03-18 21:38:21,843215019613605891
fhollande,Je salue le courage et l’efficacité des policiers et militaires face aux agressions commises par un individu particulièrement dangereux.,2017-03-18 11:41:12,843064743896240128
fhollande,Je félicite chaleureusement @markrutte pour sa nette victoire contre l'extrémisme.,2017-03-16 06:26:12,842260693571235843
fhollande,"Être Français, c'est bien plus qu’un acte juridique ou un héritage, c’est un idéal #LibéDesRéfugiés https://t.co/70liM9E7xR",2017-03-06 20:38:40,838851346124128257
fhollande,"Ce que demandent les Européens, c’est que l’UE puisse les protéger davantage https://t.co/w08vWK9YxH",2017-03-06 13:19:56,838740934837874688
fhollande,Le peuple français est souverain. Je rappelle que la Justice est également rendue en son nom et que nul ne peut s’y… https://t.co/Si8KhvFsx7,2017-03-01 15:08:22,836956281709658116
fhollande,Je suis là comme président de la République. Je n'ai qu'une ambition montrer mon soutien aux agriculteurs. Je leur… https://t.co/Adh09Nn6NN,2017-02-25 07:10:09,835386385553100800
fhollande,Bravo aux équipes de France de biathlon et de ski alpin pour leur réussite qui fait une nouvelle fois briller les couleurs de la France,2017-02-19 17:26:21,833367128938049537
fhollande,Je félicite chaleureusement Frank-Walter Steinmeier pour son élection à la présidence de la République Fédérale d'Allemagne,2017-02-12 17:34:01,830832343954898944
fhollande,"Théo a réagi avec dignité et responsabilité. La justice a été saisie, il faut lui faire confiance. Elle ira jusqu'a… https://t.co/9wn0fzQlDc",2017-02-07 17:24:46,829018076649811968
fhollande,"Je salue le courage et la détermination dont ont fait preuve les militaires, ce matin, au Carrousel du Louvre",2017-02-03 11:56:10,827485831770284033
fhollande,Je dénonce avec la plus grande fermeté l'odieux attentat qui a fait au moins six morts et de nombreux blessés dans une mosquée à Québec.,2017-01-30 07:20:19,825966859333881857
fhollande,Félicitations à cette formidable équipe de France de nouveau championne du monde !  #FRANOR,2017-01-29 20:36:33,825804849371607044
fhollande,Chaque épreuve qui frappe l'Allemagne vise la France &gt;&gt;&gt; https://t.co/kSP9xSEucl https://t.co/IFs8w9zc7Z,2017-01-27 13:46:50,824976965077782528
fhollande,"Je salue la mémoire de l'Abbé Pierre qui a dédié sa vie aux plus démunis, à la lutte contre l'exclusion et au dialogue interreligieux.",2017-01-22 10:39:18,823117832510705664
fhollande,Félicitations à Armel le Cléac’h pour cette belle victoire dans le @VendeeGlobe. Bravo pour son courage et sa détermination.,2017-01-19 17:03:26,822127337668014082
fhollande,Nous allons créer une fondation pour élargir les ambitions de @LaFrancesengage. Unissons-nous pour qu'elle soit au service de tous.,2017-01-15 16:17:06,820666126518677504
fhollande,"Félicitations à Isabelle Huppert, immense actrice, distinguée aux Golden Globes, pour son interprétation exceptionnelle dans """"""""Elle"""""""".",2017-01-09 07:08:24,818353715086299136
fhollande,François CHEREQUE était un homme dont le courage a éclairé l’action. Toute sa vie il s’est mobilisé pour la justice et le progrès.,2017-01-02 12:30:53,815898155589963776
fhollande,"Un lien indéfectible nous unit et rien ne l'altèrera. Fort de cette conviction, je vous adresse du fond du cœur mes vœux les plus chaleureux",2016-12-31 20:12:07,815289451006017536
fhollande,J'ai décidé d'accorder à Jacqueline Sauvage une remise gracieuse du reliquat de sa peine. Cette grâce met fin immédiatement à sa détention.,2016-12-28 15:12:56,814126998754881536
fhollande,"Félicitations à Thomas Coville ! Nouveau record du tour du monde à la voile en solitaire, en moins de 50 jours ! Un exploit plein de courage",2016-12-25 18:19:04,813086673881931776
fhollande,J'exprime ma solidarité aux proches du sapeur-pompier décédé accidentellement en Essonne et à ses trois collègues blessés grièvement.,2016-12-24 22:05:59,812781392060968961
fhollande,"J'adresse mes condoléances aux familles des trois gendarmes décédés dans un accident à Berneuil en Bray, ainsi qu'aux personnes blessées.",2016-12-23 22:23:43,812423469141020672
fhollande,"Michèle Morgan était bien plus qu’un regard, c’était une élégance, une grâce, une légende qui a marqué de nombreuses générations.",2016-12-20 19:43:15,811295922055512065
fhollande,"J'exprime ma solidarité et ma compassion à la Chancelière Merkel, au peuple allemand et aux familles des victimes de Berlin.",2016-12-19 21:33:43,810961335521603584
fhollande,Je condamne avec force l’assassinat de l’Ambassadeur de Russie à Ankara.,2016-12-19 19:13:05,810925943602692096
fhollande,Je salue l’adoption par le CSNU d’une résolution proposée par la France pour la protection de la population d’Alep https://t.co/qNsov517gQ,2016-12-19 16:31:58,810885397182107648
fhollande,J'exprime mon soutien aux victimes de l'incendie du foyer de travailleurs immigrés. Toute la vérité sera faite sur ce drame.,2016-12-16 16:12:11,809793254417952773
fhollande,"En déplacement à Berlin, je me suis exprimé au sujet de la situation humanitaire inacceptable à Alep https://t.co/atxegVCZ1F",2016-12-13 11:45:13,808638906174357504
fhollande,L'accord de Paris sur le climat a un an. C'est notre devoir de le mettre en œuvre pour l'avenir de l'Humanité. Il y a urgence ! #COP21,2016-12-12 21:15:02,808419916625956864
fhollande,Je condamne l'attentat ignoble contre l'église copte orthodoxe Boutrossia du Caire. La France se tient aux côtés de l'Egypte.,2016-12-11 16:59:51,807993310874890240
fhollande,Je dénonce avec force les attentats commis à Istanbul. La France apporte son plein soutien à la Turquie dans  cette nouvelle épreuve.,2016-12-11 08:26:54,807864223732813824
fhollande,".@jm_leguen Secrétaire d'Etat au Ministère des Affaires Étrangères, chargé du Développement et de la Francophonie 3/3",2016-12-06 09:41:25,806071035690893313
fhollande,".@valliniandre Secrétaire d'État, en charge des relations avec le Parlement 2/3",2016-12-06 09:40:36,806070829956165632
fhollande,"Sur proposition du Premier Ministre @BCazeneuve, j'ai nommé @BrunoLeRoux Ministre de l'Intérieur, 1/3",2016-12-06 09:40:08,806070713744584704
fhollande,J'ai nommé @BCazeneuve Premier Ministre et je l'ai chargé de former le nouveau gouvernement.,2016-12-06 08:18:09,806050080235077632
fhollande,Je félicite Alexander Van der Bellen pour le résultat net et incontesté qui le porte à la présidence de la République d'Autriche.,2016-12-04 20:24:50,805508182223290373
fhollande,"Dans les mois qui viennent mon seul devoir sera de continuer à diriger l'État, mandat pour lequel vous m'avez élu en 2012",2016-12-01 19:11:20,804402518721777664
fhollande,"Aussi, j'ai décidé de ne pas être candidat au renouvellement de mon mandat",2016-12-01 19:09:33,804402072565272576
fhollande,Je ne suis animé que par l'intérêt supérieur du pays. L'expérience m'a apporté l'humilité nécessaire dans ma tâche,2016-12-01 19:08:36,804401830784417792
fhollande,"Comme président de la République je me dois de diriger l'État. Comme socialiste, je ne peux me résoudre à la dispersion de la gauche",2016-12-01 19:07:51,804401642263216128
fhollande,"Le plus grand danger c'est le protectionnisme, c'est l'enfermement, qui seraient un désastre pour les travailleurs français",2016-12-01 19:07:11,804401474423951361
fhollande,Je porte un bilan et j'en assure toute la responsabilité. Dans cinq mois vous aurez à faire un choix pour notre pays,2016-12-01 19:06:18,804401252977246208
fhollande,"Je n'ai qu'un seul regret et c'est d'avoir proposé la déchéance de la nationalité. Je pensais qu'elle pouvait nous unir, elle nous a divisé",2016-12-01 19:05:42,804401101067943936
fhollande,Dans ce contexte j'ai voulu que soit maintenue la cohésion nationale,2016-12-01 19:04:48,804400874315517952
fhollande,"J'ai engagé nos armées dans le monde pour nous protéger, pour lutter contre le terrorisme.",2016-12-01 19:04:38,804400833316192256
fhollande,L'engagement que j'avais pris était de faire baisser le chômage. J'ai fait en sorte d'aider les embauches. Les résultats arrivent.,2016-12-01 19:03:19,804400503899746305
fhollande,"J'ai fait avancer les libertés, l'égalité entre les couples a été renforcée. J'ai modernisé notre démocratie avec la réforme territoriale",2016-12-01 19:02:25,804400277168259072
fhollande,Les comptes publics ont été assainis. J'ai voulu que notre modèle social soit conforté et élargi,2016-12-01 19:01:33,804400056912711680
fhollande,Je m'adresse à vous pour vous faire connaître ma décision dans la perspective de la prochaine élection présidentielle,2016-12-01 19:00:45,804399855523299328
fhollande,"Soyez fiers comme je le suis moi-même de vous, soyez fiers du choix que vous avez fait de servir la République.… https://t.co/s4OtEpWXID",2016-11-25 16:38:47,802189803106148352
fhollande,"La France quand elle a cette volonté de se redresser, elle gagne ! https://t.co/HP4gnhXsYv",2016-11-23 18:02:38,801486126120734720
fhollande,"J'ai adressé un courrier à Vincente G. Loscertales, Secrétaire général du @bieparis, pour déclarer la candidature d… https://t.co/btuEbyo6gN",2016-11-22 14:24:47,801068917389230081
fhollande,"Ce soir, notre compatriote @Thom_astro rejoint la Station spatiale internationale pour 6 mois &gt;&gt; https://t.co/9XOwIeEodk",2016-11-17 09:49:40,799187741250637824
fhollande,La seule peur qui soit justifiée aujourd'hui est celle qui peut venir de l'avenir de la planète. #COP22 https://t.co/u6b0ojAV0B,2016-11-16 12:16:28,798862297678680064
fhollande,"L’accord de Paris est irréversible en droit, en fait et dans les consciences. L’inaction serait désastreuse pour le monde #COP22",2016-11-15 16:23:43,798562130832359424
fhollande,"Je suis à Marrakech, vous êtes à Doha : soutien chaleureux à la candidature #Paris2024",2016-11-15 15:21:42,798546524045197312
fhollande,"Je veux rendre hommage à nos forces armées qui partout se déploient. La France doit être forte, en cohésion, en union #11novembre",2016-11-11 11:46:36,797042843898494976
fhollande,Je viens de m'exprimer au sujet de l'élection présidentielle américaine. https://t.co/ZCwHUPtuPL,2016-11-09 11:02:06,796306866804400129
fhollande,"Tous mes encouragements aux skippers du @VendeeGlobe, incroyable course en solitaire qui exige audace, humilité et maitrise de soi.Bon vent!",2016-11-06 12:02:06,795234804795117568
