screenName,text,created,id
fhollande,La peur ne peut pas être un moteur. Elle peut être un réflexe mais pas un argument. #Café #QG #FH2012,2012-03-12 14:16:40,179209294825271296
fhollande,Les premiers moments du quinquennat sont déterminants. #Café #QG #FH2012,2012-03-12 14:11:11,179207917059325952
fhollande,Je reçois les 6 personnes qui se sont inscrites sur mon site pour boire un café dans mon bureau! #QG #FH2012 http://t.co/To8XFJKh,2012-03-12 13:52:20,179203170302562306
fhollande,Je recevrai dans quelques instants les 6 sélectionnés pour boire un café dans mon bureau au #QG de campagne : http://t.co/T1Vb5AA2 #FH2012,2012-03-12 13:38:55,179199795691393024
fhollande,Le point presse de @BCazeneuve suite à notre rencontre avec les familles des victimes de #Karachi: http://t.co/kPKvPmiT #FH2012,2012-03-12 13:13:09,179193313662992386
fhollande,"Je recevrai, à leur demande, dans quelques instants les rescapés et les proches des victimes de l'attentat de Karachi. #FH2012",2012-03-12 11:05:54,179161288054800384
fhollande,J'ai présenté hier mes engagements en matière de défense. Voici l'intégralité de mon intervention : http://t.co/Ko0ph9CN #Defense #FH2012,2012-03-12 09:27:27,179136512615657472
fhollande,"Retrouvez le magazine """"""""Capital"""""""" dont j'étais hier l'invité : http://t.co/puXaFnOg #Capital #FH2012",2012-03-12 07:16:40,179103601640210433
fhollande,Je perçois un peu moins de 7 000 euros par mois. #Capital #FH2012,2012-03-11 22:01:03,178963774294859776
fhollande,"La différence entre la gauche et la droite, ce n'est pas l'augmentation des impôts mais qui va payer davantage. #Capital #FH2012",2012-03-11 22:00:38,178963671299538947
fhollande,"J'ai pris, pour mon projet, une prévision de croissance de 1,7%, identique à celle du gouvernement. #Capital #FH2012",2012-03-11 21:57:31,178962884343250945
fhollande,"Le médecin doit être rémunéré sur ses actes,mais aussi par rapport à ce qu'il permettra d'économiser à la sécurité sociale. #Capital #FH2012",2012-03-11 21:56:07,178962532210446336
fhollande,J'ai fait une proposition sur le quotient familial : http://t.co/jNSEjzwD #Capital #FH2012,2012-03-11 21:54:57,178962238516903936
fhollande,Je propose que les dépenses de l'ensemble de nos administrations n’augmentent pas de plus de 1% chaque année pendant 5 ans #Capital #FH2012,2012-03-11 21:54:06,178962024028577792
fhollande,"Je veux un pays qui bouge, qui innove, qui crée. #Capital #FH2012",2012-03-11 21:52:57,178961735091372032
fhollande,Tous ceux qui investiront dans l'entreprise auront des avantages fiscaux justifiés. #Capital #FH2012,2012-03-11 21:52:41,178961668313841665
fhollande,Nous créerons une taxe sur les transactions financières partout en Europe qui dissuadera les fonds spéculatifs. #Capital #FH2012,2012-03-11 21:41:03,178958740274429952
fhollande,Je porterai le taux marginal d'imposition des revenus supérieurs à 1 million d'euros par an à 75% : http://t.co/Br0HDhqe #Capital #FH2012,2012-03-11 21:38:39,178958136835715072
fhollande,"Il est inacceptable que des fonds, en Europe, continuent de spéculer contre la valeur de notre monnaie. #Capital #FH2012",2012-03-11 21:36:05,178957489885290496
fhollande,Je propose 150 000 emplois d'avenir pour faciliter l’insertion des jeunes dans l’emploi. #Emploi #Capital #FH2012,2012-03-11 21:21:01,178953699354361856
fhollande,Le principe de l'alternance est un principe qui vaut pour le jeune comme pour l'entreprise! #Emploi #Capital #FH2012,2012-03-11 21:20:07,178953471872077825
fhollande,"Je propose le """"""""contrat de générations"""""""" : http://t.co/doCx8a0O #Emploi #Capital #FH2012",2012-03-11 21:09:15,178950739874430976
fhollande,"Si les Français me donnent leur confiance, ce qui sera dit sera fait. Et ça, ça sera une rupture! #Capital #FH2012",2012-03-11 21:03:42,178949340755267584
fhollande,LA TVA est l'impôt le plus injuste. #Capital #FH2012,2012-03-11 20:59:54,178948384286179328
fhollande,"Je suis pour que le SMIC soit lié à la croissance. Si la croissance augmente de 1 point, l'augmentation du SMIC sera de 0,5 point. #Capital",2012-03-11 20:57:39,178947818076119041
fhollande,"Dès le mois de septembre, l'allocation de rentrée scolaire,si les Français me donnent leur confiance,sera augmentée de 25%. #Capital #FH2012",2012-03-11 20:57:03,178947666795966465
fhollande,Les heures supplémentaires ne peuvent pas être une solution alors qu'une embauche dans l'entreprise peut être possible. #Capital #FH2012,2012-03-11 20:55:14,178947212489916416
fhollande,Mes propositions en matière d'emploi : http://t.co/lmBjoxYo #Capital #FH2012,2012-03-11 20:53:44,178946835744952322
fhollande,"150 000 jeunes sortent chaque année du système scolaire sans aucune qualification, je veux réduire en 5 ans ce chiffre de moitié. #Capital",2012-03-11 20:34:14,178941928153423872
fhollande,"Les priorités sont l'éducation, la sécurité et la justice. #Servicespublics #Capital #FH2012",2012-03-11 20:32:23,178941459028910080
fhollande,"Je créerai 60 000 postes dans l’École, en 5 ans. #Capital #FH2012",2012-03-11 20:31:56,178941346202128385
fhollande,Toutes mes propositions en matière d'éducation sont à retrouver par ici : http://t.co/vT2UQGdG,2012-03-11 20:31:03,178941126454161410
fhollande,"Je suis pour que des enseignants expérimentés, mieux payés, aillent là où leur expérience est un atout. #Capital #FH2012",2012-03-11 20:29:37,178940762950610945
fhollande,"Est-ce juste, qu'en France, on envoie dans les établissement les plus difficiles les plus jeunes enseignants? #Capital #FH2012",2012-03-11 20:28:06,178940382262992896
fhollande,Toutes mes propositions en matière de logement sont à retrouver par ici : http://t.co/ySyEKJMX #Capital #FH2012,2012-03-11 20:18:53,178938064616435712
fhollande,Nous multiplierons par 5 les sanctions financières contre les communes qui ne respectent pas la loi SRU. #Capital #FH2012,2012-03-11 20:16:59,178937585119408129
fhollande,Je propose que ce taux de passe de 20 à 25%. #LoiSRU #Capital #FH2012,2012-03-11 20:15:57,178937324644732929
fhollande,La loi SRU oblige chaque commune à disposer de 20% de logements sociaux. #Capital #FH2012,2012-03-11 20:15:29,178937207502012416
fhollande,La candidat-sortant traite l'Union européenne comme un bouc-émissaire. #Capital #FH2012,2012-03-11 20:02:26,178933923982745600
fhollande,"La confiance est essentielle, en économie comme en politique. #Capital #FH2012",2012-03-11 19:59:14,178933119393611777
fhollande,Il y a aujourd'hui une défiance par rapport à la parole politique. #Capital #FH2012,2012-03-11 19:59:05,178933079480614912
fhollande,C'est un candidat qui est dans une fuite en avant. #Capital #FH2012,2012-03-11 19:57:29,178932679591464961
fhollande,"Il a occulté son bilan, je le comprends, il n'est pas en sa faveur! #Capital #FH2012",2012-03-11 19:56:47,178932500117204993
fhollande,"J'ai trouvé que le candidat-sortant avait parlé de lui, plutôt que de son projet. #Capital #FH2012",2012-03-11 19:56:35,178932449710063617
fhollande,"Je serai dans quelques instants l'invité du magazine """"""""Capital"""""""" sur M6! #FH2012",2012-03-11 19:54:48,178932003213819904
fhollande,Découvrez mon agenda de la semaine prochaine : http://t.co/CCsUQk3Q #FH2012,2012-03-11 19:14:56,178921968190504960
fhollande,"J'étais vendredi en #Pologne. Vivez ce déplacement comme si vous y étiez grâce """"""""au fil d'Ariane"""""""" : http://t.co/ouwWYVi0 #FH2012",2012-03-11 14:37:47,178852221943955456
fhollande,"Je serai ce soir l'invité de l'émission """"""""Capital"""""""", à partir de 20h50 en direct sur M6. #FH2012",2012-03-11 14:32:30,178850893087768576
fhollande,Je veux rappeler que nos armées sont les premiers recruteurs des jeunes de 18 à 25 ans. #Defense #FH2012,2012-03-11 11:01:57,178797908357943297
fhollande,Il reviendra au Président élu de rétablir une cohérence adaptée à cette grande fonction régalienne. #Defense #FH2012,2012-03-11 10:51:47,178795348926541824
fhollande,Je rétablirai un fonctionnement équilibré du service public dans le domaine de la défense. #Defense #FH2012,2012-03-11 10:51:28,178795269276704768
fhollande,Je soutiendrai le rôle des PME dans le domaine de la défense. Leur dynamisme en font un réservoir technologique précieux. #Defense #FH2012,2012-03-11 10:50:01,178794902459654144
fhollande,"Des mesures de rationalisation seront réalisées, sans faux semblants et sans artifices. #Defense #FH2012",2012-03-11 10:45:10,178793683569737728
fhollande,Je veux consolider de notre dissuasion nucléaire. Elle est l'assurance vie de notre pays face à la menace de la prolifération. #Defense,2012-03-11 10:43:33,178793278202847232
fhollande,Je souhaite que soit entreprise au plus tôt la rédaction d'un livre blanc sur notre défense nationale. #Defense #FH2012,2012-03-11 10:42:57,178793123709853696
fhollande,La France n'en a retiré aucun bénéfice probant. Je veux que fassions une évaluation de cette position de la France. #OTAN #Defense #FH2012,2012-03-11 10:41:48,178792834948804608
fhollande,"Le Président sortant a décidé, au début de son mandat, de revenir dans le commandement intégré de l'OTAN. #Defense #FH2012",2012-03-11 10:41:02,178792641327153152
fhollande,Je veux aussi évoquer l'alliance atlantique : elle est une garantie de notre sécurité. #Defense #FH2012,2012-03-11 10:40:46,178792577024262144
fhollande,Je veux que l'alternance politique en France soit l'occasion d'une relance de la défense européenne. #Defense #FH2012,2012-03-11 10:37:32,178791763778084864
fhollande,"L’Europe de la défense a été tant de fois espérée, elle doit prendre une nouvelle dimension. #Defense #FH2012",2012-03-11 10:36:47,178791574812114944
fhollande,Je prends l'engagement de fixer un cap pour notre stratégie de défense. #Defense #FH2012,2012-03-11 10:35:36,178791277310132225
fhollande,"Si les Français m'en donnent la responsabilité, la France retirera ses troupes d’Afghanistan. #Defense #FH2012",2012-03-11 10:32:20,178790452068225024
fhollande,"Mes pensées vont à leurs familles et à tous les blessés, nous ne les oublierons pas. #Afghanistan #Defense #FH2012",2012-03-11 10:31:41,178790289954181120
fhollande,82 soldats sont morts pour la France en Afghanistan. #Defense #FH2012,2012-03-11 10:31:19,178790195397795840
fhollande,La porte doit rester ouverte pour le dialogue afin de trouver une issue à cette crise. #Iran #Defense #FH2012,2012-03-11 10:27:40,178789279441485824
fhollande,C'est en Iran et dans le Golfe que résident notre plus grande inquiétude. #Defense #FH2012,2012-03-11 10:26:50,178789069629829123
fhollande,"Suivez en direct, à partir de 11 heures, mon discours sur la défense nationale : http://t.co/EaXM2v7g #Defense #FH2012",2012-03-11 09:47:02,178779053401194496
fhollande,Retrouvez ici l'intégralité du discours que j'ai aujourd'hui prononcé sur l' #Outremer : http://t.co/TypN8KcM #FH2012,2012-03-10 22:08:25,178603242350063616
fhollande,Vous devez prendre conscience de votre force dans la République. #Outremer #FH2012,2012-03-10 19:41:31,178566271502254080
fhollande,"Après le grand rassemblement d'aujourd'hui, je rencontre les associations ultramarines parisiennes. #Outremer #FH2012 http://t.co/9iCtJGDi",2012-03-10 19:36:21,178564967824502788
fhollande,"Je vous dois cette victoire que vous attendez depuis si longtemps. Une victoire pour la République, une victoire pour la France. #FH2012",2012-03-10 18:31:16,178548592485736448
fhollande,Le 22 avril doit être un premier tour qui nous permette d’être le plus haut possible au second tour. #Outremer #FH2012,2012-03-10 18:30:23,178548370594471936
fhollande,C'est nous qui devons donner l'exemple et redresser le pays! #Outremer #FH2012,2012-03-10 18:28:55,178548002636570625
fhollande,Nous devons donner à tous les Français qui nous regardent la fierté d'être au rendez-vous de l'Histoire. #Outremer #FH2012,2012-03-10 18:28:31,178547901528682497
fhollande,"J'appelle à la participation la plus élevée possible, et je mets en garde par rapport à la tentation de la colère du vote extrême. #Outremer",2012-03-10 18:26:44,178547454067744769
fhollande,"Respectons la campagne, ne redoutons rien sauf les polémiques, les outrances, les surenchères. #Outremer #FH2012",2012-03-10 18:24:57,178547001699467264
fhollande,"Ne craignez rien, ne vous laissez impressionner par rien! #Outremer #FH2012",2012-03-10 18:24:43,178546945126711297
fhollande,La France est un grand archipel! #Outremer #FH2012,2012-03-10 18:22:56,178546494155132928
fhollande,"Je connais bien l' #Outremer, j'y ai des amis partout, et ceux qui ne sont pas mes amis ne me connaissent pas encore! #FH2012",2012-03-10 18:22:39,178546424429023232
fhollande,C'est la justice qui résume le projet que je présente aux Français. #Outremer #FH2012,2012-03-10 18:15:06,178544525214629889
fhollande,Les crédits permettant de financer les emplois aidés ont été divisés par 10. #Outremer #FH2012,2012-03-10 18:10:58,178543485677346816
fhollande,"La lutte contre le chômage, fléau n°1 de l' #Outremer : 60% des jeunes y sont au chômage. #FH2012",2012-03-10 18:10:38,178543398821699584
fhollande,"J'ai pris 30 engagements pour l' #Outremer, http://t.co/RxvySG4r , en plus de mes 60 propositions. #FH2012",2012-03-10 18:07:16,178542552637640704
fhollande,"A l'école, sera proposé des cours de langues locales. #Outremer #FH2012",2012-03-10 18:06:29,178542357761892354
fhollande,"Cette cité de l' #Outremer sera un lieu d'expression des cultures. Un lieu vivant, ouvert à tous. #FH2012",2012-03-10 18:05:38,178542142933835776
fhollande,6 semaines de promesses n’effaceront pas 5 ans d'inerties. Je relancerai le projet de la cité de l' #Outremer à Paris. #FH2012,2012-03-10 18:05:21,178542070183641089
fhollande,La délégation interministérielle à l'égalité des chances deviendra compétente pour lutter contre les discriminations. #Outremer #FH2012,2012-03-10 18:03:05,178541499959607296
fhollande,Je m'engage à ce que les prix des communications entre l'hexagone et l' #Outremer soient alignés sur ceux en hexagone. #FH2012,2012-03-10 18:01:20,178541061109587968
fhollande,"La promesse républicaine, c’est d'abord celle de l'égalité. Cela pose la question de la continuité territoriale. #Outremer #FH2012",2012-03-10 17:59:25,178540577774768128
fhollande,"Notre combat est tourné contre les inégalités, mais aussi contre les indignités. #Outremer #FH2012",2012-03-10 17:56:37,178539873794408448
fhollande,"L'esclavage est un crime contre l'humanité, un affront fait à la dignité de chaque être humain. #Outremer #FH2012",2012-03-10 17:55:15,178539528062111746
fhollande,"Ce mot a pris un autre sens aujourd'hui. Nous ne connaissons qu'une seule race, qu'une seule famille, la famille humaine. #Outremer #FH2012",2012-03-10 17:53:12,178539014771580928
fhollande,Il n'y a pas de place dans la République pour la race. Je demanderai au Parlement de supprimer le mot race de notre Constitution. #Outremer,2012-03-10 17:52:54,178538936266784768
fhollande,"La République ne craint pas la diversité, car la diversité c'est la vie, le mouvement. L'uniformité c'est l'oubli. #Outremer #FH2012",2012-03-10 17:52:29,178538832612954112
fhollande,"La République française est une, indivisible et laïque. #Outremer #FH2012",2012-03-10 17:51:56,178538693953462272
fhollande,La France que j'aime est celle qui est capable de faire vivre tout le monde ensemble. #Outremer #FH2012,2012-03-10 17:50:53,178538431763320833
fhollande,"La France est fière de toutes ses multiplicités, la France est fière de son métissage. #Outremer #FH2012",2012-03-10 17:50:15,178538271054364673
fhollande,"Je veux saluer affectueusement @BertrandDelanoe, maire de Paris, qui est aussi, maire de l'une des plus grandes villes d'#Outremer! #FH2012",2012-03-10 17:46:25,178537307975069699
fhollande,"Avant que je prononce mon discours dans quelques minutes, voici mes engagements pour l'Outre-mer : http://t.co/u8GaXMoP #FH2012",2012-03-10 17:32:58,178533923012358145
fhollande,"Au gymnase Jean Jaurès à Paris avec mes amis ultramarins, pour un grand rassemblement! cc @VictorinLurel #FH2012 http://t.co/ognqVDrA",2012-03-10 17:31:53,178533643071922176
fhollande,"J'apprends avec tristesse la disparition de Jean Giraud. Dessinateur et scénariste, il était avant tout un artisan de rêves.",2012-03-10 15:32:05,178503499519229953
fhollande,Je vous invite à me rejoindre à partir de 17h30 à Paris pour un grand rassemblement sur l'Outre-mer http://t.co/qqU4ue1j #FH2012,2012-03-10 10:49:35,178432407979048960
fhollande,"Je rencontre les Français de Varsovie avec @pyleborgn, le candidat socialiste aux législatives! #Pologne #FH2012 http://t.co/TMqz2Ivz",2012-03-09 19:33:03,178201750602395648
fhollande,Nous devons redonner confiance en l'idéal européen! #Pologne #FH2012,2012-03-09 18:11:03,178181119404015616
fhollande,"En débat sur l'avenir de l'Europe avec l'ancien Président Kwasniewski, organisé par le quotidien polonais Gazetta Wyborcza. #Pologne #FH2012",2012-03-09 17:48:45,178175503847526400
fhollande,J'ai tenu à me recueillir cet après-midi devant le mémorial du ghetto de Varsovie. cc @pierremoscovici #Mémoire #Pologne #FH2012,2012-03-09 17:17:47,178167711250128897
fhollande,"Je plaiderai, j'agirai pour la renégociation du traité européen, les partenaires le savent. Je ne cache rien. #Pologne #FH2012",2012-03-09 16:25:16,178154496193605634
fhollande,Il y a de ma part une veritable volonté européenne. #Pologne #FH2012,2012-03-09 16:24:17,178154249140711424
fhollande,"A la presse qui me questionne, j'explique que tous les partenaires européens sont respectueux du vote des Français. #Pologne #FH2012",2012-03-09 16:23:20,178154011558543360
fhollande,Nous continuons notre visite en s'arrêtant devant les dernières pierres d'un bunker du ghetto de Varsovie. #Mémoire http://t.co/Fn7bOGXe,2012-03-09 16:07:03,178149906530312194
fhollande,Je souhaite remercier le grand rabbin de Pologne de m'avoir accueilli ici au mémorial du ghetto de Varsovie. #Mémoire http://t.co/6E6vYdcF,2012-03-09 15:45:07,178144387136618496
fhollande,Je souhaite affirmer ici l'attachement que je porte aux liens entre la France et la Pologne. #FH2012 cc @Leszek_Miller http://t.co/GcRehOIx,2012-03-09 14:59:50,178132992181547008
fhollande,"Il manque au traité un volet sur la croissance, le développement de grands projets communs, des instruments financiers comme les eurobonds.",2012-03-09 14:38:23,178127597299974144
fhollande,J'ai expliqué au Président que je voulais renégocier le traité européen pour lui ajouter la dimension qui lui manque. #Pologne #FH2012,2012-03-09 14:36:26,178127108793569281
fhollande,Je souhaite associer tous les pays européens à la gouvernance économique de l'Union. #Pologne #FH2012,2012-03-09 14:35:26,178126854132211712
fhollande,J'ai souhaité dire au Président Komorowski ma position sur les grands enjeux européens. #Pologne #FH2012,2012-03-09 14:34:53,178126718920441859
fhollande,"J'arrive à Varsovie où je rencontrerai dans quelques minutes Bronislaw Komorowski, président de la République polonaise. #Pologne #FH2012",2012-03-09 11:41:04,178082973084692480
fhollande,Faites avec moi le choix du changement! #Reims #FH2012,2012-03-08 20:35:53,177855178123378690
fhollande,"Il faut gagner pour nous-mêmes, pour nos idées, mais aussi et surtout pour la République! #Reims #FH2012",2012-03-08 20:35:08,177854989652344832
fhollande,"La France a besoin de l'Europe, et l'Europe a besoin de la France! #Reims #FH2012",2012-03-08 20:31:47,177854144344883200
fhollande,Notre premier objectif est de redresser le pays! #Reims #FH2012,2012-03-08 20:30:28,177853814911668225
fhollande,C'est quand même incroyable que le Président n'apprenne que maintenant que seuls 10% des chômeurs sont formés! #Reims #FH2012,2012-03-08 20:27:06,177852966466891776
fhollande,C'est votre décision qui va compter! #Reims #FH2012,2012-03-08 20:24:53,177852408687362048
fhollande,Rien ne serait pire que de parier sur l'abstention! #Reims #FH2012,2012-03-08 20:24:26,177852298033238016
fhollande,"Je défendrai ce qu'a été l'histoire de la République, et l'histoire de la gauche. #Reims #FH2012",2012-03-08 20:23:23,177852032227614721
fhollande,J'assume le bilan de la gauche ! #Reims #FH2012,2012-03-08 20:21:54,177851660733923329
fhollande,"Une campagne utile pour les citoyens, c'est une campagne qui éclaire et non qui vise à impressionner. #Reims #FH2012",2012-03-08 20:21:05,177851452990046208
fhollande,Je veux que la campagne soit utile à la France et aux Français. #Reims #FH2012,2012-03-08 20:20:38,177851342361067522
fhollande,Nous n'attendons pas du Président des états d’âmes mais des états de service! #Reims #FH2012,2012-03-08 20:19:52,177851148445827072
fhollande,"Ce qu'on attend d'un Président de la République, ce n'est pas qu'il parle de lui mais des Français. #Reims #FH2012",2012-03-08 20:19:18,177851003717173250
fhollande,"La laïcité, inscrite dans la constitution, sera une protection pour les femmes! #Reims #8mars #FH2012",2012-03-08 20:14:41,177849843996311552
fhollande,"La République doit être laïque! La laïcité, c'est notre capacité de vivre ensemble! #Reims #8mars #FH2012",2012-03-08 20:13:45,177849606368010241
fhollande,"La République doit être laïque! La laïcité, c'est notre capacité de vivre ensemble! #Reims 8mars #FH2012",2012-03-08 20:13:35,177849567813959680
fhollande,"Je m'adresse à toutes les femmes de France : je veux leur dire ma gratitude, ma reconnaissance et mon engagement! #Reims #8mars #FH2012",2012-03-08 20:06:30,177847782537838592
fhollande,"La République, c'est la fraternité! #Reims #8mars #FH2012",2012-03-08 20:03:49,177847106785116160
fhollande,"A ceux qui tolèrent l'oppression des femmes, à tous ces intégristes, je dis que la France les combattra toujours. #Reims #8mars #FH2012",2012-03-08 20:03:21,177846988795154432
fhollande,"La République, c'est la liberté! #Reims #8mars #FH2012",2012-03-08 20:01:58,177846643633291265
fhollande,"Ce n'est pas à la femme victime de quitter son domicile, mais au conjoint violent. Nous lui imposerons la force de la loi. #Reims #8mars",2012-03-08 20:01:28,177846516948541440
fhollande,"Tous les deux jours dans notre pays, une femme meurt sous les coups de son conjoint. #Reims #8mars #FH2012",2012-03-08 20:00:59,177846396525887489
fhollande,Tous les établissements hospitaliers de notre pays doivent avoir un centre IVG. Et je veux que cet acte soit remboursé à 100%. #Reims #8mars,2012-03-08 19:59:52,177846113137733633
fhollande,J’allongerai le congé paternité. #Reims #8mars #FH2012,2012-03-08 19:59:23,177845992165617664
fhollande,Une femme qui ne peut pas faire garder ses enfants n'est pas une femme libre. #Reims #8mars #FH2012,2012-03-08 19:57:40,177845558843670528
fhollande,La garde des jeunes enfants doit devenir un véritable service public. #Reims #8mars #FH2012,2012-03-08 19:57:21,177845482721263616
fhollande,Les femmes sont les premières victimes de la précarité dans l'emploi. #Reims #8mars #FH2012,2012-03-08 19:54:48,177844839730249728
fhollande,Les partis politiques qui ne respecteront pas la parité perdront l'ensemble des dotations de l’État. #Reims #8mars #FH2012,2012-03-08 19:54:26,177844747753357312
fhollande,Nous imposerons le respect de la parité pour les élections législatives. #Reims #8mars #FH2012,2012-03-08 19:53:32,177844520652775424
fhollande,"Si je suis élu, la contraception pour les mineures sera réellement confidentielle. #Reims #8mars #FH2012",2012-03-08 19:51:37,177844036802064384
fhollande,"Ensuite, ces grandes entreprises perdront les bénéfices des cotisations sociales sur ces emplois. #Reims #8mars #FH2012",2012-03-08 19:50:41,177843803305148416
fhollande,Je donnerai aux grandes entreprises un an pour se mettre en conformité avec la loi. Un an et pas un jour de plus. #Reims #8mars #FH2012,2012-03-08 19:50:05,177843650196283394
fhollande,"A responsabilités égales, le salaire des femmes est inférieur de 20%. #Reims #8mars #FH2012",2012-03-08 19:49:47,177843577882292224
fhollande,Aujourd’hui le salaire moyen des femmes est inférieur de 25% aux salaires des hommes. #Reims #8mars #FH2012,2012-03-08 19:49:30,177843503387262977
fhollande,Nous recréerons un Ministère du droit des femmes. #Reims #8mars #FH2012,2012-03-08 19:47:51,177843089443008512
fhollande,"Les conseils d'administration des entreprises publiques seront, eux aussi, paritaires! #Reims #8mars #FH2012",2012-03-08 19:47:13,177842931514880000
fhollande,Toutes les grandes instances de la République seront également paritaires. #Reims #8mars #FH2012,2012-03-08 19:46:44,177842809510969344
fhollande,"Je constituerai un gouvernement paritaire.
#Reims #8mars #FH2012",2012-03-08 19:46:25,177842731131994112
fhollande,L'égalité entre les femmes et les hommes est une priorité. #Reims,2012-03-08 19:46:08,177842657354190848
fhollande,Je vous demande de reprendre la marche! #Reims 8mars #FH2012,2012-03-08 19:44:55,177842349962043392
fhollande,"Une histoire s'est interrompue, un fil s'est brisé. #Reims #8mars #FH2012",2012-03-08 19:44:31,177842251286855681
fhollande,"Pour le féminisme et l'égalité, il est temps d'ouvrir une nouvelle page! #Reims #8mars #FH2012",2012-03-08 19:43:54,177842096340860928
fhollande,C'est à toutes les femmes et tous les hommes de lutter pour la dignité! #Reims #8mars #FH2012,2012-03-08 19:43:13,177841922155622400
fhollande,Le féminisme n'est pas le monopole d'un parti politique. #Reims #8mars #FH2012,2012-03-08 19:43:03,177841881978384385
fhollande,"C'est avec de l'audace, du courage et de la volonté que nous transformerons notre pays! #Reims #8mars #FH2012",2012-03-08 19:38:03,177840622428880899
fhollande,Nous devons avoir de l'audace! #Reims #8mars #FH2012,2012-03-08 19:37:52,177840577667280896
