screenName,text,created,id
fhollande,Aucun sondage n'assure les deux finalistes du 2nd tour! #Auxerre #FH2012,2012-04-13 12:47:53,190783366252085248
fhollande,"Durant toute cette campagne, je n'ai pas changé d'objectif : redresser notre pays! #Auxerre #FH2012 http://t.co/jPBg0ikZ",2012-04-13 12:42:05,190781902779723776
fhollande,"J'arrive au marché de Moulins dans l'Allier, où l'accueil est chaleureux! #FH2012 http://t.co/nehl4f9y",2012-04-13 08:38:30,190720603752382464
fhollande,"Discussion avec les journalistes ce matin dans le bus de la presse en direction de Moulins, dans l'Allier. #FH2012 http://t.co/Bo7cQMzm",2012-04-13 07:06:17,190697394025938945
fhollande,"L'intégralité de mon discours, ce soir à #ClermontFerrand est à retrouver par ici : http://t.co/tTIGIwMu #FH2012",2012-04-12 19:22:08,190520193586438144
fhollande,Je tiens à remercier les 10 000 personnes qui sont venues à notre rassemblement sur la place de Jaude à #ClermontFerrand! #FH2012,2012-04-12 18:40:10,190509633901834241
fhollande,"Ensemble, on va gagner! #ClermontFerrand #FH2012",2012-04-12 17:54:07,190498042598785024
fhollande,"Nous devons mériter notre victoire, aller la chercher. Je me battrai jusqu'au bout! #ClermontFerrand #FH2012",2012-04-12 17:51:51,190497472995528704
fhollande,"La candidature que je porte doit rassembler, faire gagner la gauche, mais aussi et surtout faire réussir la France! #ClermontFerrand #FH2012",2012-04-12 17:48:53,190496726799499265
fhollande,"Je vous demande de venir voter pour que dès le premier tour nous rendions la victoire irréversible, irrépressible, inévitable! #FH2012",2012-04-12 17:47:23,190496350994042880
fhollande,"Je n'ai qu'un adversaire, c'est la droite, c'est le candidat-sortant et rien ne me détournera de mon chemin! #ClermontFerrand #FH2012",2012-04-12 17:46:15,190496063453540353
fhollande,Je ne serai l'otage de personne! #ClermontFerrand #FH2012,2012-04-12 17:45:34,190495892644704256
fhollande,"La meilleure manifestation, le meilleur cortège, c'est le suffrage universel! #ClermontFerrand #FH2012",2012-04-12 17:44:30,190495622934183936
fhollande,"Aucun sondage n'a jamais élu un président. C'est vous, et vous seuls qui prendrez cette decision! #ClermontFerrand #FH2012",2012-04-12 17:43:11,190495291294752768
fhollande,"Ce ne sont pas les marchés qui s'affolent, c'est la droite qui s'affole! #ClermontFerrand #f_inter",2012-04-12 17:41:46,190494935051550721
fhollande,"La confiance elle ne se proclame, elle se démontre. C'est un lien à la fois personnel et politique. #ClermontFerrand #FH2012",2012-04-12 17:30:30,190492098330492928
fhollande,"J'ai depuis plusieurs mois présenté mes propositions : 60 engagements. Je n'ai pas dévié, c'est ma cohérence, ma constance. #ClermontFerrand",2012-04-12 17:27:13,190491272664981505
fhollande,Toute ma passion sera au service de la priorité à la jeunesse! #ClermontFerrand #FH2012,2012-04-12 17:26:12,190491017349308416
fhollande,"A chaque génération doit correspondre un progrès. La France ne s'est pas arrêtée, elle doit reprendre sa marche! #ClermontFerrand #FH2012",2012-04-12 17:24:38,190490625513242624
fhollande,"Sommes-nous capable de donner une vie meilleure à nos enfants? Oui, c'est le devoir de la République! #ClermontFerrand #FH2012",2012-04-12 17:24:03,190490478750351360
fhollande,"En 10 ans, je souhaite l'accès de tous au très haut débit. #Numérique #ClermontFerrand #FH2012",2012-04-12 17:22:40,190490128303656960
fhollande,"Je créerai un ministère de l'égalité, de l'égalité territoriale! #ClermontFerrand #FH2012",2012-04-12 17:21:53,190489929690779648
fhollande,"Je changerai la loi sur l'hôpital public, qui ne sera plus dirigé comme une entreprise! #ClermontFerrand #FH2012",2012-04-12 17:21:22,190489800158097411
fhollande,"Suivez en direct notre rassemblement sur la place de Jaude, à #ClermontFerrand : http://t.co/j9zdmulx #FH2012",2012-04-12 17:19:36,190489358283980800
fhollande,"Dernière étape avant de rejoindre notre rassemblement place de Jaude, à Clermont-Ferrand! cc @NajaVB #FH2012 http://t.co/Jyvi2HKb",2012-04-12 16:09:39,190471748460879873
fhollande,Promenade à la rencontre des habitants de Clermont-Ferrand avant notre grand rassemblement à 18h30!cc @NajatVB #FH2012 http://t.co/xOmbmR42,2012-04-12 15:53:32,190467694930300928
fhollande,"J'ai répondu, il y a quelques instants, aux questions de la presse : http://t.co/D4Mdz2ng lors de mon arrivée à Clermont-Ferrand. #FH2012",2012-04-12 14:51:29,190452083156197376
fhollande,Je poursuis la visite de l'institut des métiers de Clermont-Ferrand en rencontrant les apprenties coiffeuses. #FH2012 http://t.co/jmEJtUNV,2012-04-12 14:30:38,190446833229774849
fhollande,"Visite de l'institut des métiers et rencontre avec les jeunes apprentis, à Clermont-Ferrand. #FH2012 http://t.co/m9kpBkvR",2012-04-12 14:25:22,190445505019527169
fhollande,"Mon intervention, hier soir, lors de l'émission de France 2 """"""""Des paroles et des actes"""""""" : http://t.co/wNOei8uC #DPDA #TousHollande",2012-04-12 07:48:59,190345755465228290
fhollande,Le Figaro fait chaque jour une Une qui ne m'est pas favorable. C'est son droit! Je me battrai toujours pour la liberté! #TousHollande #DPDA,2012-04-11 20:13:59,190170855534379008
fhollande,"Si je deviens le prochain chef de l’État, je ne serai ni le chef de la majorité, ni le chef du Parti socialiste. #TousHollande #DPDA",2012-04-11 20:12:51,190170567956119553
fhollande,"Si je suis élu, c'est mon projet qui sera appliqué, il n'y aura aucun doute. #TousHollande #DPDA",2012-04-11 20:11:51,190170316507582464
fhollande,"Dans le prochain quinquennat, il n'y aura pas d'adhésion de la Turquie dans l'Union. Les conditions ne sont pas réunies. #TousHollande #DPDA",2012-04-11 20:08:58,190169591660552192
fhollande,"La stature présidentielle on l'acquiert quand on devient président de la République. La sympathie, c'est moins sur! #TousHollande #DPDA",2012-04-11 20:07:50,190169305177001984
fhollande,"Moi, je ne suis pas un candidat """"""""pochette-surprise"""""""", j'ai un cap, je ne suis pas dans le zig-zag! #TousHollande #DPDA",2012-04-11 20:06:00,190168843275091968
fhollande,"L'ISF ne sera multiplié par trois, puisque je reviendrai au barème allégé par Nicolas Sarkozy. #TousHollande #DPDA",2012-04-11 20:04:59,190168589922344960
fhollande,Nous devons renégocier le traité pour le compléter avec un dispositif de croissance! #Europe #TousHollande #DPDA,2012-04-11 20:02:27,190167950148386817
fhollande,Le traité prévoit uniquement des disciplines et des sanctions qui instaureraient l'austérité pour des années. #Europe #TousHollande #DPDA,2012-04-11 20:01:52,190167803695874048
fhollande,Le rôle d'un responsable politique est de dominer les marchés. #TousHollande #DPDA,2012-04-11 19:59:20,190167166350409728
fhollande,Le rôle d'un responsable politique est de ne pas jouer avec la spéculation. #TousHollande #DPDA,2012-04-11 19:57:15,190166642087563265
fhollande,J'ai compris que certains utilisaient une crise de la zone euro pour critiquer l'alternance! #TousHollande #DPDA,2012-04-11 19:56:34,190166470062387202
fhollande,"Mon devoir est de redresser le pays, dans la justice. #TousHollande #DPDA",2012-04-11 19:53:28,190165689632423937
fhollande,Ces réformes ne sont pas des porte-drapeaux. Elles sont faites pour être efficaces et justes. #TousHollande #DPDA,2012-04-11 19:53:12,190165625627344896
fhollande,Faire une nouvelle étape de la décentralisation est là aussi une grande réforme de structure. #TousHollande #DPDA,2012-04-11 19:52:51,190165534988443649
fhollande,Une réforme fiscale d'ampleur n'est pas une réforme de structure? #TousHollande #DPDA,2012-04-11 19:51:40,190165236924416000
fhollande,"Merci d'avoir lu mes propositions, présentées il y a plus de 3 mois! #TousHollande #DPDA",2012-04-11 19:51:07,190165097925197824
fhollande,"Les temps forts de notre grand rassemblement http://t.co/a92Xa0oJ à 12 jours du #22avril, à #Besançon! #FH2012",2012-04-11 17:47:52,190134084083789825
fhollande,"Je serai ce soir un des invités de l'émission politique """"""""Des Paroles et des actes"""""""" sur France 2! #DPDA #FH2012",2012-04-11 16:39:18,190116826582220801
fhollande,"Découvrez grâce à une infographie interactive le bilan du candidat-sortant, en chiffres : http://t.co/Std50s3n via @partisocialiste #FH2012",2012-04-11 14:00:10,190076781842272258
fhollande,"La zone euro ne connaît pas la croissance, c'est ce que je veux justement renégocier au plan européen. #FranceInter #FH2012",2012-04-11 13:50:55,190074454108418048
fhollande,Il me semble que c'est Nicolas Sarkozy qui est président de la République pour quelques jours encore! #FranceInter #FH2012,2012-04-11 13:50:43,190074400492634114
fhollande,"S'il y a eu la perte du triple A, c'est à cause de la gauche ou à cause de la droite ? #FranceInter #FH2012",2012-04-11 13:50:34,190074362446090241
fhollande,"J'étais à 13 heures l'invité de #FranceInter, un entretien à écouter ici : http://t.co/SayyWhxg #FH2012",2012-04-11 13:41:59,190072202547298304
fhollande,"La qualité principale d'un président,c'est la confiance : mon entretien à paraître aujourd'hui dans l'Express : http://t.co/dnLegbAB #FH2012",2012-04-11 10:03:21,190017184997720066
fhollande,R. Aubrac poursuivait avec modestie et ferveur la volonté d’alerter les jeunes générations. http://t.co/7ILT3N1X C’était sa leçon de vie.,2012-04-11 09:32:22,190009384812814337
fhollande,"Le récit, en vidéo, de ma visite des anciens jardins ouvriers de #Besançon, transformés en jardin familiaux : http://t.co/ADVlPiRL #FH2012",2012-04-11 09:21:51,190006740861992960
fhollande,Le discours que j'ai prononcé ce soir à #Besançon est à retrouver par ici : http://t.co/fC8FRhch #FH2012,2012-04-10 20:11:06,189807740116414465
fhollande,"Après mon meeting de #Besançon, j'ai tenu à aller saluer ceux qui dans une salle adjacente ont suivi mon 1er discours! http://t.co/CNuYpQmz",2012-04-10 19:25:15,189796200852111362
fhollande,"Ce mouvement ne s’arrêtera pas : si le 22 avril nous sommes forts, le 6 mai nous serons victorieux pour la République et pour la France!",2012-04-10 18:44:04,189785838438191106
fhollande,"Dans 12 jours, je vous demande qu'un seul vote : le vote de la victoire! #Besançon #FH2012",2012-04-10 18:43:05,189785592115101696
fhollande,"C'est la gauche qui va ouvrir de nouveaux chemins, permettre de nouvelles conquêtes, arracher de nouvelles libertés! #Besançon #FH2012",2012-04-10 18:42:40,189785485533659136
fhollande,Nous avons une mission : faire que la gauche rencontre la France pour changer son avenir! #Besançon #FH2012,2012-04-10 18:40:17,189784885748178944
fhollande,"La meilleure manifestation, la meilleure grève, la meilleure mobilisation c'est le droit de vote! #Besançon #FH2012",2012-04-10 18:39:26,189784673147297792
fhollande,"On avait dit le candidat-sortant """"""""bling-bling"""""""", il est surtout zig-zag! #Besançon #FH2012",2012-04-10 18:36:51,189784020089970688
fhollande,"Je ne suis pas candidat contre le candidat-sortant, je suis candidat pour la France, pour l'espérance, pour le changement! #Besançon #FH2012",2012-04-10 18:34:36,189783453586305024
fhollande,"Cette élection est déterminante pour notre pays, décisive pour l'Europe : nous sommes observés! #Besançon #FH2012",2012-04-10 18:33:15,189783118004228097
fhollande,"L'Europe telle qu'elle va aujourd'hui a oublié de protéger les citoyens, et de se protéger elle-même. #Besançon #FH2012",2012-04-10 18:30:34,189782439567163392
fhollande,Nous mettrons en place une taxe carbone à l'échelle européenne. #Besançon #FH2012,2012-04-10 18:29:33,189782185253945344
fhollande,Je souhaite une communauté européenne de l'énergie! #Besançon #FH2012,2012-04-10 18:29:13,189782099585269760
fhollande,L'air et l'eau sont des biens publics! #Besançon #FH2012,2012-04-10 18:28:00,189781795615678464
fhollande,"Nos pays ne sont pas seuls au monde, ma génération n’est pas la dernière, l'humanité n'est pas la seule habitante de la planète. #Ecologie",2012-04-10 18:26:36,189781441276690433
fhollande,Je suis socialiste et je me sens écologiste! #Besançon #FH2012,2012-04-10 18:25:23,189781136480800768
fhollande,Nous créerons le contrat de générations! http://t.co/doCx8a0O #Besançon #FH2012,2012-04-10 18:24:36,189780937825988608
fhollande,"Je ne peux pas admettre qu'au début du collège, déjà, les déterminismes et les fatalités font que certains jeunes sont déjà """"""""condamnés"""""""".",2012-04-10 18:23:57,189780776743731200
fhollande,Je n'accepte pas que 150 000 jeunes sortent de notre Ecole sans qualification. #Besançon #FH2012,2012-04-10 18:23:23,189780631025238016
fhollande,"Nous ne ferons pas de nouvelles lois, nous ferons appliquer nos lois. Je pense à l'égalité salariale homme-femme. #Besançon #Egalité #FH2012",2012-04-10 18:22:22,189780378297446402
fhollande,Nous devons lutter contre toutes les discriminations et contre toutes les inégalités. #Besançon #FH2012,2012-04-10 18:21:40,189780199695581184
fhollande,"Plus haut on est dans l’exercice de la responsabilité, encore plus exemplaire doit-on être dans ses rémunérations et dans son comportements.",2012-04-10 18:20:11,189779825886633984
fhollande,Je fais appel au patriotisme car c'est la plus belle idée que nous pouvons promouvoir dans la République! #Besançon #FH2012,2012-04-10 18:18:42,189779454946574337
fhollande,Nous séparerons les activités bancaires spéculatives et celles de dépôts et de crédits. #Besançon #FH2012,2012-04-10 18:17:42,189779201056980992
fhollande,Je ne veux pas que les marchés décident à notre place! #Besançon #FH2012,2012-04-10 18:16:12,189778824320393216
fhollande,Le candidat-sortant invente un voyage à Fukushima qu'il n'a jamais fait! #Besançon #FH2012,2012-04-10 18:12:40,189777933924188162
fhollande,"Nous ferons la réforme fiscale avec un seul objectif : la justice, qui imposera de la même façon les revenus du travail et du capital.",2012-04-10 18:08:33,189776898585407488
fhollande,Le candidat-sortant a crée 41 taxes en 5 ans! #Besançon #FH2012,2012-04-10 18:06:57,189776495852527616
fhollande,Je n'accepterai aucune leçon d'un Président qui a un bilan aussi lourd pour le pays. #Besançon #FH2012,2012-04-10 18:06:22,189776348552765441
fhollande,"C'est la vague du changement qui arrive, et si vous en vous décidez, rien, rien ne pourra l’arrêter! #Besançon #FH2012",2012-04-10 18:04:33,189775893072322560
fhollande,"Dimanche, il disait sentir monter la vague : moi aussi je la sens monter, la vague de colère du peuple qui n'en peut plus. #Besançon #FH2012",2012-04-10 18:03:07,189775534262198274
fhollande,"Les seuls que le candidat-sortant a protégé ces 5 dernières années, ce sont le puissants, les rentiers! #Besançon #FH2012",2012-04-10 18:01:14,189775057764098048
fhollande,"Faute de pouvoir de nouveau tout promettre, le candidat-sortant prétend maintenant protéger! #Besançon #FH2012",2012-04-10 17:59:51,189774709934657537
fhollande,"N'ayez aucune crainte, ne vous laissez pas intimider : vous êtes les seuls détenteurs de la légitimité du suffrage. #Besançon #FH2012",2012-04-10 17:57:25,189774096328949760
fhollande,"Vous, soyez prêts à faire le choix du changement, le 22 avril prochain! #Besançon #FH2012",2012-04-10 17:54:58,189773483050409984
fhollande,"Ici, à #Besançon, je suis venu vous dire que je suis prêt à présider la France, à changer concrètement la vie de nos concitoyens. #FH2012",2012-04-10 17:54:26,189773345896673282
fhollande,"J'ai un devoir : ne pas décevoir, ne rien promettre que je ne pourrais pas tenir. #Besançon #FH2012",2012-04-10 17:54:08,189773271787515904
fhollande,Nous réviserons nos institutions pour les moderniser et les démocratiser. #Besançon #FH2012,2012-04-10 17:52:56,189772970267377664
fhollande,"Je composerai un gouvernement paritaire, chaque membre de l'équipe ne pourra cumuler un autre mandat que celui de servir le pays. #Besançon",2012-04-10 17:52:10,189772775324516353
fhollande,J'ai fixé le calendrier du changement : http://t.co/zuUShNgL #Besançon #FH2012,2012-04-10 17:50:47,189772426849161217
fhollande,"J'arrive à la tribune, à #Besançon : à suivre en direct sur http://t.co/j9zdmulx #FH2012",2012-04-10 17:45:58,189771216956030976
fhollande,"Notre grand rassemblement à #Besançon avec @PierreMoscovici et @Chevenement, est à suivre en direct sur http://t.co/EaXM2v7g #FH2012",2012-04-10 16:29:44,189752031924334592
fhollande,Les membres de mon équipe de campagne ont tenu à vous raconter leur première fois... http://t.co/YCqtpAVk #PaP #FH2012,2012-04-10 16:02:18,189745128217382913
fhollande,"A partir de 18 heures, #RadioHollande recevra @LaurentFabius, une émission à écouter sur http://t.co/EaXM2v7g ! #FH2012",2012-04-10 15:59:00,189744297527087104
fhollande,"Après une promenade dans les rues de #Besançon,je dédicace mon livre """"""""Changer de destin"""""""" à la librairie des Scandales. http://t.co/KHqP2fqo",2012-04-10 14:21:43,189719811029348352
fhollande,"Visite des anciens jardins ouvriers, aujourd'hui jardins familiaux de #Besançon. #FH2012 http://t.co/9EcLU0Bc",2012-04-10 12:19:22,189689022182981632
fhollande,"Dans le TGV avec @Pierremoscovici et @Chevenement, direction Besançon! Je vous donne rdv à 18h30 pour grand rassemblement au Parc des expos!",2012-04-10 10:37:21,189663350911799296
fhollande,"Pour tout savoir de mes 48 heures dans les quartiers délaissés, cliquez par ici : http://t.co/EPcso4hO #FH2012",2012-04-09 17:15:57,189401276482723841
fhollande,Le clip officiel de ma campagne présidentielle est à découvrir par ici : http://t.co/kV9xxMoG #FH2012,2012-04-09 14:35:30,189360898069106691
fhollande,"Toutes les infos sur notre grand rassemblement, dimanche prochain, sur l'esplanade du Château de Vincennes : http://t.co/N2w2J24A #FH2012",2012-04-09 07:40:44,189256515956391937
fhollande,Découvrez en avant-première ma profession de foi que recevront plus de 48 millions de Français : http://t.co/xLLX2MLT #FH2012,2012-04-08 17:26:08,189041450816770048
fhollande,RT @VincentFeltesse: Retrouvez maintenant en temps réel le nombre de portes frappées à travers toute la France http://t.co/4cPay0bM #Por ...,2012-04-08 10:42:12,188939794708045824
fhollande,Le récit en images de ces 2 derniers jours passés dans les quartiers populaires : http://t.co/B7N2GvXM #FH2012,2012-04-08 10:00:30,188929302539145218
fhollande,Retrouvez par ici le discours que j'ai prononcé ce soir à #Aulnay : http://t.co/9XCbUVKs #FH2012,2012-04-07 18:30:22,188695227928813568
fhollande,"Avez-vous la volonté du changement? Alors je vous l'annonce, le changement vient, il est devant nous! #Aulnay #FH2012",2012-04-07 17:32:01,188680543653740544
fhollande,"Faites peur à ceux qui vous utilisent : vous n'êtes pas une menace, vous êtes une chance pour la France! #Aulnay #FH2012",2012-04-07 17:30:08,188680066442592256
fhollande,"Je vous lance cet appel pour la levée en masse, comme on disait lors de la Révolution française! #Aulnay #FH2012",2012-04-07 17:29:40,188679952030375936
fhollande,Soyez fiers dès lors que la République est de votre côté! #Aulnay #FH2012,2012-04-07 17:28:26,188679639458267138
fhollande,"Soyez fiers de ce que vous êtes, dans votre diversité comme dans votre unité! #Aulnay #FH2012",2012-04-07 17:28:10,188679572924006403
fhollande,"C'est vous la force, c'est vous le pays, c'est vous le suffrage : ne laissez pas d'autres décider de votre avenir! #Aulnay #FH2012",2012-04-07 17:26:31,188679159957041152
fhollande,C’est parce que je suis de gauche que je suis conscient que je dois gagner cette élection mais aussi que je dois après changer le pays!,2012-04-07 17:25:21,188678863231000576
fhollande,Partout où il y a un centre hospitalier il y aura un centre IVG. #Aulnay #FH2012,2012-04-07 17:20:48,188677718341189632
fhollande,Je lutterai non pas contre les contrôles d'identité qui sont nécessaires mais contre les contrôles au faciès qui sont inacceptables #Aulnay,2012-04-07 17:20:14,188677578096246785
fhollande,Je veillerai à ce que chacun de mes compatriotes soient respectés et non pas suspectés! #Aulnay #FH2012,2012-04-07 17:19:31,188677397808291841
fhollande,La République devra faire respecter le principe d'égalité. #Aulnay #FH2012,2012-04-07 17:18:20,188677097449979904
fhollande,Je veux être le Président du respect et de la justice! #Aulnay #FH2012,2012-04-07 17:16:43,188676693265887233
fhollande,"Jeunesse de France, c'est vous qui devez prendre le pouvoir! #Aulnay #FH2012",2012-04-07 17:15:42,188676437501427713
fhollande,Nous ferons de l'emploi et de la formation la priorité de l'action gouvernementale. #Aulnay #FH2012,2012-04-07 17:14:16,188676074513764353
fhollande,Nous créerons l'allocation d'étude sous conditions de ressources. #Aulnay #FH2012,2012-04-07 17:10:58,188675243236265984
fhollande,Je veux que dans tous les quartiers de France les enfants aient toutes les conditions de l'accomplissement de leur destin. #Aulnay #FH2012,2012-04-07 17:08:00,188674500110458881
fhollande,"Jeunesse de France, ayez de grands rêves, poussez le murs : aucune frontière ne sera posée à votre propre réussite. #Aulnay #FH2012",2012-04-07 17:07:18,188674323005972482
fhollande,Le prix des transports sera modulé en fonction des revenus et pas simplement en fonction de la distance! #Aulnay #FH2012,2012-04-07 17:05:54,188673971657506817
fhollande,Chaque jeune pourra avoir un système de caution solidaire pour qu'à la précarité du travail ne s'ajoute la précarité de la résidence #Aulnay,2012-04-07 17:04:15,188673556266221569
fhollande,La promesse républicaine que je vous adresse est d'offrir un logement digne à chacun. #Aulnay #FH2012,2012-04-07 17:01:27,188672851157585920
fhollande,"J'ai visité ces villes qu'on appelle la banlieue et qui sont tout simplement la France, la France qui veut vivre dignement! #Aulnay #FH2012",2012-04-07 16:51:43,188670402132836352
fhollande,"Je reviens d'un parcours qui m'a amené en 48 heures de Vaulx-en-Velin à #Aulnay, en passant par Creil, Trappes, Aubervilliers..! #FH2012",2012-04-07 16:50:58,188670212789383169
fhollande,Suivez en direct dès maintenant notre grand rassemblement à #Aulnay! http://t.co/EaXM2v7g #FH2012,2012-04-07 16:33:52,188665908741419008
fhollande,Les quartiers sont une chance pour la République. La République doit donc leur donner les chances de réussir! #FH2012 http://t.co/Vi2nPsEK,2012-04-07 15:22:13,188647871552307200
fhollande,Suivez en direct mon intervention sous le chapiteau de la relève des @Jeunessocialist  : http://t.co/ndhGy2Ow #Aubervilliers #FH2012,2012-04-07 15:17:01,188646568700817408
fhollande,"J'arrive devant les """"""""chapiteaux de la relève"""""""" des jeunes socialistes à #Aubervilliers! #FH2012 http://t.co/RrClVMcO",2012-04-07 15:09:59,188644797509148675
fhollande,La prévention est un investissement! #Santé #Aubervilliers #FH2012,2012-04-07 14:50:47,188639965842907136
fhollande,Nos avons à permettre une meilleure coordination de l'hôpital et de la médecine de ville. #Aubervilliers #FH2012,2012-04-07 14:47:15,188639077413818369
fhollande,"Il faudra encadrer les dépassements d'honoraires, et mettre en place partout où il est possible de le faire le tiers payant. #Aubervilliers",2012-04-07 14:46:20,188638848803282944
fhollande,Une partie de nos compatriotes renoncent à se soigner. #Aubervilliers #FH2012,2012-04-07 14:44:36,188638410079084546
fhollande,"Les inégalités sont cumulatives : quand il y a des inégalités sociales, il y a des inégalités à l'accès aux soins. #Aubervilliers FH2012",2012-04-07 14:44:01,188638265555943424
fhollande,"A #Aubervilliers, rencontre avec des professionnels de santé. #FH2012 http://t.co/IE6wIe23",2012-04-07 14:15:23,188631056407203841
fhollande,"Et si je retiens parfois mon humour, c'est par charité pour le candidat sortant! #FH2012",2012-04-07 13:16:38,188616273649860608
fhollande,"Je n'ai pas d'artifice, je n'ai pas besoin de m'habiller dans un personnage. Je suis ce que je suis, simple, direct, libre. #FH2012",2012-04-07 13:15:37,188616018191597568
fhollande,Déjeuner avec les acteurs associatifs de Clichy-sous-Bois. #FH2012 http://t.co/9kjwFV8l,2012-04-07 11:50:41,188594640348393472
fhollande,"À l'issue de notre table ronde avec les femmes des #Ulis, j'ai répondu à la presse : http://t.co/JvyKTvfR #FH2012",2012-04-07 10:51:44,188579805921427456
fhollande,Je remercie toutes les femmes qui sont venues échanger ce matin aux #Ulis. Vous donnez une très belle image des femmes et de vos engagements,2012-04-07 09:49:04,188564035657146368
fhollande,Nous renforcerons les moyens de la protection judiciaire de la jeunesse. #Ulis #FH2012,2012-04-07 09:44:48,188562964796809217
fhollande,"Chaque peine, chaque sanction doit être exécutée, pour éviter l'impunité. #Ulis #FH2012",2012-04-07 09:43:42,188562686349553664
fhollande,L'éducation des pères est indispensable : on ne devient pas père parce qu'on est homme. #Ulis #FH2012,2012-04-07 09:41:21,188562095531495425
fhollande,"Je pense qu'un Président seul, même appuyé par une majorité ne peut réussir seul. Nous devons avoir un effort national. #Associations #Ulis",2012-04-07 09:33:44,188560178021543936
fhollande,"Si les associations n'étaient pas présentes et s'il n'y avait pas des élus dévoués,nous aurions connu de nouvelles explosions. #Ulis #FH2012",2012-04-07 09:32:28,188559861796188160
fhollande,"Dans la négociation que nous ouvrirons sur les retraites, nous devrons avoir une dimension """"""""femme"""""""" dans nos discussions. #Ulis #FH2012",2012-04-07 09:28:41,188558907235508225
fhollande,"Nous devons renforcer tous les dispositifs d'insertion, notamment vers les chômeurs de longues durées. #Ulis #FH2012",2012-04-07 09:26:27,188558345991487489
