screenName,text,created,id
jcgaudin,J'ai rencontré aujourd'hui les membres du collectif #CleanmyCalanques qui s'engagent pour la propreté de nos magnif… https://t.co/t0UfBx3TgP,2017-11-24 16:36:30,934098409547616256
jcgaudin,"Bienvenue au  nouveau préfet des Bouches-du-Rhône, Pierre Dartout nommé hier en conseil des Ministres. Je lui souha… https://t.co/RJATSprSbu",2017-11-23 11:23:57,933657365790027776
jcgaudin,"Comme tous les ans, j'inaugurais ce dimanche notre traditionnelle foire aux santons de #Provence https://t.co/HbE5abezj2",2017-11-21 17:30:41,933024884220887040
jcgaudin,"Une nouvelle fois Marseille est à l'honneur !  À l'occasion du #MAPIC, le centre commercial Prado et la ville de… https://t.co/8L47W1FMQh",2017-11-17 09:28:51,931454074767269888
jcgaudin,"Tous ceux qui ont connu le Cardinal PANAFIEU se souviendront longtemps de sa bonté, de sa générosité et de sa clair… https://t.co/tMepycLtVy",2017-11-13 11:47:02,930039296890982401
jcgaudin,"Un ami nous a quitté. 
Son Éminence le Cardinal Bernard PANAFIEU s'est éteint hier à l'hôpital de Carpentras. Sa di… https://t.co/vWhH1ZF9W1",2017-11-13 11:45:53,930039009874731008
jcgaudin,RT @Gometmedia: [Carnet de bord] #MissionMiami : l'accord entre @MiamiDadeCounty et la Métropole Aix Marseille est signé. https://t.co/q5ox…,2017-11-09 11:24:07,928583980718477312
jcgaudin,RT @RebecaSosaMiami: Truly an honor to join my colleagues in signing Sister City Agreement w/ Aix-Marseille Provence Metropolis &amp; #MiamiDad…,2017-11-06 23:33:56,927680480140460033
jcgaudin,"C’est avec tristesse que j’apprends le décès de Robert Lagier, Maire de Meyreuil... https://t.co/xwWieNvQqM https://t.co/CvJGubE8dD",2017-10-22 10:27:46,922046817038163968
jcgaudin,Blocage des centres de transfert des ordures: le Préfet doit intervenir ! Il en va de la santé publique de nos conc… https://t.co/KhvQuYUctV,2017-10-15 15:17:11,919582936579694592
jcgaudin,RT @marseille: Moment de recueillement et dépôt d'une gerbe de fleurs sur le parvis de la gare Saint-Charles en mémoire de Mauranne et Laur…,2017-10-10 15:59:11,917781565324824577
jcgaudin,RT @MarinsPompiers: [Retour en ] Cérémonie de Présentation au Drapeau du Bataillon et remise de casques aux élèves de l'école des #MarinsP…,2017-10-10 15:57:59,917781262181588993
jcgaudin,"Retrouvez mon interview dans Le Point de cette semaine : 

Il l'a répété à plusieurs... https://t.co/L3ep2Y9C9R https://t.co/L4PViBCEAR",2017-10-07 10:51:14,916616902990008320
jcgaudin,".@gerard_larcher est un homme d’État, autant dans son rôle de Président du @Senat que de 2ème personnage de la République. Bravo à lui !",2017-10-02 18:36:28,914922042855755777
jcgaudin,.@gerard_larcher a montré qu'à ce poste il a toujours été le président de tous les sénateurs et sénatrices.,2017-10-02 18:34:22,914921515463905280
jcgaudin,.@gerard_larcher mérite particulièrement cette large victoire car c'est un fervent défenseur du bicamérisme républicain.,2017-10-02 18:33:52,914921389106352130
jcgaudin,Je félicite du fond du cœur mon ami @gerard_larcher brillamment réélu pour la 3ème fois Président du @Senat avec 22… https://t.co/gtGXqdD5DR,2017-10-02 18:33:14,914921232197353472
jcgaudin,RT @marseille: @jcgaudin « Je salue le courage du jeune réserviste de l’opération Sentinelle qui a permis de stopper l’assaillant. » @jcgau…,2017-10-02 16:20:10,914887743012052992
jcgaudin,"RT @marseille: @jcgaudin « En notre nom à tous, je présente mes plus sincères condoléances aux familles de Mauranne et Laura. »
@jcgaudin h…",2017-10-02 16:20:04,914887716520808448
jcgaudin,"RT @marseille: @jcgaudin . @jcgaudin « Frappée en plein cœur hier par des actes de terrorisme, Marseille est meurtrie. » https://t.co/t2gvx…",2017-10-02 16:19:54,914887678042214405
jcgaudin,RT @marseille: @jcgaudin « Marseille reste déterminée à lutter contre la terreur et la barbarie. » Marseille Espérance https://t.co/HCDaBqS…,2017-10-02 16:19:42,914887627706421248
jcgaudin,"RT @marseille: @jcgaudin « Depuis toujours, ici, le respect des cultures et des communautés est ancré dans les mentalités. »
Marseille Espé…",2017-10-02 16:19:35,914887597536763904
jcgaudin,"RT @marseille: @jcgaudin . @jcgaudin « Je remercie de leur mobilisation les membres de Marseille Espérance, présents à mes côtés aujourd’hu…",2017-10-02 16:19:27,914887563072196608
jcgaudin,"RT @marseille: @jcgaudin « Nous voulons une ville unie, fraternelle et solidaire. » @jcgaudin
#MarseilleEsperance
 https://t.co/8k78hfdsSx…",2017-10-02 16:18:58,914887442817257472
jcgaudin,"RT @marseille: @jcgaudin Retrouvez la déclaration intégrale de #MarseilleEsperance, ce jour, aux côtés de Monsieur le Maire @jcgaudin &gt; htt…",2017-10-02 16:18:50,914887407002103808
jcgaudin,"Entouré de tous les dignitaires religieux de """"Marseille Espérance"""", j'ai souhaité réagir suite à l'acte... https://t.co/JNVotckLsT",2017-10-02 16:16:46,914886885880758272
jcgaudin,"RT @marseille: Le maire de Marseille @jcgaudin réunira les dignitaires religieux de Marseille Espérance à 16h15, suite à la tragédie surven…",2017-10-02 16:14:49,914886398762733569
jcgaudin,"Attentat à la Gare Saint-Charles :

Ce qui s'est passé cet après-midi à la gare... https://t.co/FfQ4xiSi2A https://t.co/Tse37yz1Bd",2017-10-01 18:13:58,914553994953052161
jcgaudin,RT @gerardcollomb: Une attaque odieuse. Un crime lâche et abject. Mes premières pensées vont aux familles des victimes de ce drame. https:/…,2017-10-01 16:22:00,914525816528211974
jcgaudin,Aux côtés de @gerardcollomb à la gare Saint-Charles pour rencontrer les forces de sécurité et de secours,2017-10-01 16:21:03,914525576555323392
jcgaudin,"RT @EmmanuelMacron: Profondément indigné par cet acte barbare, en peine avec les familles et les proches des victimes de Marseille.
Je salu…",2017-10-01 16:16:53,914524530776903682
jcgaudin,"RT @gerardcollomb: #Marseille : après l’attaque perpétrée à proximité de la gare Saint Charles, je me rends immédiatement sur les lieux.",2017-10-01 14:10:21,914492685356077057
jcgaudin,RT @PoliceNationale: [ #Marseille] Événement gare Saint Charles. Ne relayez pas les #rumeurs &amp; suivez les comptes : @PoliceNat13 @prefpolic…,2017-10-01 13:39:17,914484866229719040
jcgaudin,"RT @PoliceNat13: #Marseille Gare Saint Charles @PoliceNat13 
Opération de Police en cours 
Évitez le secteur",2017-10-01 13:38:48,914484747769966593
jcgaudin,la Métropole @AMPMetropole en tant que premier investisseur public avec plus de 10 millions€ soutient la révolution… https://t.co/JlUfYmuVuA,2017-09-28 18:26:38,913470019127869441
jcgaudin,RT @thecampProvence: We launch our global engine for positive change on September 28. #openthecamp The future starts HERE! https://t.co/D9H…,2017-09-28 18:21:34,913468744365731840
jcgaudin,Très heureux d’inaugurer @thecampProvence projet structurant pour le territoire métropolitain de par son envergure internationale #THECAMP,2017-09-28 18:20:54,913468574039199747
jcgaudin,RT @laurentwauquiez: Félicitations aux sénateurs LR élus aujourd'hui. Un premier avertissement pour un President coupé de nos territoires.…,2017-09-25 21:46:16,912433096011722752
jcgaudin,Aujourd’hui c’est une belle journée pour les Républicains ! @lesRepublicains @lesRep_Senat #Senatoriales2017 https://t.co/P1ajRQdHx1,2017-09-24 18:38:16,912023394056536064
jcgaudin,Rien ne doit se faire dans l'élaboration des lois au nom de l'idéologie mais dans le pragmatisme et l'intérêt de nos concitoyens !,2017-09-24 18:36:38,912022983102930944
jcgaudin,Je me réjouis de la très probable réélection de mon ami @gerard_larcher comme Président du @Senat le 2/10 prochain #senatoriales2017,2017-09-24 18:33:26,912022179935608838
jcgaudin,Le groupe « Les Républicains » restera le plus important au sein de la Haute Assemblée et je m'en réjouis #Senatoriales2017,2017-09-24 18:30:54,912021540178399236
jcgaudin,La droite Républicaine et le Centre ont remporté les élections sénatoriales récoltant les bons résultats des électi… https://t.co/kR5gW7HALw,2017-09-24 18:28:47,912021008533606400
jcgaudin,Très heureux d’avoir pu faire découvrir au Président @EmmanuelMacron et au Président du CIO le futur site olympique… https://t.co/dRXRJsIUae,2017-09-22 06:00:40,911107961992261632
jcgaudin,RT @marseille: Marseille et @Paris rassemblées autour des valeurs de l'olympisme et de @Paris2024 https://t.co/cMbCC07jWF,2017-09-21 21:11:04,910974686191898624
jcgaudin,RT @marseille: L'Hôtel de Ville aux couleurs de @Paris2024 #ANousLesJeux @EmmanuelMacron @jcgaudin @TonyESTANGUET @sophcluz @FlesselLaura…,2017-09-21 21:10:06,910974442561523712
jcgaudin,"RT @Paris2024: @marseilleLa dream team pour les Jeux2⃣0⃣2⃣4⃣
Cc @emmanuelmacron @jcgaudin @tonyestanguet @sophcluz #ANousLesJeux https://t…",2017-09-21 21:09:54,910974390615101440
jcgaudin,"Roch Hachana qui marque le nouvel an juif et le début des célébrations du mois de Tichri,... https://t.co/HwCUg85OAQ https://t.co/QmGPEQx57n",2017-09-20 17:23:34,910555042389749760
jcgaudin,"Le Dôme n'accueillera pas le spectacle de Dieudonné. 

La politique que je conduis à Marseille a toujours été... https://t.co/frR1OKKnU2",2017-09-15 17:05:19,908738510114426880
jcgaudin,Paris et @Marseille accueilleront les Jeux Olympiques en 2024 ! #ANousLesJeux https://t.co/ecsJ77Y8gV,2017-09-14 11:14:29,908287833139503104
jcgaudin,"C’est une reconnaissance supplémentaire pour Marseille, ville attractive et rayonnante désormais installée dans le club des cités olympiques",2017-09-13 17:52:40,908025651839545346
jcgaudin,"Au-delà de notre ville, notre Métropole toute entière bénéficiera fortement et durablement de ces JO et de ses retombées économiques",2017-09-13 17:52:29,908025605660258312
jcgaudin,"Marseille a soutenu dès son origine la candidature de Paris, notre ville aura le privilège d’accueillir les épreuves de voile et de football",2017-09-13 17:52:10,908025527243550720
jcgaudin,Marseille accueillera les Jeux Olympiques en 2024 avec Paris ! #anouslesjeux,2017-09-13 17:51:43,908025414685270016
jcgaudin,Corderie : je prends acte de la décision de la Ministre qui respecte l’histoire de notre Ville et lui permet de continuer son développement,2017-09-04 18:28:20,904773138331860994
jcgaudin,"Inauguration cet après-midi de la boutique Marcel Pagnol sur la voie historique de Marseille, rue Caisserie https://t.co/uQzhpDO6wy",2017-08-28 17:01:22,902214537927159810
jcgaudin,Retrouvez mon interview de ce mercredi dans le Figaro https://t.co/aj6W4KxRd8,2017-08-25 08:45:58,901002699608641536
jcgaudin,J'ai tenu à rendre hommage aux marins pompiers qui sont intervenus avec courage tout le... https://t.co/gOeR9lWqTC https://t.co/FW2nDYxhod,2017-08-21 17:35:02,899686295966019584
jcgaudin,La folie meurtrière d’un individu ayant séjourné plusieurs fois en hôpital psychiatrique... https://t.co/rLm9QvqYkh https://t.co/Fa9492VU3V,2017-08-21 14:20:15,899637277046984704
jcgaudin,"Plus que jamais, il nous faut unir nos forces pour vaincre le fanatisme et faire triompher les valeurs de paix et de solidarité #Barcelone",2017-08-17 20:37:17,898282606319484928
jcgaudin,"J'adresse toutes mes pensées aux victimes, aux blessés et à leurs proches, aux responsables de la ville de… https://t.co/JZ3AMvQo3X",2017-08-17 20:32:32,898281412540760064
jcgaudin,"À sa famille et à ses proches, j'adresse mes plus sincères condoléances et toutes mes pensées les plus chaleureuses #EtienneCassaro",2017-08-09 19:30:35,895366717760819200
jcgaudin,"Figure incontournable de Marseille et du Panier, Étienne avait repris l'établissement familial tenu aujourd'hui par… https://t.co/veoU2G3I8x",2017-08-09 19:28:27,895366181384855556
jcgaudin,"C'est avec émotion et tristesse que j'apprends le décès d'Étienne Cassaro, patron de la pizzeria emblématique """"""""Chez… https://t.co/nB0FveWVuG",2017-08-09 19:19:37,895363957858480129
jcgaudin,"C'est avec tristesse et émotion que j'apprends le décès de la sénatrice Nicole Bricq,... https://t.co/7HvyPdNy3D https://t.co/fKkcMFtadF",2017-08-06 19:10:40,894274541203185664
jcgaudin,Cette bonne nouvelle augmente notre confiance et notre détermination à la hauteur de l'honneur qui nous serait ains… https://t.co/TwfGrZnCil,2017-08-01 12:50:11,892366851908530176
jcgaudin,Très attristé par le décès de #SophieHuet fine commentatrice de la vie politique. Condoléances à ses proches et aux… https://t.co/zBEMmVtjI1,2017-07-31 15:13:03,892040418799562752
jcgaudin,Bravo et merci à ces athlètes marseillais qui font rayonner notre ville à travers le monde ! @Cam_Lacourt @MMetella #Budapest #Marseille,2017-07-30 18:41:36,891730513358184448
jcgaudin,C'est l'occasion pour moi de saluer aussi la belle performance de @MMetella qui a terminé sur le podium de la finale du 100m nage libre,2017-07-30 18:38:45,891729794391564288
jcgaudin,"En glanant l'or pour l'ultime course de son immense carrière, @Cam_Lacourt a su triompher pour terminer au sommet de la scène internationale",2017-07-30 18:34:58,891728841688961024
jcgaudin,Toutes mes félicitations à @Cam_Lacourt pour sa performance exceptionnelle sur le 50 m nage dos aux championnats du… https://t.co/uK2M7K692e,2017-07-30 18:31:22,891727937053089792
jcgaudin,"Je suis particulièrement heureux de vous annoncer, aujourd'hui, que la Ville de Marseille... https://t.co/8VO3PCZE1B https://t.co/lr1IA4sXmd",2017-07-28 15:26:12,890956563640397824
jcgaudin,Merci à @gerard_larcher ainsi qu’à tous les sénateurs m’ayant témoigné leur amitié lors de cette séance particulièrement émouvante,2017-07-25 14:55:16,889861615104950272
jcgaudin,"RT @Senat: """"""""Je peux dire, par dessus tout, @marseille c'est vous-même""""""""  Hommage de @gerard_larcher à @jcgaudin alors qu'il préside sa dern…",2017-07-25 14:45:38,889859191732674562
jcgaudin,"RT @publicsenat: Pour sa dernière présidence de séance @JCGaudin a reçu une standing-ovation de tout l’hémicycle #DirectSénat
https://t.co/…",2017-07-25 14:44:42,889858955756875777
jcgaudin,C'est avec une immense émotion que j'apprends le décès brutal de Frédéric CHEVALIER.... https://t.co/ZgKVYv3HzU https://t.co/V40yqZRDmm,2017-07-21 20:25:43,888495224699457536
jcgaudin,"C'est avec beaucoup d'émotion que j'apprends la mort de Robert Vigouroux. 

Je tiens à... https://t.co/8pttVaXDQw https://t.co/4XJ14FpEVQ",2017-07-09 13:04:34,884035551392919552
jcgaudin,"En tant que grande Femme de notre siècle, je suis tout à fait favorable à ce que Simone Veil soit inhumée au Panthé… https://t.co/kuuco3Wsxb",2017-07-02 16:35:10,881551834535653378
jcgaudin,Une très grande dame vient de nous quitter et la France toute entière est en deuil d'une... https://t.co/zPEX3TjvXK https://t.co/LaNuWr8tZ9,2017-06-30 13:31:35,880780857895682048
jcgaudin,Retrouvez mon interview de ce lundi dans @laprovence https://t.co/uPWfiGaVJX,2017-06-27 09:15:25,879629229591318530
jcgaudin,@montecristo6ma Oui cher monsieur !,2017-06-25 10:39:45,878925677717803009
jcgaudin,@kalinou68 Oui chère Madame !,2017-06-25 10:39:27,878925599095566336
jcgaudin,Meilleurs vœux de santé et de prospérité à l'ensemble des Marseillais musulmans fêtant la fin du mois sacré de Ramadan.  AIDKOUM MABROUK !,2017-06-25 08:09:01,878887741211254784
jcgaudin,RT @valerieboyer13: Je suis ce soir particulièrement émue et j'ai une pensée pour celles et ceux qui m'ont aidé dans cette campagne #legisl…,2017-06-18 21:29:47,876552547045187586
jcgaudin,RT @YvesMoraine: Félicitations à Valérie Boyer et Guy Teissier réélus à Marseille et mes amicales pensées Dominique Tian!!!,2017-06-18 21:29:42,876552524622434304
jcgaudin,"Les Français ont donné une majorité au Président de la République, lors de ce second tour... https://t.co/rc32gB7Cbq https://t.co/9Xztyl1rf1",2017-06-18 20:50:38,876542693387665409
jcgaudin,"A voté, pour ce deuxième tour des élections législatives. https://t.co/eBDbUErRWO",2017-06-18 10:13:19,876382307380285440
jcgaudin,"Chère Nathalie, tout mon soutien en ce moment difficile et mes vœux de prompt rétablissement @nk_m",2017-06-15 13:14:01,875340621791277056
jcgaudin,RT @MartineVassal: #Législatives2017 | Soutien aux candidats de la Droite Républicaine et de Centre pour le 2e tour https://t.co/l1ciZM8V…,2017-06-12 20:41:59,874366191703396352
jcgaudin,A voté ! https://t.co/1PuQ278a0e,2017-06-11 12:17:18,873876795405291521
jcgaudin,"En cette sombre période de notre histoire nous devons rester solidaires pour ne pas laisser triompher la désunion, la haine et la peur",2017-06-04 10:20:06,871310586298204160
jcgaudin,Je veux féliciter les forces de l'ordre qui par leur intervention et leur courage ont neutralisé les assaillants dans leur folie meurtrière,2017-06-04 10:18:51,871310272924987392
jcgaudin,Je tiens à présenter mes condoléances aux familles et aux proches des 7 personnes décédées et des 48 blessés.,2017-06-04 10:16:25,871309657830293504
jcgaudin,Ce nouvel attentat visant le coeur de Londres ravive les plaies des victimes du drame de Manchester et du peuple britannique.,2017-06-04 10:15:39,871309464430837760
jcgaudin,"Pour la troisième fois en moins de trois mois, l'Angleterre a été frappée sur son sol par la cruauté terroriste. https://t.co/mn0TRZaBEW",2017-06-04 10:13:56,871309032778289152
jcgaudin,@RenaudMuselier @regionpaca Je sais qu’il saura mettre toute son énergie et ses compétences au service de nos conci… https://t.co/scMOftFx7U,2017-05-29 14:31:09,869199438199349248
jcgaudin,Toutes mes félicitations à mon ami @RenaudMuselier pour son élection à la présidence de la @regionpaca . https://t.co/IcefegQBuD,2017-05-29 13:59:19,869191427414265856
jcgaudin,"C'est avec effroi, que j'apprends et déplore, ce matin, le décès de quatre personnes dont... https://t.co/8NaCkKuy2H https://t.co/9E2oBOWpUZ",2017-05-25 10:23:01,867687441506996224
jcgaudin,Autour d'@YvesMoraine et de @MarinePustorino pour le lancement de leur campagne pour les législatives dans la 5ème… https://t.co/ObS7z2VExy,2017-05-12 20:38:35,863131312139493376
jcgaudin,"Démission de @cestrosi, législatives : retrouvez mon interview de ce matin sur @bleuprovence https://t.co/VvlOJAqwvh",2017-05-09 11:10:18,861901136466509824
jcgaudin,Retrouvez mon interview de ce matin dans @laprovence sur mon appel à voter @EmmanuelMacron au deuxième tour de l'él… https://t.co/3VSCfKyS3h,2017-04-27 09:54:47,857533477096435712
jcgaudin,"Présidentielles, deuxième tour, législatives : retrouvez mon interview de ce matin sur @bleuprovence https://t.co/ytNE75ZGcP",2017-04-25 12:26:58,856846996296142848
jcgaudin,RT @laprovence:  @jcgaudin appelle à voter @EmmanuelMacron https://t.co/McOWrM50HT #Marseille #Presidentielle2017 #Politique https://t.co/…,2017-04-23 19:03:51,856222101581303810
jcgaudin,Pour les élections législatives dans les BdR je soutiendrai les candidats de la Droite et du Centre investis par Les Républicains et l’UDI.,2017-04-23 19:01:45,856221571488337923
jcgaudin,Pour le 2nd tour les candidats en présence me conduiront sans hésiter à voter pour Emmanuel MACRON #Presidentielle2017,2017-04-23 18:58:25,856220732468154368
jcgaudin,"Le projet de @FrancoisFillon est le meilleur pour l’avenir de la France, il devrait être largement repris par les candidats aux législatives",2017-04-23 18:56:34,856220269098278912
jcgaudin,Après les résultats du 1er tour je tiens à rendre hommage à l’engagement et à la campagne de @FrancoisFillon que j’… https://t.co/uKGj76dp9l,2017-04-23 18:53:29,856219492418015232
jcgaudin,C'est avec une immense tristesse que j'apprends le décès de Jean-Pierre Franceschi qui a... https://t.co/xUGJMtsrP4 https://t.co/6ecV1pjNs4,2017-04-17 20:06:07,854063444210876419
jcgaudin,"Alors que tous les Chrétiens  s'apprêtent à célébrer Pâques, mes pensées  les plus... https://t.co/trKuyFAu6i https://t.co/1DtqxKyenz",2017-04-16 08:26:13,853524922089472000
jcgaudin,"RT @Fillon2017_fr: « Si je résume : voter Le Pen, c'est voter Macron ; voter Macron,c'est voter Hollande ! Je vote @FrancoisFillon » @jcgau…",2017-04-12 18:28:53,852227036378783744
jcgaudin,RT @Gometmedia: [Direct] Séance d'installation du Conseil de développement métropolitain avec @jcgaudin @MichelRouxSalon @schalinet et Géra…,2017-04-06 16:11:45,850018198116237313
jcgaudin,@massalia13013 @FrancoisFillon Il faut adresser votre demande au Préfet dont c'est la compétence. Il est le seul à… https://t.co/nXr9shF7RJ,2017-04-05 15:28:39,849644961758928897
jcgaudin,Je vous invite tous à nous rejoindre autour de @FrancoisFillon mardi 11 avril à 18h30 au parc Chanot. Inscription :… https://t.co/LMIpdlQpXo,2017-04-04 16:00:38,849290623949656066
jcgaudin,Retrouvez mon interview dans @laprovence par Sylvain Pignol et Philippe Schmit https://t.co/YoiPNHdl4W,2017-04-03 16:11:44,848931027909300224
jcgaudin,"Rappel : Je vous donne rendez-vous Mardi 28 mars 2017 à 18h30, pour une réunion publique en présence de Bruno RETA… https://t.co/qjz8Ge3abF",2017-03-23 13:52:19,844909677678940160
jcgaudin,"Le monde politique perd avec lui l'une de ses figures emblématiques, sans concessions sur les valeurs.",2017-03-21 17:26:07,844238705657331712
jcgaudin,"Même si nous ne partagions pas les mêmes opinions politiques, je tiens à saluer ce personnage incontournable de notre vie parlementaire.",2017-03-21 17:25:42,844238603370860545
jcgaudin,"Henri Emmanuelli fut un homme de convictions et de caractère. C'est avec tristesse que j'apprends sa mort, aujourd'… https://t.co/kQnORQwLpC",2017-03-21 17:25:12,844238474383441920
jcgaudin,Sur l'ensemble des questions @FrancoisFillon a démontré que son projet est le seul à même de redresser la France… https://t.co/G68qrZ8wJt,2017-03-20 22:45:21,843956655620603904
jcgaudin,".@FrancoisFillon est le seul candidat qui possède l'envergure, l'expérience et la solidité pour être le Président d… https://t.co/8Gi8eV0Qej",2017-03-20 22:41:49,843955768437235712
jcgaudin,@FlorentBastien Il n'y a pas besoin d'inscription. Bien à vous.,2017-03-18 13:47:49,843096604018139141
jcgaudin,Je vous invite à nous rejoindre pour une réunion publique en présence de @BrunoRetailleau Mardi 28 mars à 18h30 au… https://t.co/nGjtEW45RH,2017-03-17 16:30:10,842775073002000388
jcgaudin,RT @FrancoisFillon: Très heureux de retrouver mon ami @jcgaudin aujourd'hui à #Marseille ! https://t.co/kFpsK9zTtM,2017-03-15 16:13:49,842046185317756928
jcgaudin,Très heureux d'accueillir à Marseille @FrancoisFillon et @BrunoRetailleau @Fillon2017_fr #Presidentielle2017… https://t.co/syY4PINDXk,2017-03-15 16:13:30,842046104086675456
jcgaudin,RT @Fillon2017_fr: .@FrancoisFillon est accueilli à #Marseille par @jcgaudin avant son meeting ce soir à Pertuis. @BrunoRetailleau @valerie…,2017-03-15 16:10:00,842045222209114113
jcgaudin,Je présentais hier avec @MartineVassal l'Agenda du Développement Économique de la Métropole @AMPMetropole… https://t.co/swljfKXdjS,2017-03-14 17:21:52,841700920387878920
jcgaudin,Cet effectif est insuffisant! Les feux dévastateurs de cet été dans les Calanques et vers Vitrolles le démontrent!,2017-03-10 18:47:44,840272979095375873
jcgaudin,"En ne laissant que 2 Canadair à Marignane, le Gouvernement méprise la sécurité des Marseillais et notre patrimoine environnemental.",2017-03-10 18:43:50,840271996663476224
jcgaudin,Je condamne fermement la décision du Gouvernement de transférer la base des Canadair de Marignane à Nîmes ! https://t.co/pydYnu0WQR,2017-03-10 18:42:40,840271704937115648
jcgaudin,Retrouvez mon interview par @FranzOlivierG dans @LePoint de cette semaine https://t.co/x7YgujWV3s,2017-03-09 11:21:08,839798201951617024
jcgaudin,"Ce matin à Saint Victor, je participais à notre traditionnelle bénédiction des navettes pour la #chandeleur marseil… https://t.co/EiJGQODkjG",2017-02-02 17:09:14,827202227894964224
jcgaudin,J'ai été très heureux de rencontrer @francishuster de passage à Marseille au théâtre municipal de l'Odéon pour sa c… https://t.co/XLzV3Lo07u,2017-01-19 12:18:43,822055686603472896
jcgaudin,Je déclare Marseille ville capitale européenne du sport 2017 officiellement ouverte @mpsport2017 https://t.co/CIl70gqJ3Q,2017-01-14 16:24:38,820305635975647232
jcgaudin,C’est un grand plaisir pour moi de vous dévoiler le nouveau logo de la métropole Aix-Marseille Provence… https://t.co/Kq9swZcFEY,2017-01-12 15:00:04,819559576114724864
jcgaudin,Très heureux d’être venu soutenir @FrancoisFillon pour son meeting hier soir à Nice https://t.co/4VoN7eQ6Kp,2017-01-12 07:30:15,819446378371940352
jcgaudin,Je vous souhaite à tous une très bonne année 2017 ! https://t.co/owBkQ7t7IL,2017-01-01 10:40:04,815507877540597760
jcgaudin,Je vous souhaite à tous de bonnes et chaleureuses fêtes de fin d'année ! https://t.co/g9NBxpNtr9,2016-12-23 13:14:36,812285277632860160
jcgaudin,Cette année et comme depuis toujours j'ai réalisé avec plaisir ma crèche provençale qui symbolise nos belles tradit… https://t.co/1SqYezSfkn,2016-12-20 14:38:45,811219290665971712
jcgaudin,"Le peuple allemand doit savoir qu’en ces heures sombres nous marchons à ses côtés, nous lutterons avec lui pour la… https://t.co/3E1YQmzOLi",2016-12-20 11:26:48,811170987576270848
jcgaudin,Je tiens à assurer le peuple allemand de ma compassion et de la solidarité de tous les Marseillais,2016-12-20 11:25:14,811170592460304384
jcgaudin,Ces femmes et ces hommes fêtaient un moment de paix quand la barbarie s’est encore manifestée dans toute son horreur.,2016-12-20 11:24:18,811170357189210113
jcgaudin,"Après l’attaque au camion qui a frappé un marché de Noël en plein Berlin, nos pensées vont vers les victimes de cette violence aveugle",2016-12-20 11:23:42,811170204520775680
