screenName,text,created,id
jcgaudin,Les maires de Marseille n'ont pas toujours bien accueilli les étrangers. En 1915 il ne voulait pas accueillir les arméniens,2015-09-12 10:04:56,642640024257851392
jcgaudin,Tout ne peut pas reposer sur la ville même si je cherche des moyens qui peuvent aider #refugies,2015-09-12 09:57:29,642638151752794112
jcgaudin,Nous sommes prêt à accepter d'acceuillir des gens qui sont persécutés dans leur pays,2015-09-12 09:56:33,642637917228302336
jcgaudin,Nous ne pouvons pas accepter que l'Etat se défausse sur les collectivités territoriales pour les réfugiés,2015-09-12 09:54:28,642637393816850433
jcgaudin,L'Etat va t'il participer au moment où il nous prive de 30 millions €? Nous ne pouvons pas payer l'accueil de ces réfugiés.,2015-09-12 09:53:30,642637146558451712
jcgaudin,Je dis non à la propagande compassionnelle et culpabilisante de ceux qui donnent des leçons et ne sont en charge de rien #réfugiés,2015-09-12 09:51:12,642636570969948160
jcgaudin,Pour les réfugiés je dis oui à la générosité mais attention à la responsabilité,2015-09-12 09:48:33,642635903173849089
jcgaudin,"La demande de débat sur les réfugiés, c’est de l'agitation que le PS veut faire au Conseil Municipal car il ne sait plus comment exister",2015-09-12 09:46:41,642635432300257280
jcgaudin,Je n'ai pas de problème personnel ni politique avec @marysejoissains sa fille est sénatrice avec moi sur ma liste au Sénat.,2015-09-12 09:44:35,642634903608262656
jcgaudin,Je prendrai ma décision pour la métropole le 9 ou le 10 octobre En attendant les élus doivent désigner les 240 représentants qui y siégeront,2015-09-12 09:43:32,642634640407298048
jcgaudin,Nous allons mettre les bouchées doubles pour remédier aux quelques couacs des TAP.,2015-09-12 09:40:18,642633827018481664
jcgaudin,Dans 98% des cas les TAP se sont bien passés il y a eu quelques couacs je le reconnais,2015-09-12 09:37:17,642633068361199616
jcgaudin,Nous avons lancé 250 appels d'offres pour trouver les associations qui assurent les TAP pour s'occuper des 73 000 enfants marseillais,2015-09-12 09:36:25,642632849431097344
jcgaudin,Les rythmes scolaires sont un décret-loi très contestable et très contesté pour l’intérêt des enfants.,2015-09-12 09:34:50,642632450104008704
jcgaudin,"Je serai demain samedi 12 septembre l'invité de l'émission """"""""La voix est libre"""""""" diffusée à 11h30 sur @France3Provence http://t.co/k2TI7AXQEq",2015-09-11 14:32:54,642345074785959937
jcgaudin,Très heureux d'avoir échangé avec @Anne_Hidalgo qui partage notre enthousiasme au sujet de la coopération Marseille Paris pour les JO2024,2015-09-08 14:53:28,641263085433528321
jcgaudin,"RT @CPozmentier: """"""""Marseille : aux armes, policiers municipaux !"""""""" http://t.co/4OopsQt2QQ @Destimed @jcgaudin @villemarseille #sécurité http:…",2015-09-05 10:14:57,640105829774008320
jcgaudin,La police municipale marseillaise sera désormais dotée d'armes de poing de catégorie B https://t.co/txn4L11RId http://t.co/hfU5XVfUm9,2015-09-04 17:06:12,639846937060081664
jcgaudin,C'est ce problème et ses conséquences qui ont nourri les débats de l'Union des Maires ce jour à St Victoret. http://t.co/i2yGE2Xcxc,2015-08-29 20:18:03,637720892777361408
jcgaudin,L'ensemble des Maires de France socialistes compris manifesteront leur désaccord avec cette politique hypocrite et irresponsable le 19 sept,2015-08-29 18:35:27,637695073187164160
jcgaudin,Les soit-disant économies de l'Etat se font uniquement sur le dos des Communes.,2015-08-29 18:34:50,637694914986426368
jcgaudin,Une très bonne fête de l'Assomption à tous en ce 15 août avec une pensée particulière de soutien pour les Chrétiens d'Orient,2015-08-15 12:16:44,632526332933632000
jcgaudin,Les résultats des nageurs du @CNMarseille font honneur non seulement à la France mais également à Marseille ! #Kazan https://t.co/rGnSkhIOAR,2015-08-10 15:22:26,630761125857128448
jcgaudin,J'espère que Bielsa reviendra sur sa décision et qu'une solution sera trouvée rapidement car l'OM est un facteur de cohésion pour Marseille,2015-08-09 12:39:00,630357612576550912
jcgaudin,"Je regrette la décision de M.Bielsa, elle me choque énormément car elle met l'OM en difficulté @OM_Officiel #BielsaDemission",2015-08-09 12:37:02,630357116088414209
jcgaudin,J'ai fait savoir à Mme Louis-Dreyfus et au Pdt Vincent Labrune qu'il fallait tout faire pour garder M. Bielsa.@OM_Officiel #BielsaDemission,2015-08-09 09:27:25,630309395721793536
jcgaudin,.@Cam_Lacourt retrouve aujourd'hui sa place parmi les meilleurs mondiaux de la natation #Kazan2015,2015-08-04 18:30:36,628634153144176640
jcgaudin,"Bravo pour son retour dû à son travail, son courage et ses efforts. Il ne s'est pas laissé abattre par l'adversité #camillelacourt #Kazan",2015-08-04 18:29:26,628633861900140544
jcgaudin,Je souhaite adresser toutes mes félicitations à @Cam_Lacourt pour sa victoire à #Kazan2015,2015-08-04 18:28:17,628633570337247232
jcgaudin,RT @FFNatation: #Natation : Nouvelle médaille pour la France ! @Cam_Lacourt  décroche l'argent sur 100m dos en 52.48 #Kazan2015 http://t.co…,2015-08-04 18:27:27,628633363264499712
jcgaudin,Bravo à @romainbarnierTM leur entraineur qui a rendu cela possible ainsi qu'à Paul Leccia @CNMarseille #Manaudou #Gilot #Metella #Kazan2015,2015-08-02 17:01:17,627886899454193665
jcgaudin,Vous avez définitivement fait rentrer le relais français dans la légende! Marseille est fière de vous! #Kazan2015 #Manaudou #Gilot #Metella,2015-08-02 16:59:18,627886402458533892
jcgaudin,"Bravo à @FlorentManaudou​, Mehdy Metella​ et Fabien Gilot​ du @CNMarseille #Kazan2015",2015-08-02 16:57:17,627885895425896448
jcgaudin,Je me réjouis que le ministre de l'Intérieur vienne saluer leur travail et leur exprimer la reconnaissance de notre pays tout entier,2015-07-27 09:33:03,625599773144391680
jcgaudin,"je tiens à féliciter tous les enquêteurs qui ont contribué à ce succès, dans une lutte sans cesse renouvelée contre le trafic de drogue",2015-07-27 09:31:12,625599305794109440
jcgaudin,La saisie de 6 tonnes de drogue aux portes même de Marseille est une formidable victoire de la police contre le trafiquants,2015-07-27 09:29:11,625598800422375424
jcgaudin,RT @gobrep: El Presidente @EPN recibió la Gran Medalla de la Cd. de #Marsella #MéxicoEnFrancia http://t.co/HgQHkBWrjv @jcgaudin http://t.co…,2015-07-21 00:21:04,623286532594601984
jcgaudin,Je souhaite à cette nageuse de l'équipe de France de Natation et du Club des Nageurs de Marseille un prompt rétablissement. #melaniehenique,2015-07-06 11:20:18,618016617138659332
jcgaudin,Les auteurs de l'odieuse agression homophobe que Mélanie Hénique a subie à Amiens doivent être sévèrement punis par la Justice.,2015-07-06 11:19:23,618016388372893697
jcgaudin,Je tiens à apporter à @MelanieHenique tout mon soutien et celui des Marseillais dans l'épreuve qu'elle traverse,2015-07-06 11:18:05,618016061330432000
jcgaudin,"C.Pasqua fut un véritable ami, la France perd aujourd'hui un de ses grands serviteurs, un homme d'état ! http://t.co/P11fzqR1ej",2015-06-29 21:21:07,615631105102868480
jcgaudin,"A sa famille et à ses proches, j'adresse mes plus sincères condoléances et toute mes pensées les plus chaleureuses. #Pasqua",2015-06-29 21:03:41,615626714824224772
jcgaudin,La lutte résolue et déterminée que C.Pasqua a menée contre le terrorisme trouve une résonance particulière au regard de l'actualité récente,2015-06-29 21:03:12,615626594464497664
jcgaudin,"Nos routes se sont souvent croisées à Marseille, ville avec laquelle il avait tissé des liens qui ne se sont jamais distendus. #Pasqua",2015-06-29 20:59:14,615625596723404800
jcgaudin,"Au-delà de la truculence et du verbe, je retiens d'abord le parcours d'un homme déterminé à combattre pour les valeurs de la République.",2015-06-29 20:58:29,615625406394273792
jcgaudin,"Charles Pasqua fut un immense résistant, l'un de ceux qui honoraient encore la mémoire de l'homme du 18 juin.",2015-06-29 20:56:57,615625019478155264
jcgaudin,"C'est avec une très vive émotion que j'apprends ce soir le décès de Charles Pasqua.
Gaulliste historique! #Pasqua",2015-06-29 20:56:26,615624890666848257
jcgaudin,Toutes mes pensées vont aux familles et proches des victimes de ces deux actes barbares qui ont frappé l'Isère et la ville de Sousse.,2015-06-26 22:03:26,614554590185328640
jcgaudin,Marseille doit plus que jamais montrer l'exemple d'une ville fraternelle où la cohésion entre les communautés reste un exemple de tolérance,2015-06-26 22:02:37,614554384341577728
jcgaudin,"La France vit une année particulièrement douloureuse malgré des mesures de l'état pour lutter contre les djihadistes, tout comme la Tunisie",2015-06-26 22:01:36,614554127293677569
jcgaudin,"La France et la Tunisie sont, aujourd'hui, unies dans un même combat : la lutte contre le terrorisme",2015-06-26 21:59:28,614553590196273152
jcgaudin,RT @cestrosi: Je suis ce matin au #MedCop21 en tant que Président du réseau EuroMed  avec @jcgaudin @Vauzelle et @fhollande http://t.co/jlo…,2015-06-07 14:32:16,607555678031515648
jcgaudin,RT @UMPActus: Le Sud est bien représenté : Jean-Claude Gaudin (Marseille) et Hubert Falco (Toulon) sont là ! #Congres30mai @jcgaudin @huber…,2015-05-30 10:19:16,604592905873989632
jcgaudin,RT @cestrosi: Avec @ECiotti @jcgaudin @hubertfalco @RenaudMuselier @JulienAubert84 ns allons tt mettre en oeuvre pr mettre fin 17 ans de so…,2015-05-30 10:19:09,604592875658166272
jcgaudin,La Métropole avance !,2015-05-30 10:01:45,604588497140346880
jcgaudin,"A la demande des maires, j'ai encore fait adopter 2 amendements cette nuit au Sénat pour le bon fonctionnement des Conseils de Territoires",2015-05-30 10:01:17,604588383332147200
jcgaudin,"Le projet Valls est un remake des promesses non tenues de Monsieur Ayrault. 
Tout était déjà dans les contrats de plan.",2015-05-29 10:41:57,604236226858741760
jcgaudin,"Les Socialistes ne changent pas !
Les mesures du Premier Ministre c'est beaucoup d'annonces et pas d'avancées. Le compte n'y est pas !",2015-05-29 10:41:34,604236130641399809
jcgaudin,"Retrouvez mon interview au magazine Ecorama du 27 mai, présenté par David Jacquot http://t.co/fGO1znEkZO",2015-05-28 14:49:41,603936183182327808
jcgaudin,RT @UDG2015: Beaucoup de monde ce soir pour les remerciements de campagne @MartineVassal @jcgaudin @guyteissier @cestrosi @ump http://t.co/…,2015-05-27 21:43:33,603677949435449344
jcgaudin,"En tant qu'actionnaire, l'Etat doit à tout prix empêcher le démantèlement annoncé des bases de province! @AirFranceFR #AirFrance",2015-05-26 17:21:42,603249662955520000
jcgaudin,La décision de la direction de @AirFranceFR de fermer trois de ses bases de province et notamment à Marseille est inacceptable! #AirFrance,2015-05-26 17:19:00,603248984661041152
jcgaudin,Le but refusé à l'@OM_Officiel lors du match contre Lyon prive Marseille d'une troisième place méritée ! #Ligue1,2015-05-23 20:50:52,602215140919025664
jcgaudin,Toutes mes pensées vont vers les familles de ces jeunes gens à qui je présente mes condoléances au nom de tous les Marseillais,2015-05-17 16:21:53,599973118233436160
jcgaudin,"Je tenais à rectifier les choses au sujet de @RobertChardon , j'apporte tout mon soutien à Patricia Saez Première Adjointe de #venelles",2015-05-15 12:51:49,599195480313167872
jcgaudin,Le Maire de Venelles @RobertChardon n'a plus sa place à l'UMP,2015-05-15 11:16:23,599171463585763330
jcgaudin,L'état de santé de @RobertChardon n'excuse pas des propos inacceptables qui ne correspondent pas aux valeurs de notre formation politique.,2015-05-15 11:10:47,599170054601756672
jcgaudin,.@Cl_Perrier http://t.co/GjZRzAnZmk Méconnaissance de l'histoire politique Marseillaise? Car je n'étais pas candidat aux régionales de 1998,2015-05-14 08:38:47,598769413928652800
jcgaudin,@Cl_Perrier http://t.co/GjZRzAnZmk Méconnaissance de l'histoire politique marseillaise? Car je n'étais pas candidat aux régionales de 1998!,2015-05-14 08:34:51,598768423091478528
jcgaudin,Retrouvez mon interview sur le site de LCI/TF1 http://t.co/JYbuKg8xq6 #Regionales2015 #FN,2015-04-29 17:50:11,593472359606185984
jcgaudin,Bravo pour vos propos sur la métropole ! @chauvinjl,2015-04-26 17:45:44,592384074796441601
jcgaudin,Bravo cher @cestrosi tu as été impeccable dans le 12-13 aujourd'hui. JCG,2015-04-26 17:44:20,592383723359830016
jcgaudin,Bravo cher @ECiotti tu as fait la démonstration de ta dimension la plus grande dans #cpolitique,2015-04-26 17:42:24,592383237470744576
jcgaudin,Ce combat pour la reconnaissance du génocide je le poursuivrai et les Arméniens me trouveront toujours à leurs côtés.,2015-04-24 15:50:12,591630226792308736
jcgaudin,"Je suis fier d’avoir remporté en 2001, avec Roland Blum, cette bataille pour la reconnaissance du génocide Arménien par la France.",2015-04-24 15:49:42,591630101877551104
jcgaudin,Marseille était une terre d’accueil et de refuge pour les Arméniens qui ont su y trouver leur place malgré la douleur de l’exil,2015-04-24 15:47:21,591629508140212225
jcgaudin,«S'ils se taisent les pierres crieront» Ce verset inscrit au centre culturel de la cathédrale arménienne illustre ce combat pour la mémoire,2015-04-24 15:45:59,591629163490123776
jcgaudin,"La reconnaissance de l'extermination méthodique des Arméniens est loin d’être achevée à l’échelle internationale, mais elle progresse.",2015-04-24 15:37:27,591627019047297024
jcgaudin,"Depuis 1915, depuis ce génocide, les Arméniens portent la souffrance profonde de ce crime contre l’Humanité.",2015-04-24 15:35:31,591626532377989122
jcgaudin,"Un million et demi de citoyens arméniens de l’Empire Ottoman ont été massacrés, torturés, affamés, spoliés, contraints à un exil forcé",2015-04-24 15:35:17,591626470675636224
jcgaudin,C’est un anniversaire bouleversant que nous commémorons aujourd’hui avec l’ensemble de la communauté arménienne marseillaise,2015-04-24 15:33:26,591626006584229888
jcgaudin,RT @JmBoutin: Pensée amicale en direct de #Marseille pour son maire @jcgaudin tellement dévoué à sa ville et ses habitants. Bravo ! http://…,2015-04-15 18:44:07,588412504142966784
jcgaudin,Je tiens à saluer les propos du Pape François qui a officiellement reconnu le génocide arménien. #ArmenianGenocide,2015-04-12 19:23:14,587335183596183553
jcgaudin,Je me réjouis pour @MartineVassal  Je lui adresse mes plus sincères félicitations pour son élection à la Présidence du CG13,2015-04-03 09:07:36,583918763130642433
jcgaudin,C'est un bonheur pour moi de voir une nouvelle génération de femmes et d'hommes engagés à mes côtés accéder à des responsabilités majeures.,2015-04-03 09:06:43,583918541423910912
jcgaudin,"A sa jeune femme, ses enfants, ses nombreux amis ici et ailleurs, j'adresse mes plus sincères condoléances. #salimhatubou",2015-04-01 18:07:51,583329946225000448
jcgaudin,C'est avez une vive émotion que j'ai appris la disparition brutale de l'auteur et conteur marseillais Salim HATUBOU,2015-04-01 18:05:30,583329356329684992
jcgaudin,La politique du gouvernement ne doit pas dégrader l'APHM et la qualité du service qu'il propose aux Marseillais et aux Provençaux,2015-03-31 09:55:00,582843529384337408
jcgaudin,j'ai demandé à @MarisolTouraine que Marseille bénéficie du même traitement que les deux autres grands CHU nationaux à Paris et à Lyon,2015-03-31 09:49:57,582842256077549569
jcgaudin,Le départ du directeur de l'APHM est la conséquence directe du plan de réforme drastique de l'Agence Régionale de Santé rejeté par tous,2015-03-31 09:48:04,582841781412331520
jcgaudin,Au plan national la victoire de notre famille politique est tout aussi puissante #departementales2015,2015-03-29 21:57:11,582300495747891200
jcgaudin,Ce succès est doublement historique. Il met fin à plus de 70 ans d’une gestion socialiste sans partage #departementales2015,2015-03-29 21:56:31,582300328231624704
jcgaudin,Unis autour de @MartineVassal nos élus incarnent l’espoir d’une politique courageuse qui rendra aux BdR un rayonnement digne de ses atouts,2015-03-29 20:49:19,582283418622402560
jcgaudin,"En nous donnant la victoire dans 16 cantons, nos concitoyens ont confirmé, la confiance qu’ils nous avaient accordée lors des municipales",2015-03-29 20:42:12,582281624353705986
jcgaudin,Je suis heureux et fier de notre victoire dans les Bouches-du-Rhône,2015-03-29 20:40:38,582281232580526081
jcgaudin,Nous avons envoyé ds marins-pompiers et 3 véhicules dont des moyens spécifiques de désincarcération en direction du lieu du crash #Airbus320,2015-03-24 15:44:07,580394669789605888
jcgaudin,Je suis consterné par cette tragédie qui endeuille toute notre région #crashA320,2015-03-24 15:42:59,580394385944248320
jcgaudin,Retrouvez ma réaction complète sur la réquisition des agents municipaux pour la grève dans les cantines scolaires http://t.co/Fb9uzRBmlm,2015-03-24 09:26:20,580299598725550080
jcgaudin,J'ai décidé de réquisitionner le personnel nécessaire au rétablissement du service public dans les écoles à Marseille,2015-03-24 09:07:49,580294939189338112
jcgaudin,Le mouvement de grève dans les écoles à Marseille qui se généralise est source de difficultés majeures pour de nombreuses familles,2015-03-24 09:04:47,580294176719409152
jcgaudin,L’alternance est enfin en marche dans les BdR J’appelle tous nos concitoyens à traduire cette chance historique dimanche prochain en réalité,2015-03-22 22:25:01,579770784102645760
jcgaudin,La politique du FN ne pourrait qu’aggraver une situation que la gestion socialiste a terriblement et durablement endommagée,2015-03-22 22:23:12,579770327858851840
jcgaudin,La politique du FN s’inscrirait en pire dans le droit fil de celle menée par la gauche à qui il doit d’avoir un maire de secteur à Marseille,2015-03-22 22:22:34,579770167271526400
jcgaudin,Comme l'a dit @NicolasSarkozy ds ls cantons où notre candidat ne sera pas présent nous n’appellerons à voter ni pour la gauche ni pour le FN,2015-03-22 22:20:59,579769770712633345
jcgaudin,J'invite les Marseillais à se rassembler encore plus largement autour des candidats de l’UMP de l’UDI et du MODEM au 2ème tour,2015-03-22 22:17:57,579769008339185664
jcgaudin,Le FN sera présent dans les 29 cantons des Bouches-du-Rhône lors du second tour de dimanche prochain,2015-03-22 22:16:33,579768653983383552
jcgaudin,"Sii les électeurs se sont heureusement rendus plus nombreux aux urnes qu’on ne l’annonçait, le Front National atteint des scores importants",2015-03-22 22:15:50,579768473926127616
jcgaudin,1 an après notre succès aux municipales nos concitoyens ont réaffirmé avec force leur confiance aux candidats de notre famille politique,2015-03-22 22:14:53,579768235383517184
jcgaudin,À Marseille et dans les BdR la sanction est plus dure encore pour l’ensemble de la gauche et pour les faux frères ennemis du PS en 1er lieu,2015-03-22 22:12:49,579767713050021888
jcgaudin,Je me réjouis que les électeurs aient clairement choisi l’UMP avec nos amis UDI et MODEM pour incarner la perspective de l’alternance,2015-03-22 22:11:28,579767375177900034
jcgaudin,Les Français ont sévèrement sanctionné la politique de François HOLLANDE et du gouvernement socialiste qui fait du mal à la France.,2015-03-22 22:09:28,579766873337831424
jcgaudin,Les Marseillais apprécient la piétonisation du Vieux-Port. Il n'est pas question d'y revenir!,2015-03-20 18:09:28,578981699381518336
jcgaudin,Je le répète aujourd'hui : Nous ne voulons pas de l'entrée de la Turquie dans l'Europe ! #ArmenianGenocide,2015-03-19 18:24:49,578623171571654656
jcgaudin,"Inauguration de l'exposition """"""""100 portraits de l'exil"""""""", événement de l'année du centenaire du génocide arménien http://t.co/CA8tCaq1NP",2015-03-19 18:14:54,578620678817112065
jcgaudin,Je m'associe à la douleur de la #Tunisie. Au nom de tous les Marseillais je présente mes condoléances aux familles et proches des victimes,2015-03-18 18:33:36,578262997250023424
jcgaudin,"Là-bas, ici, partout, il ne faut pas laisser les forces occultes de la barbarie gagner du terrain.  #Tunisie",2015-03-18 18:25:54,578261059821289473
jcgaudin,"En s'attaquant au Parlement et au musée du Bardo, c'est la démocratie qui vient de s'exprimer ds ls urnes en Tunisie qu'on a voulu atteindre",2015-03-18 18:25:02,578260841344151552
jcgaudin,"La #Tunisie est frappée de plein fouet par le terrorisme. Une fois encore, ce sont des innocents qui en sont les victimes",2015-03-18 18:23:08,578260362358861826
jcgaudin,Le double langage des socialistes n'aura qu'un effet : celui de faire monter le Front National qui pourra remercier le PS au soir du 29 mars,2015-03-16 18:06:10,577531315832156160
jcgaudin,.@jccambadelis Vous prétendez vouloir chasser Guérini alors que le PS n'a pas été capable de trouver ds candidats à présenter face à lui 2/3,2015-03-16 18:05:35,577531169731907585
jcgaudin,.@jccambadelis La majorité des candidats socialistes aux élections départementales ont presque tous la double investiture PS/Force13   1/3,2015-03-16 18:00:41,577529938267475968
jcgaudin,Mes pensées vont vers les familles des dix victimes de ce drame et leurs proches à qui j’adresse mes plus sincères condoléances,2015-03-10 09:37:20,575228937636343808
jcgaudin,Je suis consterné aussi par la mort de Camille Muffat et Alexis Vastine. Tous laisseront un grand vide dans le monde sportif français.,2015-03-10 09:36:48,575228802252566528
jcgaudin,"C’est avec une profonde tristesse que j’apprends la mort de Florence Arthaud, grande navigatrice et Marseillaise d’adoption.",2015-03-10 09:33:57,575228083743100929
jcgaudin,RT @AOhanessian: @NicolasSarkozy #Marseille pour soutenir @MartineVassal avec @jcgaudin  @brunogilles13 #electionsdepartementales2015 http:…,2015-03-05 20:51:35,573586676640972800
jcgaudin,Un an après les municipales alors que le chômage et les déficits continuent d'augmenter le gouvernement reste sans réponse #NSMarseille,2015-03-05 17:44:34,573539615539359745
jcgaudin,Nous devons mettre fin à plus de 70 ans de clientélisme de la gauche au conseil général ! #NSMarseille,2015-03-05 17:42:59,573539215335624704
jcgaudin,Il y a un an le gouvernement soutenait sans retenue le candidat socialiste #NSMarseille,2015-03-05 17:37:08,573537744208687105
jcgaudin,Il y a un an à Marseille on ne donnait pas cher de nos chances #NSMarseille,2015-03-05 17:36:18,573537534531276800
jcgaudin,RT @NicolasSarkozy: Très heureux de retrouver mon cher ami @jcgaudin ! #NSMarseille http://t.co/WENkQSwVai,2015-03-05 17:23:17,573534257622224896
jcgaudin,"Je suis très heureux d'accueillir @NicolasSarkozy au parc Chanot, venu soutenir nos candidats aux prochaines élections départementales",2015-03-05 17:22:45,573534124322996226
jcgaudin,Je suis très heureux du rétablissement de l'amendement Gaudin sur les PLUi de la #Métropole Aix Marseille Provence,2015-03-03 15:56:56,572787753177501696
jcgaudin,"RT @sudradio: Présidentielles : """"""""Je soutiendrai le candidat qui aura le plus de chances de regagner l'Elysée"""""""" #BrunchPolitique @jcgaudin @L…",2015-02-15 21:55:47,567079852785029120
jcgaudin,"RT @sudradio: """"""""Que certains politiques pensent au peuple et pas à leur carrière ! Un peu de modestie !"""""""" #BrunchPolitique @jcgaudin @Louis_M…",2015-02-15 21:55:43,567079837312253952
jcgaudin,"RT @sudradio: Herzallah et Gallo passant au FN : """"""""Ça ne compte pas, c'est rien du tout, ce sont des inconnus"""""""" #BrunchPolitique @jcgaudin @L…",2015-02-15 21:55:07,567079687089033217
jcgaudin,"RT @sudradio: """"""""Je souhaite bien sûr la vicroire de la droite républicaine et du centre dans les Bouches du Rhône"""""""" #BrunchPolitique @jcgaudi…",2015-02-15 21:55:01,567079662288117762
jcgaudin,"RT @sudradio: Loi Macron : """"""""Elle ne répond pas à l'urgence de la situation et aux problématiques de notre pays, comme l'emploi"""""""" @jcgaudin @…",2015-02-15 21:54:57,567079643178881024
jcgaudin,"RT @sudradio: """"""""Je ne suis pas pr mettre la Russie à l'écart, condamner Poutine. Il ne faut pas en faire un ennemi"""""""" #BrunchPolitique @jcgaud…",2015-02-15 21:54:43,567079585838555136
jcgaudin,"RT @sudradio: Ukraine : """"""""L'accord de Minsk ne garantit pas un succès durable, attendons de voir s'il est respecté"""""""" #BrunchPolitique @jcgaud…",2015-02-15 21:54:40,567079570965544960
jcgaudin,"RT @sudradio: Dette : """"""""Je pense qu'on peut très bien étaler, échelonner mais il faut que la Grèce paie"""""""" #BrunchPolitique @jcgaudin @Louis_M…",2015-02-15 21:54:35,567079550337961984
jcgaudin,"RT @sudradio: Apartheid : """"""""C'est un mot que je récuse, il ne peut pas s'appliquer dans la République française"""""""" #BrunchPolitique @jcgaudin …",2015-02-15 21:54:23,567079500262150144
jcgaudin,"RT @sudradio: """"""""Il faut qu'on consacre à son pays quelques mois [...] mais le coût est important"""""""" #BrunchPolitique @jcgaudin @Louis_Morin",2015-02-15 21:54:18,567079481199054848
jcgaudin,"RT @sudradio: """"""""Je pense qu'on a eu tort de supprimer le service militaire, j'ai moi-même fait 28 mois"""""""" #BrunchPolitique @jcgaudin @Louis_Mo…",2015-02-15 21:54:09,567079443081228289
jcgaudin,"RT @sudradio: Incidents Charlie : """"""""C'est regrettable, devant le drame que la France a subi, il fallait une adhésion totale"""""""" @jcgaudin @Loui…",2015-02-15 21:53:54,567079377247408128
jcgaudin,"RT @sudradio: """"""""Cmt voulez-vous que je trouve des animateurs qui travaillent au lance-pierres et sont mal reçus ?"""""""" #BrunchPolitique @jcgaudi…",2015-02-15 21:53:42,567079330984251393
