screenName,text,created,id
jcgaudin,"RT @itele: .@jcgaudin """"""""faire reculer le chômage et créer des emplois, voilà ce que j'ai toujours fait dans ma ville"""""""" #Marseille2014",2014-03-17 22:05:32,445682372487700480
jcgaudin,"RT @itele: .@jcgaudin """"""""nous avons fait reculer le chômage, voilà ce qu'il faudrait me dire au lieu de me dire des choses désagréables"""""""" #Mar…",2014-03-17 22:05:29,445682359359524864
jcgaudin,"RT @itele: .@jcgaudin """"""""nous avons renouvelé entièrement notre liste, la dame ministre est totalement inconnue"""""""" #Marseille2014 http://t.co/C…",2014-03-17 22:05:22,445682331295440896
jcgaudin,"RT @itele: .@jcgaudin """"""""ce qui est détestable c'est que le Président de la République se soit occupé de faire la liste de M. Mennucci"""""""" #Mars…",2014-03-17 22:05:18,445682311246651392
jcgaudin,"RT @itele: .@jcgaudin sur une victoire de l'#UMP à Marseille """"""""je suis tout à fait serein, rassuré, déterminé"""""""" #Marseille2014",2014-03-17 22:05:12,445682288899391488
jcgaudin,je serai ce soir à 19h30 le rédacteur en chef du journal sur @LCMTELE,2014-03-17 13:48:18,445557239655706624
jcgaudin,Nous présenterons demain notre projet pour le sport à Marseille http://t.co/K7ZTCzjrXo,2014-03-17 10:09:47,445502241806364672
jcgaudin,RT @JBHAUTON: Au Vallon des Auffes avec @jcgaudin @Dominique_TIAN @JeanRoatta pour un réunion #marseilleenavant http://t.co/b1cHWPfd9e,2014-03-16 12:34:46,445176345501237249
jcgaudin,RT @Marseillenavant: Visite au Vallon des Auffes avec @Dominique_TIAN  Merci à Ora-Ïto d'être venu saluer @jcgaudin en ce dimanche matin,2014-03-16 12:34:06,445176179243642880
jcgaudin,Coup d'envoi d'un match au stade Hubert moruzzo avec @guyteissier #jcgaudin2014 http://t.co/Xh2u7doBgm,2014-03-15 14:28:11,444842501476999168
jcgaudin,Ceux qui vont voter Front National vont voter par ricochet Patrick Mennucci,2014-03-15 12:07:56,444807206387863552
jcgaudin,Pas de tramway jusqu'aux Catalans à cause de @patrickmennucci qui s'y est opposé. C'est M. Niet. Il dit non à tout,2014-03-15 12:00:16,444805275447721984
jcgaudin,"Partie 3/3 de l'émission """"""""Tapie se met à table avec..."""""""" http://t.co/toptNS7Sa7",2014-03-14 19:55:42,444562533228482560
jcgaudin,"Partie 2/3 de l'émission """"""""Tapie se met à table avec..."""""""" http://t.co/2gASo0LxXb",2014-03-14 19:55:00,444562359466856448
jcgaudin,"Partie 1/3 de l'émission """"""""Tapie se met à table avec ..."""""""" http://t.co/78HMLXd4tj",2014-03-14 19:46:53,444560316748558337
jcgaudin,"À partir de 20h45 je serai l'invité de Bernard Tapie pour son émission """"""""Tapie se met à table avec ..."""""""" sur internet http://t.co/OZ1n8SLchP",2014-03-14 19:22:28,444554169928929280
jcgaudin,Notre projet pour améliorer la sécurité et la tranquillité publique des Marseillais http://t.co/Th3BRuh0vR,2014-03-14 10:23:00,444418410320244736
jcgaudin,RT @Marseillenavant: Une police municipale présente sur le terrain 24/24 7/7,2014-03-14 10:09:17,444414957598539776
jcgaudin,RT @Marseillenavant: Plus de 1000 caméras de vidéosurveillance en projet pour la fin 2014,2014-03-14 10:09:14,444414947431579648
jcgaudin,Nous présenterons demain notre programme pour la sécurité des Marseillais et la tranquillité publique http://t.co/ZYGQrJGHny,2014-03-13 15:04:35,444126886369964032
jcgaudin,Mon interview de ce matin à France Info (via @franceinfo)  http://t.co/xPPiRI0jfB #jcgaudin2014,2014-03-12 09:56:58,443687083270750208
jcgaudin,"Je serai demain à 8h15 l'invité de Jean Leymarie pour son émission """"""""La Matinale"""""""" sur @franceinfo",2014-03-11 19:49:44,443473868037300225
jcgaudin,Pour un réseau de transports en commun étendu à toute la ville. ##jcgaudin2014 @guyteissier http://t.co/xY0kRuncqd,2014-03-11 10:33:17,443333836269944833
jcgaudin,Notre projet de prolongement des transports en commun pour Marseille #jcgaudin2014 @guyteissier http://t.co/y2YaGpgy4H,2014-03-11 10:31:53,443333480739782657
jcgaudin,Une liaison ferrée au départ du centre de Marseille vers l'aéroport. http://t.co/VIxy0T0mQG,2014-03-11 10:30:39,443333173116936193
jcgaudin,Prolongement du métro vers le Nord déjà à l'étude ainsi que vers Saint Loup Bonneveine et la Vieille Chapelle.,2014-03-11 10:28:55,443332736875773952
jcgaudin,Dromel sera une gare de connexion métro tramway avec un parking relais en silo.,2014-03-11 10:25:54,443331976020639744
jcgaudin,Notre première priorité le prolongement Nord Sud du tramway vers Capitaine Gèze et Saint Louis d'un côté Dromel et la Rouvière de l'autre,2014-03-11 10:23:57,443331485190594560
jcgaudin,2008-2014: mandat perdu pour les transports faute au président socialiste de la CUM @CaselliEugene qui n'a pas eu de politique alternative,2014-03-11 10:22:02,443331001654468608
jcgaudin,Je présenterai demain nos propositions sur les transports pour les Marseillais avec @guyteissier http://t.co/Oks9hMt7hX,2014-03-10 19:20:17,443104071839657984
jcgaudin,Nous ne sommes pas dans l'idéologie contrairement à mon adversaire. Nous sommes dans le pragmatisme pour les Marseillais,2014-03-10 19:17:20,443103326356639744
jcgaudin,Marseille ne sera pas la bouée de sauvetage du Radeau de la Méduse gouvernemental,2014-03-10 19:09:46,443101421874212864
jcgaudin,Le candidat socialiste s'appuie sur le FN dont il attise les braises et sur l'appareil de l'Etat.,2014-03-10 19:09:33,443101367339843584
jcgaudin,Grâce à vous les changements que nous avons initiés vont continuer !,2014-03-10 19:03:43,443099902902800385
jcgaudin,Nous voyons bien que les Marseillais n'ont pas envie de donner les clés de la ville au candidat du gouvernement @patrickmennucci,2014-03-10 18:59:13,443098770331672576
jcgaudin,Projet pour les voies de circulation #JCGAUDIN2014 http://t.co/DT1APCYN75,2014-03-10 14:14:26,443027099587461120
jcgaudin,Notre projet pour les infrastructures de voirie et la circulation à Marseille. #JCGAUDIN2014 #L2 http://t.co/2Iqy4a9TRZ,2014-03-10 14:13:21,443026826487926784
jcgaudin,Visite du Stade Vélodrome spéciale #journeedelafemme avec plus 200 Marseillaises #JCGAUDIN2014 http://t.co/L2ZgaF8snW,2014-03-08 10:43:50,442249326904238080
jcgaudin,Rencontre avec les commerçants du Centre Bourse http://t.co/P7dEEfSqTz,2014-03-07 14:37:13,441945670556340224
jcgaudin,Rencontre ce soir avec la communauté Arménienne de Marseille #JCGAUDIN2014 http://t.co/liQzrZV6sC,2014-03-06 19:40:54,441659708559327232
jcgaudin,Rencontre avec les habitants du quartier de Belsunce aux côtés de @Dominique_TIAN #JCGAUDIN2014 http://t.co/vjxGpVsLkH,2014-03-06 17:10:53,441621952487514113
jcgaudin,Signature cet après-midi du pacte Handicap 2014 de l'APAJH. Pour mettre le handicap au cœur des projets municipaux http://t.co/n1uAfiKodu,2014-03-06 15:08:26,441591139913990144
jcgaudin,"Notre projet pour l'éducation, l'école et la petite enfance #jcgaudin2014 http://t.co/mlOkcWWPaJ",2014-03-06 09:26:10,441505005577568258
jcgaudin,"Augmentation des dépenses d'investissement entre 2008 et 2012: ville  +20%, communauté urbaine socialiste -40% #jcgaudin2014",2014-03-05 19:05:17,441288355855470592
jcgaudin,"Augmentation des dépenses de fonctionnement entre 2008 et 2012: ville  +5%, communauté urbaine socialiste +20% #jcgaudin2014",2014-03-05 19:04:44,441288219104395264
jcgaudin,RT @jenny_gallego2B: @jcgaudin : #menucci est comme un amoureux transi qui voudrait séduire sa belle en lui disant qu'elle est moche!,2014-03-05 18:53:22,441285356429004800
jcgaudin,"RT @newgenmarseille: “@ClementAouiz: .@jcgaudin :""""""""je n'entend pas bcp dans les médias les propositions de notre programme @Marseillenavant …",2014-03-05 18:53:05,441285283758481408
jcgaudin,"Eugène Caselli tête de liste 2/3 disait de @patrickmennucci il y a quelques semaines """"""""Jamais il ne sera Maire de Marseille"""""""" @CaselliEugene",2014-03-05 18:49:11,441284302371061760
jcgaudin,Le projet de grande Arena pour la programmation de grands événements http://t.co/eX1DLFeAfM,2014-03-05 13:50:12,441209062722506752
jcgaudin,"Le projet de """"""""Futuroscope de la Mer"""""""" (aquarium et parc d’attractions aquatiques) http://t.co/ckwQhP6C3y",2014-03-05 13:44:42,441207679759810561
jcgaudin,"Les esquisses de notre projet de """"""""Promenade des Passerelles"""""""" http://t.co/tMuuZZJQbF",2014-03-05 13:40:51,441206709986394112
jcgaudin,Notre programme pour accroître l'attractivité touristique de Marseille  #jcgaudin2014 #tourisme #marseille http://t.co/Rn7brJfSib,2014-03-05 10:59:59,441166224060207106
jcgaudin,Présentation de notre programme pour augmenter l'attractivité touristique de Marseille #jcgaudin2014 http://t.co/o1WfWeB7gz,2014-03-05 10:08:09,441153182539190272
jcgaudin,RT @Marseillenavant: .@jcgaudin présentera demain à 11h son projet touristique pour Marseille #jcgaudin2014 #tourisme #Marseille http://t.c…,2014-03-05 09:55:18,441149948034572288
jcgaudin,"Ma vision pour Marseille, capitale de la Méditerranée http://t.co/B9ScCLSfnL @LeHuffPostBlog #jcgaudin2014",2014-03-04 09:35:38,440782612362432512
jcgaudin,Présentation ce matin des listes de @Marseillenavant http://t.co/RBbBzAdoSt,2014-03-03 22:06:54,440609285912137728
jcgaudin,Réunis tous ensemble autour de Rose Sugello pour la remise de sa légion d'honneur http://t.co/obEDjIE5o5,2014-02-28 18:14:44,439463693412495362
jcgaudin,"Merci à Jean-Pierre Foucault pour son soutien, ses encouragements et surtout son amitié",2014-02-28 17:51:33,439457863195688960
jcgaudin,"Je serai demain à 11h30 l'invité de l'émission """"""""La voix est libre"""""""" sur France 3 Méditerranée http://t.co/UJAeZnk6zK",2014-02-28 14:34:18,439408222462423040
jcgaudin,À la rencontre des Marseillais sur le marché du Prado http://t.co/P8FSJahrKv,2014-02-28 10:02:02,439339702223900672
jcgaudin,"Il a des manières à la limite de la courtoise, il agit de façon bruyante et désordonnée et essaie d'humilier et de diminuer ses adversaires",2014-02-27 15:10:21,439054905102569472
jcgaudin,"Patrick Mennucci ne peut pas s’empêcher d'avoir les caractéristiques du PS d'il y a 50 ans : pressions, menaces ...",2014-02-27 15:09:20,439054651561107456
jcgaudin,"Jean-Claude Gaudin : """"""""Menucci menace, à la limite de la délicatesse et de la courtoisie"""""""" par @KTOTV - http://t.co/4ecxdNpC4a #jcgaudin2014",2014-02-27 15:05:29,439053682445795329
jcgaudin,"Jean-Claude Gaudin : « Un maire doit être consensuel, il doit rassembler » par @KTOTV - http://t.co/iD1RUEnEEE #jcgaudin2014",2014-02-27 15:01:24,439052653041946624
jcgaudin,« Je suis démocrate-chrétien » par @KTOTV - http://t.co/CStQ6s46hV #jcgaudin2014,2014-02-27 14:58:14,439051855549562881
jcgaudin,Accueil aujourd'hui des 100 nouveaux policiers municipaux http://t.co/ACGsElZPlC,2014-02-27 14:09:40,439039632463126528
jcgaudin,"Retrouvez mon passage dans le """"""""Face à Face"""""""" de Ruth Elkrief  http://t.co/2RrbaXpAf8 #jcgaudin2014",2014-02-27 11:29:56,438999435259817984
jcgaudin,@19HRuthElkrief @ruthelkrief @BFMTV compte twitter de jcgaudin : @jcgaudin,2014-02-26 18:52:13,438748354047385601
jcgaudin,"Hollande est le directeur de campagne de M. Mennucci, c'est lui qui s'occupe de la constitution de ses listes. #jcgaudin2014",2014-02-26 18:38:21,438744863379820544
jcgaudin,"Augmentation des dépenses d'investissement entre 2008 et 2012: ville  +20%, communauté urbaine socialiste -40% #jcgaudin2014",2014-02-26 18:36:53,438744495493234691
jcgaudin,"Augmentation des dépenses de fonctionnement entre 2008 et 2012: ville  +5%, communauté urbaine socialiste +20% #jcgaudin2014",2014-02-26 18:36:15,438744334264184832
jcgaudin,"Aux électeurs du FN dont l'exaspération envers le gouvernement est forte je dis """"""""Si vous votez FN vous votez @patrickmennucci"""""""" #jcgaudin2014",2014-02-26 18:24:38,438741410041577473
jcgaudin,Je ne suis pas dans l'idéologie. Je suis dans le pragmatisme. #jcgaudin2014,2014-02-26 18:20:34,438740388648857600
jcgaudin,Nous préparons les perspectives d'avenir pour Marseille en 2020 #jcgaudin2014,2014-02-26 18:14:19,438738815738720257
jcgaudin,RT @19HRuthElkrief: Spéciale #Marseille : JC Gaudin et @patrickmennucci au micro de @ruthelkrief de 19h à 20h @BFMTV http://t.co/ys7DbASutG,2014-02-26 18:12:18,438738307590389760
jcgaudin,"Je serai Jeudi 27 février à 11h00 l'invité de l'émission """"""""Face aux chrétiens"""""""" sur la chaîne @KTOTV et sur Radio Notre-Dame #jcgaudin2014",2014-02-26 10:00:41,438614589081939968
jcgaudin,"Je serai Mercredi 26 février à 19h00 l'invité de l'émission """"""""Face à Face"""""""" de Ruth Elkrief sur la chaîne @BFMTV #jcgaudin2014",2014-02-25 16:02:11,438343176236314624
jcgaudin,Mon chat sur le journal 20minutes http://t.co/nhgQnV1Nnq,2014-02-25 13:58:17,438311994928939008
jcgaudin,"RT @itele: .@jcgaudin : """"""""c'est véritablement scandaleux que le Président de la République s'occupe de faire la liste du socialiste à #Marse…",2014-02-25 10:40:58,438262337435607040
jcgaudin,"RT @itele: .@jcgaudin sur Nicolas #Sarkozy : """"""""vous n'avez jamais été tendres avec le Sarko !"""""""" #TeamToussaint",2014-02-25 10:40:53,438262315662979073
jcgaudin,"RT @itele: .@jcgaudin : """"""""les deux reproches qui sont faits à #Marseille (manque de policiers et sur la propreté) ne dépendent pas de la mun…",2014-02-25 10:40:46,438262288962056192
jcgaudin,"RT @itele: .@jcgaudin sur l’image de Marseille : """"""""avant 2013, nous avons supporté le #Marseille bashing à cause des morts violentes"""""""" #TeamT…",2014-02-25 10:40:39,438262257487974400
jcgaudin,Mon interview à @Bruce_Toussaint lors de la matinale d'Itélé de ce mardi 25 févrirer @itele #jcgaudin2014 http://t.co/9A4c5fbY0j,2014-02-25 10:20:07,438257091099508736
jcgaudin,Je serai demain Mardi 25 février à 07h45 l'invité de Bruce Toussaint dans la matinale d'Itélé @itele @Marseillenavant #jcgaudin2014,2014-02-24 17:00:23,437995431772299264
jcgaudin,"Retrouvez mon interview au site planet.fr
http://t.co/d1yChadw7e #jcgaudin2014 @Marseillenavant",2014-02-24 14:45:01,437961366897307648
jcgaudin,"Pour moi ma vie, c'est ma ville ! @itele #Marseille #JCGAUDIN2014 @Marseillenavant",2014-02-23 17:42:08,437643553926561792
jcgaudin,"RT @itele: J-C Gaudin aux électeurs du FN à #Marseille : """"""""si ils votent pour le FN, par ricochet ils aident Mennucci"""""""" #MonVote2014",2014-02-23 17:32:43,437641181816946688
jcgaudin,"RT @itele: J-C Gaudin #Marseille :""""""""nous sommes dans une ville où le score du FN a été très fort"""""""" #MonVote2014",2014-02-23 17:32:40,437641170211328000
jcgaudin,"RT @itele: J-C Gaudin #Marseille :""""""""je voudrais faire une charte de la propreté, donner plus de responsabilités aux mairies de secteur"""""""" #Mon…",2014-02-23 17:32:35,437641148426121217
jcgaudin,"RT @itele: Jean-Claude Gaudin #Marseille : """"""""mieux nettoyer pour les employés, moins salir pour les Marseillais"""""""" #MonVote2014",2014-02-23 17:32:30,437641129438478336
jcgaudin,"RT @itele: Jean-Claude Gaudin #Marseille : """"""""j'ai une politique pragmatique, c'est pour ça que les Marseillais m'aiment"""""""" #MonVote2014",2014-02-23 17:32:27,437641113474981888
jcgaudin,"RT @itele: Jean-Claude Gaudin sur @itele : """"""""#Marseille est une ville d'immigration"""""""" #MonVote2014",2014-02-23 17:32:24,437641100481036288
jcgaudin,"RT @itele: Jean-Claude Gaudin / endettement #Marseille : """"""""J'ai transformé Marseille. Je poursuis le changement"""""""" #MonVote2014",2014-02-23 17:32:18,437641079413030913
jcgaudin,"RT @itele: Jean-Claude Gaudin / endettement #Marseille : """"""""nous sommes une des rares villes à l'avoir diminué"""""""" #MonVote2014",2014-02-23 17:32:17,437641071586459648
jcgaudin,"RT @itele: Jean-Claude Gaudin/endettement #Marseille : """"""""nous avons la même dette que celle que j'ai trouvé en 1995 à mon arrivée"""""""" #MonVote2…",2014-02-23 17:32:10,437641045393039360
jcgaudin,"RT @itele: Jean-Claude Gaudin #Marseille : """"""""c'est la guerre permanente contre la drogue"""""""" #MonVote2014",2014-02-23 17:32:08,437641037465792513
jcgaudin,"RT @itele: J-C Gaudin #Marseille: """"""""je n'ai pas cessé de faire reculer le chômage de  21.6% à mon arrivée, à un peu + de 13% maintenant"""""""" #Mo…",2014-02-23 17:32:04,437641016964055040
jcgaudin,"RT @itele: J-C Gaudin,candidat à sa réélection : """"""""Marseille est une ville où l'on travaille, où la qualité de la vie est importante"""""""" #MonVo…",2014-02-23 17:31:58,437640992033112064
jcgaudin,RT @itele: EN DIRECT- Jean-Claude Gaudin est le candidat UMP à sa réélection à Marseille &gt;  http://t.co/9JfZB36MZk #MonVote2014,2014-02-23 17:31:56,437640984135225345
jcgaudin,"Comme toutes les années, une très belle réussite pour l'Open 13 http://t.co/bWWZRzoPEW",2014-02-21 09:21:28,436792781424820224
jcgaudin,Je salue le travail de M. Flamand resté à la tête du Ballet National durant près de 10 ans et qui a su gérer cette structure dans l'harmonie,2014-02-20 19:12:32,436579138686955520
jcgaudin,Je me félicite de la nomination d'Emio Greco et Pieter Scholten à la direction artistique du Centre chorégraphique du Ballet de Marseille,2014-02-20 19:09:05,436578268364681216
jcgaudin,J'ai présenté aujourd'hui mon projet économique à la CGPME13 à l invitation de Alain Gargani #jcgaudin2014 http://t.co/hfbC75q7c4,2014-02-20 13:59:23,436500333104472064
jcgaudin,Le Professeur Chinot illustre une nouvelle fois l'excellence des recherches menées par les équipes hospitalo-universitaires Marseillaises,2014-02-20 11:58:29,436469904301375488
jcgaudin,La plus prestigieuse revue médicale au monde a consacré une publication à l'étude du Pr. Chinot  chef du service neuro-oncologie à la Timone,2014-02-20 11:52:31,436468404179181568
jcgaudin,"Mon interview à France Bleu : """"""""Je n'envisage pas de perdre"""""""" les municipales à Marseille http://t.co/eZgYO50aaL @francebleu #jcgaudin2014",2014-02-19 16:40:33,436178502388183040
jcgaudin,Rencontre avec des entrepreneurs Marseillais du 11/12 Nous devons tt faire pour développer l'économie et favoriser l'emploi des Marseillais,2014-02-19 10:46:36,436089427199541249
jcgaudin,"Nous avons investi plus de 3,7 milliards € dans le renouveau de la ville",2014-02-18 19:26:16,435857819645247488
jcgaudin,Nous avons beaucoup fait en 18 ans mais il reste beaucoup à faire. Et à faire encore mieux,2014-02-18 19:25:24,435857601377869824
jcgaudin,La débauche de démagogie de mon concurrent est racontée à l'encre sympathique Je croyais que la Presse était libre et indépendante en France,2014-02-18 19:24:00,435857248322330625
jcgaudin,Notez qu'il vaut mieux pas d'article du tout qu'un papier écrit à l'encre de fiel,2014-02-18 19:23:02,435857004528435200
jcgaudin,"Quand mon concurrent présente ses promesses il a une page entière dans le journal, moi j'ai droit à un timbre poste.",2014-02-18 19:21:39,435856657114214400
jcgaudin,Mennucci et Hollande sont les Laurel et Hardy de la politique.,2014-02-18 19:19:07,435856020586643457
jcgaudin,St Valentin: Mennucci se comporte avec Marseille comme un amoureux transi qui voudrait séduire sa belle en lui disant qu'elle est moche,2014-02-18 19:18:12,435855789967024129
jcgaudin,"Quand on mélange du rose du vert du rouge et de l orange:  Cela donne du gris, couleur passe muraille, inodore et sans saveur",2014-02-18 19:16:16,435855304258232320
jcgaudin,"10000 marseillais supplémentaires vont payer des impôts à cause du gouvernement. Si c'est ça le socialisme, il peuvent le garder",2014-02-18 19:05:39,435852628686557184
jcgaudin,Aux côtés de Richard Miron et de Monique Cordier pour un grand rassemblement des 13/14 arrondissements #jcgaudin2014 @Marseillenavant,2014-02-18 18:39:34,435846067524227073
jcgaudin,Je souhaite un rapide rétablissement à Jacques #Chirac et apporte mon total soutien à Mme Chirac,2014-02-17 20:20:01,435508957491499008
jcgaudin,Merci à Pierre Arditi d'avoir rétabli la vérité. Merci monsieur pour votre élégance. http://t.co/tJh6ipY0To @Marseillenavant #jcgaudin2014,2014-02-17 17:14:28,435462262015266816
jcgaudin,Ma première mesure si je suis réélu : Continuer à développer l'emploi pour les Marseillais http://t.co/I26BcczY0u #jcgaudin2014,2014-02-17 11:29:33,435375462383366144
jcgaudin,Mon passage dans l'émission Le Supplément de Canal+ http://t.co/LEV1tQ137T via @Lesupplement,2014-02-10 12:06:29,432848038743121922
jcgaudin,Chaque vote pour le Front National favorise le candidat socialiste. Il faut le dire. #JCGAUDIN2014,2014-02-07 19:42:41,431875682097172480
jcgaudin,Hollande c'est l'échec inévitable. Mennucci c'est l'échec à éviter. #jcgaudin2014,2014-02-07 19:42:00,431875510441082880
jcgaudin,Si nous avions gardé la communauté urbaine nous ne serions pas dans cette situation de saleté et d'insalubrité à Marseille,2014-02-07 19:41:29,431875380434440192
jcgaudin,Des nouveaux équipements scolaires et sportifs pour les quartiers #JCGAUDIN2014,2014-02-07 19:35:56,431873984431656960
jcgaudin,Les promesses démagogiques de mon adversaire ne sont applicables que par une augmentation forte des impôts locaux que paient les Marseillais,2014-02-07 19:35:02,431873758975242240
jcgaudin,Il a été contre le tramway et l'hôtel aux catalans. Il est contre les terrasses du port et les nouveaux projets de créations d'emplois.,2014-02-07 19:33:30,431873373908779008
jcgaudin,Nous sommes partisans contrairement à nos adversaire de l'économie facilitée pour les créateurs d'entreprise. Le mot principal: la confiance,2014-02-07 19:32:34,431873137928863744
jcgaudin,Nous n'avons pas cessé de faire reculer le chômage et de créer de l'emploi. #JCGAUDIN2014,2014-02-07 19:31:19,431872822672384001
jcgaudin,"Arena de 15000 places, des musées, un funiculaire, une promenade des passerelles, finir la piétonisation du vieux port, un pont transbordeur",2014-02-07 19:30:46,431872685371834368
jcgaudin,"Un service public municipal, plus d'un millier de place de crèches, rattachement de la propreté aux mairies de secteurs. Bd urbain sud...",2014-02-07 19:28:54,431872213680406528
jcgaudin,"Nous avons un projet formidable, foisonnant, innovant. #JCGAUDIN2014",2014-02-07 19:24:31,431871113904553984
jcgaudin,Le matracage fiscal du gouvernement a rendu plus de 10000 marseillais de plus imposables cette année. Encore 10000 de plus pour 2014,2014-02-07 19:22:57,431870719329583104
jcgaudin,Nous voulons rassembler les Marseillais pour la poursuite du changement de Marseille. #JCGAUDIN2014,2014-02-07 19:21:22,431870319658553344
jcgaudin,"RT @brunogilles13: Depuis 6 ans, le bilan des socialistes à la CUM est catastrophique. Marcher dans nos rues nous permet d'en avoir la tris…",2014-02-07 19:14:55,431868697402425344
jcgaudin,"RT @brunogilles13: Avec @guyteissier à la CUM, nous requalifierons le Jarret, nous construirons le parking Longchamp, nous réussirons le pa…",2014-02-07 19:14:36,431868615655428096
jcgaudin,"RT @brunogilles13: De la + petite réalisation au + grand chantier, chaque projet a été réalisé dans le seul but de répondre à l'attente de …",2014-02-07 19:05:35,431866346205614080
jcgaudin,RT @brunogilles13: Dans les 4ème et 5ème arrondissements nous avons beaucoup travaillé dans l'écoute et la concertation de la population #p…,2014-02-07 19:05:33,431866340333592576
jcgaudin,"RT @brunogilles13: @fhollande a lancé l'opération """"""""Il faut sauver le soldat @patrickmennucci """""""" #4/5EnAvant #MarseilleEnAvant",2014-02-07 19:05:17,431866270708166656
jcgaudin,RT @brunogilles13: Comment accepter que cette campagne municipale soit prise en otage par les plus hautes autorités de l'État ?#4/5enAvant …,2014-02-07 19:05:11,431866247329095680
jcgaudin,RT @brunogilles13: Nous sommes unis et soudés derrière @jcgaudin et nous allons nous battre ensemble pour défendre #Marseille #4/5EnAvant,2014-02-07 19:05:05,431866219864805377
jcgaudin,RT @brunogilles13: Nous sommes ce soir près de 3000 à Vallier ! Merci #4/5EnAvant,2014-02-07 19:04:57,431866188420104192
jcgaudin,"RT @brunogilles13: Depuis 1995, avec @jcgaudin et l'ensemble des élus qui m'entourent nous œuvrons au quotidien pour moderniser et améliore…",2014-02-07 19:04:21,431866035185393664
jcgaudin,"Je serai dimanche 9 février à 12h, l'invité politique du @LeSupplement de Canal+ présenté par @MaitenaBiraben #jcgaudin2014",2014-02-07 13:24:19,431780464219533312
jcgaudin,Rencontre avec le club des supporters de l' @OM_Officiel: les winners et leur président Rachid zeroual http://t.co/OutPit0tAZ #jcgaudin2014,2014-02-05 14:48:53,431076971184148481
jcgaudin,Mon interview de ce matin sur LCI et Radio Classique avec Guillaume Durand http://t.co/3ZwI4fcMLn #jcgaudin2014,2014-02-05 13:28:29,431056736019963904
jcgaudin,Certains devraient faire attention à ne pas se transformer en montgolfières parce qu'ils risquent de ne plus passer la porte d'Aix,2014-02-04 21:22:49,430813718167822336
jcgaudin,Pape Diouf. Le président de la république n'a t'il rien de mieux à faire que de s'occuper à vouloir donner mon scalp au PS? #jcgaudin2014,2014-02-04 21:18:48,430812708179812352
jcgaudin,"Demain, mercredi 5 février je serai l'invité de Guillaume DURAND, en direct sur LCI et Radio Classique à 8h15  #jcgaudin2014",2014-02-04 14:59:17,430717201730252800
jcgaudin,"Je suis très fier d’accueillir le Professeur en Chirurgie Cardiaque, Frédéric Collart sur les listes de @Marseillenavant #jcgaudin2014",2014-02-04 10:39:41,430651870378344448
jcgaudin,"Marseille ville touristique, """"""""tout le monde est gagnant"""""""" - http://t.co/v9sHhD3wUY via @marseillenavant #jcgaudin2014",2014-02-03 19:23:28,430421296699023360
jcgaudin,Retrouvez l'intégralité de mon programme ainsi que son financement en téléchargement direct : http://t.co/8rDstJH6DU  #jcgaudin2014,2014-02-03 13:50:22,430337470023356416
