screenName,text,created,id
jcgaudin,@cyrilchade j'ai dit cela sur le ton de l'humour en pensant à l'engagement sans faille à gauche de @JlBennahmias,2013-11-28 18:56:09,406134432794673152
jcgaudin,J'adresse mes félicitations au personnel des hôpitaux de Marseille pour son efficacité et son dévouement quotidien au service des malades,2013-11-28 12:36:50,406038976903270400
jcgaudin,Classement national des #hôpitaux par le @LeNouvelObs. 3 hôpitaux marseillais au tableau d'honneur!,2013-11-28 12:34:52,406038482285768704
jcgaudin,J'annoncerai et prendrai prochainement ds initiatives pour placer le gvt et ses représentants locaux dvt leurs responsabilités #SNCM,2013-11-27 17:43:15,405753700498411520
jcgaudin,Que fait le candidat socialiste si prompt d'ordinaire à se répandre dans ls média pour aider la #SNCM? Rien non plus il reste muet et inerte,2013-11-27 17:34:25,405751476036722688
jcgaudin,@jeanmarcayrault prétendait se préoccuper du développement de Marseille. Il n'a pourtant pas dit un mot pour le personnel de la #SNCM,2013-11-27 17:30:04,405750385152782336
jcgaudin,La situation de la #SNCM est très grave et toutes les informations se font chaque jour plus inquiétantes quant à son avenir @SNCM_Officiel,2013-11-27 17:28:37,405750017329082368
jcgaudin,Mon interview de ce matin sur @Europe1 par @JP_Elkabbach http://t.co/snfABWjRex,2013-11-27 08:58:32,405621652668424192
jcgaudin,2/2 une des multiples décisions dogmatiques d'un PS qui nie la réalité d'une pression fiscale devenue insupportable pr ls Français #PLF2014,2013-11-26 11:45:04,405301172757860353
jcgaudin,1/2 C'est le résultat d'un long combat pour réparer une injustice #PLF2014,2013-11-26 11:44:00,405300905299697664
jcgaudin,Je me réjouis du rejet de la baisse du quotient familial et de l'adoption de la défiscalisation des heures supp par le sénat #PLF2014,2013-11-26 11:40:56,405300131672911873
jcgaudin,"Retrouvez mon passage dans l'émission """"""""La voix est libre"""""""" de France 3 http://t.co/BXdeKWObmB",2013-11-24 13:33:31,404603690981392384
jcgaudin,Je remercie @JLBorloo pour son soutien dans cette campagne des municipales  #LeSupplement #jcgaudin2014 http://t.co/Et8cUbnIUF,2013-11-24 12:30:18,404587781508575232
jcgaudin,Je suis mieux placé que @patrickmennucci pour attirer les entreprises. Il s'est opposé aux terrasses du port qui créent 2000 emplois,2013-11-23 11:21:05,404207972500643840
jcgaudin,Les socialistes n'ont pas la côte en ce moment dans le pays et j'espère bien qu'ils ne l'auront pas à Marseille,2013-11-23 11:17:30,404207072654659584
jcgaudin,Depuis que je suis maire on a construit plus de 1500 logements par an,2013-11-23 11:15:04,404206459464212481
jcgaudin,Stade vélodrome C'est encore une proposition gadget de @patrickmennucci On ne vend pas le vieux port de Marseille ni Notre-Dame de la Garde,2013-11-23 11:13:47,404206135278043136
jcgaudin,Il y a 5000 marseillais de plus chaque année.,2013-11-23 11:10:09,404205221137899520
jcgaudin,7 à 8 millions de touristes en cette année de MP2013.,2013-11-23 11:09:33,404205070038077440
jcgaudin,Tourisme : 1 million de croisiéristes c'est une source d'emplois et de revenus  pour la ville de Marseille et les marseillais.,2013-11-23 11:08:02,404204689283358720
jcgaudin,Rythmes scolaire : cette réforme est impossible à appliquer! Allez trouver des gens qui vont venir travailler 1h30 par semaine !,2013-11-23 11:06:38,404204335590281216
jcgaudin,@jeanmarcayrault n'est pas venu pour aider Marseille et les marseillais mais uniquement pour aider son ami candidat socialiste,2013-11-23 10:54:52,404201377255391232
jcgaudin,Je ne suis pas à la recherche d'un titre. J'aime cette ville !,2013-11-23 10:53:04,404200921833680896
jcgaudin,Marseille n'est pas pour moi une question d'ambition personnelle contrairement à mon adversaire socialiste. J'ai tt eu dans ma vie politique,2013-11-23 10:50:24,404200251298680832
jcgaudin,La propreté souvent reprochée dépend de la métropole! Il faut rappeler qu'elle est gérée par les socialistes !,2013-11-23 10:48:10,404199691136827392
jcgaudin,Le gouvernement au lieu de ns faire ds promesses pour ds 30ans ferait bien d'aider Marseille aujourd'hui et notamment la SNCM pour l'emploi,2013-11-22 19:23:38,403967024230985728
jcgaudin,"Je ne veux pas un retour en arrière pour Marseille! Ns avons fait beaucoup de choses, il n'y a que le candidat socialiste qui ne le voit pas",2013-11-22 19:22:00,403966612492918784
jcgaudin,Marseille en avant ! http://t.co/TGAI0zOIc5,2013-11-22 15:05:42,403902114595737600
jcgaudin,Retrouvez ma déclaration sur mon site de campagne http://t.co/Et8cUbnIUF,2013-11-22 07:12:01,403782907099357184
jcgaudin,"Fort de mon expérience et de la passion qui m’anime, je veux la réussite de Mars.et un avenir meilleur à partager entre tous les Marseillais",2013-11-22 07:11:01,403782655470477312
jcgaudin,"Renforcer le vivre ensemble républicain de nos concitoyens, doter Mars. des équipements et services d’une vraie capitale de la Méditerranée",2013-11-22 07:10:01,403782403925491712
jcgaudin,Nous nous engagerons ainsi à accroître l’attractivité économique de notre ville au bénéfice du développement et de l’emploi,2013-11-22 07:09:01,403782152200151040
jcgaudin,Avec une équipe renouvelée et avec ts ceux qui veulent se rassembler pour faire avancer Marseille je proposerai un Pacte à ts ls Marseillais,2013-11-22 07:08:01,403781900676132864
jcgaudin,Une nouvelle gouvernance à la Communauté urbaine et à la future Métropole constitue à cet égard un enjeu majeur des élections municipales.,2013-11-22 07:07:01,403781648774619136
jcgaudin,je sais leurs difficultés et j’entends leurs préoccupations,2013-11-22 07:06:01,403781397414150144
jcgaudin,Il faut poursuivre et amplifier le changement que nous avons initié afin de faciliter la vie quotidienne des Marseillais,2013-11-22 07:05:01,403781145420382208
jcgaudin,Je ne veux pas que ls Marseillais subissent la double peine d’1 gestion socialiste qui ferait reculer Mars comme elle fait reculer la France,2013-11-22 07:04:01,403780893778903040
jcgaudin,je ne peux admettre que ma ville soit prise en otage entre populisme et retour en arrière,2013-11-22 07:03:01,403780642108080128
jcgaudin,"Avec mon équipe, nous avons placé Marseille sur le chemin du renouveau et de l'espoir. Le succès de #MP2013 en a porté un témoignage",2013-11-22 07:02:01,403780390391119872
jcgaudin,"Cette décision, je l'ai prise en plein accord avec mes amis politiques et en considérant les enjeux pour l'avenir de notre cité.",2013-11-22 07:01:01,403780139676618752
jcgaudin,Ma vidéo de candidature pour expliquer aux marseillais pourquoi je suis sollicite un nouveau mandat http://t.co/yyhs2jTYrm,2013-11-22 07:00:01,403779888240660480
jcgaudin,Bravo aux forces de l'ordre d'avoir contrôlé la situation sur la Canebière avec sang froid,2013-11-20 11:07:30,403117391334211584
jcgaudin,Il est dommage que la Police Nationale n'ait rien prévu dès le départ pour éviter les débordements qui s'étaient déjà déroulés dans le passé,2013-11-20 11:05:30,403116886964981761
jcgaudin,Mon intervention sur @franceinter ce matin http://t.co/3kcFsq6MvO,2013-11-18 09:18:25,402365166202802177
jcgaudin,#Mitterrand Ces propos sont ceux d'un courtisan qui veut revenir au gouvernement. Ces visites en province étaient pour lui un calvaire.,2013-11-17 10:39:30,402023180120121344
jcgaudin,"@WalterGinosaure renseignez vous, j ai voté pour !",2013-11-16 13:10:00,401698668463788032
jcgaudin,Cet essor considérable résulte d'une politique volontariste afin que le tourisme soit un accélérateur majeur de croissance économique,2013-11-16 12:32:32,401689241156993025
jcgaudin,"Portée par l'élan de MP 2013, Marseille a renforcé cette attractivité en mettant particulièrement en avant l'axe «Tourisme et Culture »",2013-11-16 12:30:07,401688632555077632
jcgaudin,"En octobre 2014, près de 180 000 visiteurs viendront dans notre ville, soit plus que toute l'année 2000 qui en avait accueilli 160 000.",2013-11-16 12:28:41,401688273140998144
jcgaudin,"En 1995, 18 000 passagers arrivaient à #Marseille, 1,15 million sont attendus en 2013 et pas moins de 1,35 million pour 2014. #tourisme",2013-11-16 12:27:56,401688082916704256
jcgaudin,"Les chiffres sont éloquents:7 millions de visiteurs en 2013, 18 100 emplois directs, 700 millions d'euros de retombées économiques #tourisme",2013-11-16 12:27:18,401687924728528896
jcgaudin,"Métropole Euroméditerranéenne incontournable, Marseille devient 1 destination privilégiée pour ls croisières et le développement touristique",2013-11-16 12:26:17,401687667441557504
jcgaudin,Entêtement du Ministre de l'Education Nationale sur une réforme rejetée par l'ensemble du monde éducatif Ma réaction https://t.co/bYzTCfXGsN,2013-11-16 12:24:48,401687295549399040
jcgaudin,Ces emplois créés à #Marseille sont le résultat d'un long travail qui a conduit à l'attractivité de cette ville.,2013-11-15 10:49:34,401300939505926144
jcgaudin,Plus de 2000 emplois pour ls marseillais créés avec les terrasses du port. 900 emplois également avec le chantier de la tour La Marseillaise,2013-11-15 10:48:12,401300596097286144
jcgaudin,@RV_44 @vincentpeillon OUI ! Si l'Etat nous y oblige nous en passerons par là.,2013-11-13 09:41:26,400559015643852800
jcgaudin,Financer les 25 millions € de cette réforme nous obligerait à augmenter les impôts des marseillais. Chose à laquelle je m'oppose totalement!,2013-11-13 09:23:32,400554513930936320
jcgaudin,Je suis contre la réforme des rythmes scolaires de @vincentpeillon qui coûterait plus 25 millions € à Marseille. http://t.co/UU03s0PN4l,2013-11-13 09:22:04,400554144542765056
jcgaudin,Ma réaction suite aux règlements de compte et à l’agression d’une policière ce WE. Plus d 'effectifs et de moyens !! https://t.co/IVpQt6liOA,2013-11-11 13:29:19,399891588760866816
jcgaudin,"Je présente tous mes souhaits de prompt rétablissement à mon ami @bernardreynes , et l'assure de tout mon soutien ainsi qu'à sa famille.",2013-11-11 12:50:17,399881767651651584
jcgaudin,@jeanmarcayrault aurait pu s'engager concrètement sur des problèmes plus immédiats sur lesquels l'Etat est attendu! Notamment la SNCM,2013-11-08 11:28:23,398773993198845952
jcgaudin,Reconnaissance et poursuite des projets que je porte avec ma municipales : ls annonces faites sont des bonnes nouvelles pour les marseillais,2013-11-08 11:25:59,398773390733242368
jcgaudin,Le comportement du Chef du Gouvernement montre que ce déplacement n'est qu'une tournée électorale visant à soutenir le candidat socialiste,2013-11-08 11:20:38,398772042105114624
jcgaudin,Les annonces du premier ministre @jeanmarcayrault n'ont surpris personne. Tt le monde en connaissait le contenu avant son arrivée,2013-11-08 11:19:04,398771646682923008
jcgaudin,"J’appelle le gouvernement à un """"""""cessez-le-feu fiscal"""""""", c'est une mesure de salut public! https://t.co/9o7ODcRZEF",2013-11-05 20:49:56,397828148655448064
jcgaudin,Un seul souhait: que les 7 #otages français restant dans le monde le soient bientôt également,2013-10-29 17:48:26,395245758774906880
jcgaudin,Un vrai bonheur: les 4 otages français retenus au Niger à Arlit viennent d'être libérés!,2013-10-29 17:47:36,395245546572500992
jcgaudin,La fonction d'un maire est de rassembler tous les marseillais. Pas de les insulter ni de les diviser.,2013-10-25 08:34:51,393656892754776064
jcgaudin,Il est infiniment choquant de voir le candidat PS tenir des propos racistes dans une assemblée d'élus.,2013-10-25 08:33:53,393656648583380992
jcgaudin,"A deux reprises, j'ai déjà demandé au Gouvernement de prendre ses responsabilités pour sauver cette entreprise @SNCM_Officiel",2013-10-24 16:12:38,393409710272946176
jcgaudin,L’État n'a pas le droit d'abandonner les salariés de la @SNCM_Officiel et doit maintenant agir pour la sauver #SNCM #Marseille,2013-10-24 16:09:50,393409005827022848
jcgaudin,Merci Frédéric pour ton message “Je suis un minot du Nord de #Marseille et je vote pour @jcgaudin ! “ http://t.co/SnTYb5SBkb …,2013-10-24 12:40:10,393356239511355393
jcgaudin,@Menilmuche @SNPLFALPA vous avez l'explication: c'est l'emploi pour les marseillais et le développement de notre ville qui prime pour nous,2013-10-24 12:28:21,393353266316058624
jcgaudin,@Menilmuche @SNPLFALPA cela a permis à #marseille d'être la  première dest low-cost d'Europe. Le reste c'est à la justice de se prononcer,2013-10-24 11:51:19,393343944534155264
jcgaudin,@Menilmuche @SNPLFALPA La médaille de la ville de #Marseille vient récompenser @Ryanair pour la création d'emplois pour les marseillais,2013-10-24 11:47:44,393343046697250816
jcgaudin,En route pour #Erevan #Arménie accompagné de plus 30 chefs d'entreprises pour la réactualisation ds accords de coopération avec #Marseille,2013-10-23 12:13:40,392987182371057664
jcgaudin,Les Marseillais étaient en droit d'attendre une plus grande dignité et de véritables propositions de la part de ces candidats.,2013-10-20 20:17:49,392021858217771009
jcgaudin,Ces affrontements internes au parti socialiste ont porté atteinte à l'image de Marseille et ont renforcé son dénigrement,2013-10-20 20:17:32,392021787438891008
jcgaudin,"Au cours de leurs trop nombreux débats, ils n'ont à aucun moment servi les intérêts de notre ville",2013-10-20 20:17:02,392021664826814465
jcgaudin,"Spectacle dont ils ne sortent grandis, ni l'un, ni l'autre.",2013-10-20 20:16:35,392021551521882112
jcgaudin,Je suis consterné par le triste spectacle que les deux candidats socialistes ont imposé aux Marseillais entre les deux tours,2013-10-20 20:15:41,392021323183960064
jcgaudin,#Leonarda: @fhollande doit respecter les lois de la république! Mais tout cela n'est-il pas une stratégie pour faire monter le #FN ?,2013-10-19 13:57:48,391563839898402817
jcgaudin,J'invite les marseillais à soutenir la candidature de #Marseille entant que Capitale Européenne du Sport en 2017   http://t.co/LTq1aLn76f,2013-10-18 16:57:50,391246756614533120
jcgaudin,"#Riegel Le père de la célèbre Fraise Tagada créée à Marseille, il y a + de 40 ans laissera l'image d'un grand chef d'entreprise marseillais",2013-10-15 18:15:24,390179114016968704
jcgaudin,"#Riegel Installé depuis des années dans ls quartiers nord, Haribo a su s'intégrer et fournir un nombre important d'emplois aux marseillais",2013-10-15 18:11:59,390178255531409408
jcgaudin,"Décès de Hans #Riegel. Au nom des Marseillaises et Marseillais, j'adresse mes sincères condoléances à sa famille.",2013-10-15 18:09:22,390177593611546624
jcgaudin,Excuses de @MACarlotti qui s'est conduite avec élégance #PrimairesPS,2013-10-12 21:01:32,389133760324988929
jcgaudin,Je suis surpris des procédés employés par @MACarlotti les #primairesps lui font oublier les principes même de la politesse,2013-10-12 12:30:47,389005222833815552
jcgaudin,RT @lacaradec: @CaselliEugene veut augmenter le ticket #RTM par #MPM ! Une fois de plus les #marseillais seront pénalisés par les #socialis…,2013-10-12 08:50:20,388949747429810176
jcgaudin,Nous attendons la réponse de la Gauche pas seulement sur #Brignoles mais aussi sur le plan national. #FN,2013-10-07 11:36:46,387179690529923073
jcgaudin,Les résultats du 1er tour des cantonales de Brignoles posent la question du comportement de la Gauche! Quelle attitude au second tour? #FN,2013-10-07 11:36:39,387179660314165248
jcgaudin,Le débat sur les rapports d'observation de la CRC a permis de rétablir la vérité et de vérifier la justesse des arguments de la ville,2013-10-07 11:36:30,387179625342066688
jcgaudin,#stadevelodrome #OM Le PPP coûterait 93 millions supp mais il rapportera en contrepartie 372 millions de recettes à #Marseille 2/2,2013-10-04 13:59:58,386128565445476353
jcgaudin,#stadevelodrome #OM La CRC et les médias trompent les marseillais sur le coût de construction du stade fait en Partenariat Public Privé 1/2,2013-10-04 13:31:47,386121472969670656
jcgaudin,Marseille deuxième lieu de tournage en France après Paris. Cela confirme l'attractivité grandissante de notre ville,2013-10-04 09:32:47,386061326847848448
jcgaudin,Avec @JeanDujardinOff et @GillesLellouche sur le tournage du film La French reconstitution de la vie du juge MICHEL http://t.co/ocrtc2RIpi,2013-10-04 09:17:56,386057588653436928
jcgaudin,#Roms : nous avons mis 15 ans à faire disparaître tous les bidonvilles de #marseille. Je déplore de voir que ceux-ci reviennent aujourdhui.,2013-10-03 10:41:24,385716204775956480
jcgaudin,La PM couvrira ds horaires plus étendus. Nous avons décidé de mettre en place ds brigades de nuit et le renforcement ds effectifs en journée,2013-10-03 10:39:49,385715809584427008
jcgaudin,Les agents sont dotés de gilets pare-balles nous avons décidé qu'ils seraient équipés d'armes non létales de 4ème catégorie dès 2014 #CLSPD,2013-10-03 10:38:39,385715512258625536
jcgaudin,Trouver des réponses concrètes au désarroi des familles en stoppant la dérive délinquante de leurs enfants,2013-10-03 10:35:50,385714803345719296
jcgaudin,"La Cellule aura pour mission de recevoir et écouter les familles en détresse, dialogue constructif avec elles",2013-10-03 10:35:26,385714706629263360
jcgaudin,Pour cela mise en place de la Cellule de Citoyenneté et de Tranquillité Publique constituée par ls représentants ds institutions partenaires,2013-10-03 10:35:04,385714612194529280
jcgaudin,"Aider les familles, les parents en difficulté face à leurs enfants qui s'égarent sur les chemins menant à la délinquance, la drogue",2013-10-03 10:33:57,385714329473265664
jcgaudin,"Accompagnement des services de police par la mise en place d'intervenants sociaux au sein des Hôtels de Police Centre, Nord et Sud.",2013-10-03 10:33:24,385714192697028608
jcgaudin,Également aide aux victimes grâce à un partenariat avec l'institution judiciaire et le serv d'aide aux victimes d'urgence,2013-10-03 10:32:51,385714056164020224
jcgaudin,Nous pouvons compter sur quelques 250 médiateurs sociaux,2013-10-03 10:31:36,385713741993873408
jcgaudin,Pour la prévention de la délinquance: un développement de la médiation sociale complémentaire aux forces de l ordre,2013-10-03 10:31:18,385713666030854144
jcgaudin,L'ensemble de ce dispositif représente un effort financier très important pour la ville de marseille.,2013-10-03 10:30:34,385713481343049728
jcgaudin,Ce centre de #vidéo-protection exploité par la Police Municipale fonctionne 24h/24 et 7 jours sur 7,2013-10-03 10:29:38,385713244109021184
jcgaudin,"Aujourd'hui, ce sont 258 caméras qui sont en fonction, 330 en fin d'année et 1 000 en fin 2014",2013-10-03 10:28:30,385712959001210880
jcgaudin,"Nous avons doté la ville d'un réseau de #vidéo-protection moderne, extensible à l'ensemble du territoire communal.",2013-10-03 10:27:57,385712821339959296
jcgaudin,Recrutement de 100 policiers municipaux en 2012. 100 supplémentaires les rejoindront après recrutement et formation dès l'automne 2014,2013-10-03 10:26:11,385712377817473024
jcgaudin,"Ces engagements en matière de sécurité ont été tenus, et je suis heureux de pouvoir le rappeler.",2013-10-03 10:24:55,385712058115043328
jcgaudin,"La Ville de Marseille a pris des engagements très importants en terme de sécurité des Marseillais et de prévention de la délinquance.
#CLSPD",2013-10-03 10:24:01,385711832629256192
jcgaudin,"Quel dommage que le parcours de @RobertAssante, si bien engagé en 1983, se termine dans la rancune, l’amertume et le dénigrement",2013-10-02 10:27:01,385350200195178497
jcgaudin,"Il convenait de rétablir cette vérité, beaucoup moins noble et beaucoup plus intéressée. #Assante",2013-10-02 10:26:39,385350107207462912
jcgaudin,Il s’agit tout simplement de son maintien au poste de Maire des 11 et 12ème arrondissements dans la prochaine municipalité. #Assante,2013-10-02 10:25:54,385349919642382336
jcgaudin,"Le fond du problème n’est ps un différend sur la vision strat de l’avenir de Marseille, comme le prouvent ts ses votes au CM depuis 18 ans",2013-10-02 10:24:03,385349453588074496
jcgaudin,Énorme gâchis dt il est l’unique cause Je sais que l’ingratitude est la règle ds la vie politique ms je pensais que la sagesse l’emporterait,2013-10-02 10:21:31,385348812660690944
jcgaudin,C’est avec un grand sentiment de tristesse que j’ai pris connaissance des déclarations de @RobertAssante,2013-10-02 10:18:17,385348000857350145
jcgaudin,Michel Bourgat un homme politique marseillais courageux que je salue. Un exemple pour beaucoup d'entre nous. #grandjournal,2013-10-01 17:50:44,385099477549584384
jcgaudin,Je suis très fier de voir l'attractivité et le succès de Marseille reconnus à l'étranger. http://t.co/5YY3Xzj5Wd,2013-09-19 13:54:44,380691430282625024
jcgaudin,@marseille_mp c'est votre appréciation mais vous savez tout comme moi que je me donne entièrement à Marseille!,2013-09-14 23:22:03,379022260331634688
jcgaudin,@ruquierofficiel les marseillais méritent mieux que vos constantes critiques dictées par vos amis socialistes ! #ONPC,2013-09-14 22:42:25,379012288092852224
jcgaudin,@ruquierofficiel la différence est que le gvt de @fhollande s'engage sur des promesses qu'il ne tient pas! #ONPC,2013-09-14 22:39:59,379011673488887808
jcgaudin,@ruquierofficiel arretons le Marseille bashing. Droite ou gauche nous avons demandé des moyens au gvt pour la sécurité des marseillais #ONPC,2013-09-14 22:36:45,379010859022188544
jcgaudin,@MACarlotti Ne vendez pas la peau de l'ours avant de l'avoir tué ...,2013-09-13 17:57:47,378578270033551360
jcgaudin,@MACarlotti je note votre conseil mais je serai heureux que vous en fassiez également part à @patrickmennucci,2013-09-13 13:41:25,378513751169064960
jcgaudin,C est pour mieux écrire l'avenir que nous célébrons avec ce musée le passé de #Marseille.,2013-09-12 16:45:49,378197769439416320
jcgaudin,J'ai confiance en Marseille et en la capacité des marseillais pour surmonter les épreuves. Et se projeter dans l'avenir.,2013-09-12 16:44:26,378197421026975744
jcgaudin,Ce musée nous donne une grande leçon sur Marseille et son destin. Elle a toujours su les traverser. Nous ne devons pas nous résigner.,2013-09-12 16:43:05,378197083159007232
jcgaudin,En 13 étapes ce musée nous raconte l'histoire de Marseille de la préhistoire à la tour CMA-CGM.,2013-09-12 16:41:33,378196696041545728
jcgaudin,Trop souvent j entends des critiques sur le personnel municipal. Là je leur dit bravo. Sans eux rien ne se serait fait.,2013-09-12 16:37:38,378195709889355776
jcgaudin,Merci à Roland Carta co-réalisateur du #MUCEM et réalisateur du musée,2013-09-12 16:36:22,378195390736400384
jcgaudin,Mes premiers mots sont pour tous ceux qui ont travaillés à la rénovation du musée d'histoire de #Marseille,2013-09-12 16:34:14,378194854125506560
jcgaudin,J'inaugurerai cet am le nouveau musée d'Histoire de #Marseille. Les marseillais pourront le découvrir les 13-14-15 sept #journéespatrimoine,2013-09-12 09:34:42,378089276501528577
jcgaudin,Nous devons continuer à #agirpourMarseille !,2013-09-08 11:14:44,376664896622305280
jcgaudin,"C'est dans cette perspective, que j'ai demandé, lors de la réunion #sécurité organisée hier, l'élargissement des Zones #Franches #Urbaines.",2013-09-08 11:13:25,376664565691727872
jcgaudin,"Réussite de @MP2013 , progression constante du #tourisme et progrès de la lutte incessante contre le #chômage #Marseille",2013-09-08 11:11:03,376663970566131712
jcgaudin,Nous devons montrer les autres visages de la deuxième ville de France #Marseille,2013-09-08 11:09:34,376663599676407808
jcgaudin,"Elle a besoin de travail, d'unité, d'efforts et d'apaisement, pour lutter contre l'insécurité et la mauvaise image véhiculées par les médias",2013-09-08 11:05:15,376662510864437248
jcgaudin,Mais aujourd'hui #Marseille n'a pas besoin d'une campagne électorale prématurée ni des excès de certains candidats aux Primaires socialistes,2013-09-08 11:03:55,376662177408880641
jcgaudin,Le sondage paru dans le JDD ce matin confirme les tendances lourdes déjà observées.,2013-09-08 11:01:58,376661687409315840
jcgaudin,"Mon interview donnée à l'issue de la réunion avec @manuelvalls sur la sécurité  à #Marseille
http://t.co/HmybnokqT4",2013-09-07 17:59:46,376404439940087808
jcgaudin,Si des tweets sont arrivés pendant que nous tenions la séance honte à ceux qui ont osé faire cela,2013-09-07 10:55:50,376297754055950337
jcgaudin,Nous devons améliorer cela tous ensemble et hors des contextes politiques,2013-09-07 10:53:31,376297172196937728
jcgaudin,Nous faisons des efforts: recrutement de 100 policiers municipaux et merci à l'Etat de le reconnaître.,2013-09-07 10:50:16,376296354932609024
jcgaudin,C est contre la drogue qu'il faut lutter et contre l'agressivité nouvelle qui sévit dans la ville de #Marseille,2013-09-07 10:49:06,376296058886062081
jcgaudin,Nous avons tenu tous nos engagements depuis la dernière réunion interministérielle,2013-09-07 10:48:14,376295840866123776
jcgaudin,D'accord pour une action commune entre nous en évitant le dénigrement de #Marseille,2013-09-07 10:47:42,376295708166729729
jcgaudin,"Mon interview de ce matin sur @Europe1  
#Marseille mérite une attention particulière ...
http://t.co/lqepCNeIXo",2013-09-06 09:40:52,375916499942121472
jcgaudin,"A titre personnel, j'adresse mes plus sincères condoléances à Monsieur #Anigo, Directeur sportif de l'@OM_Officiel et à sa famille",2013-09-05 18:59:46,375694763481399296
jcgaudin,"@manuelvalls m'a confirmé que la priorité de la PN doit être la lutte contre les trafics de drogue, à l'origine de cette """"""""guerre des cités""""""""",2013-09-05 18:58:18,375694393480867840
