screenName,text,created,id
MarisolTouraine,"#FH2012 MOBILISATION """"Le vote efficace est celui qui donnera l’élan nécessaire à @fhollande face au candidat sortant"""" http://t.co/uMoVAXNq",2012-04-16 08:20:12,191803163911782401
MarisolTouraine,Nous ne ferons pas la même politique sociale que Nicolas Sarkozy | #FH2012 Mon interview à @mediapart en accès libre : http://t.co/S4vuuSzh,2012-04-13 12:18:42,190776022575226880
MarisolTouraine,#FH2012 - Changer la vie des femmes : les 40 engagements de @fhollande qui vont aussi transformer la France http://t.co/aYodgHzq #egalite,2012-04-13 12:15:24,190775192480530432
MarisolTouraine,"RT @arnocast: Sur @Mediapart, @MarisolTouraine s'engage à lever l’interdiction pour les homosexuels de donner leur sang http://t.co/4iaY ...",2012-04-13 08:17:05,190715215527161856
MarisolTouraine,"#FH2012 Au cours d'une conférence de presse, j'ai rappelé les priorités de @fhollande en matière de politique de santé http://t.co/RUdTvc8F",2012-04-12 14:01:54,190439605873557504
MarisolTouraine,#FH2012 - Mon interview à Médiapart : « Nous ne ferons pas la même politique sociale que Nicolas Sarkozy » http://t.co/yv9rdDsH,2012-04-12 13:53:45,190437552325537793
MarisolTouraine,"RT @mathieu_m: @MarisolTouraine (PS) «Là il faudra, nous rouvrirons des centres IVG.» http://t.co/8WJGhnkj",2012-04-11 18:15:45,190141101192130560
MarisolTouraine,"A l'occasion de la journée mondiale contre la maladie de Parkinson, nous appellons à retrouver la voie du progrès http://t.co/Nm6Bq3VP",2012-04-11 17:23:21,190127910877802497
MarisolTouraine,"#FH2012 - Avez-vous pensé à faire votre procuration ? http://t.co/FQ38BHLA | Voter est un droit, c’est aussi un devoir civique.",2012-04-11 16:51:11,190119819683696640
MarisolTouraine,"RT @MatthiasFekl: meeting de soutien à @fhollande avec @MarisolTouraine demain à 19h00, salle Henriette Bounin (square de Verdun) #Marma ...",2012-04-11 14:10:37,190079410697805825
MarisolTouraine,"#FH2012 - Nicolas Sarkozy, après cinq années de mandat... Ce n'est pas un bilan qu'il présente mais un dépôt de bilan ! http://t.co/kGqg4mHy",2012-04-11 14:08:53,190078973668106241
MarisolTouraine,"Je serai ce soir à Marmande (Lot-et-Garonne) chez @MatthiasFekl pour tenir un meeting de soutien à @fhollande. 19h00, salle Henriette Bounin",2012-04-11 08:19:02,189990930324013056
MarisolTouraine,"#FH2012 - Notre politique, c’est de garantir la pérennité des ressources de la Sécurité sociale. http://t.co/54u5YjvA / cc @fhollande",2012-04-10 13:02:49,189699958872621058
MarisolTouraine,#Sarkopipo - Sécurité sociale : le bilan de Nicolas Sarkozy reste celui d’un déficit inégalé. http://t.co/54u5YjvA,2012-04-10 12:58:58,189698991217315841
MarisolTouraine,RT @fhollande: Le clip officiel de ma campagne présidentielle est à découvrir par ici : http://t.co/kV9xxMoG #FH2012,2012-04-09 15:16:57,189371329126998016
MarisolTouraine,"RT @fhollande: Toutes les infos sur notre grand rassemblement, dimanche prochain, sur l'esplanade du Château de Vincennes : http://t.co/ ...",2012-04-09 13:04:27,189337981763596289
MarisolTouraine,#Sarkopipo - Assurance maladie : un projet de démantèlement et de régression pour les Français http://t.co/0vgnYzxS,2012-04-07 11:16:15,188585976917016576
MarisolTouraine,"#sarkopipo - ONDAM à 2,5%, le programme caché de NS pr la santé en France : restrictions, régressions et privatisations http://t.co/8SGJQN22",2012-04-05 07:11:04,187799499207483392
MarisolTouraine,#AgendaDuChangement - Découvrez la première année du changement pour les Français : http://t.co/v4Nc1sSK #Hollande2012 #FH2012 #LCCM,2012-04-04 06:57:11,187433617834786816
MarisolTouraine,RT @partisocialiste: . @marisoltouraine et @jm_leguen «Le troisième plan cancer : une exigence forte» http://t.co/pGnEZ6pP #FH2012,2012-04-03 20:31:23,187276128367542273
MarisolTouraine,"RT @fhollande: Je suis sérieusement de gauche, mais je suis pour une gauche sérieuse! #Tours #FH2012",2012-04-03 12:43:56,187158493290180612
MarisolTouraine,"Je vous donne rendez-vous demain à 12h30 sur l'Esplanade du Château de Tours, pour un meeting de @fhollande ! http://t.co/ClWRkr0V",2012-04-02 07:35:51,186718564068237313
MarisolTouraine,"Sidaction 2012 : poursuivre les efforts, réduire les injustices, améliorer la lutte contre la maladie http://t.co/uZiZhXjR #Hollande2012",2012-03-30 14:38:19,185737727172542464
MarisolTouraine,"Retrouvez mon communiqué de presse diffusé aujourd'hui - """"Pauvreté : la fatalité n'existe pas"""" http://t.co/s0ixfpDh #Hollande2012",2012-03-30 10:43:19,185678588241129472
MarisolTouraine,"Cela fait plus de 5 ans que NS nous répète qu'il a changé... Le vrai changement, c'est avec @fhollande http://t.co/AMYlsb7J #Hollande2012",2012-03-29 15:50:23,185393475020259328
MarisolTouraine,#Hollande2012 -  J'ai présenté les engagements de @fhollande en matière de santé au grand oral organisé par le CNPS : http://t.co/prs3TpSz,2012-03-28 16:01:31,185033888941342720
MarisolTouraine,"En route vers Marseille, chez @jpmignard, où j'anime une réunion publique pour #hollande2012 ! Rendez-vous à 17h30 au Radisson Blu.",2012-03-28 13:03:08,184988997137858561
MarisolTouraine,"Vivement l'alternance ! Contrat de génération, emplois d’avenir, notation sociale des entreprises, incitations aux CDI http://t.co/Do2H7Qmc",2012-03-28 10:11:18,184945753460977664
MarisolTouraine,"En route pour Lannion (Côtes-d'Armor) : j'y rencontre les syndicats d'Alcatel et F Telecom, puis j'anime une réunion publique #hollande2012",2012-03-27 13:08:11,184627880079278081
MarisolTouraine,"RT @LesEchos: Marisol Touraine, l'incontournable http://t.co/ptJJqlEE",2012-03-27 13:04:25,184626932468551680
MarisolTouraine,#Hollande2012 - Une interview vidéo dans laquelle j'explique le projet de @fhollande en matière de santé : http://t.co/PuE1Qb9T,2012-03-27 08:27:04,184557136553058304
MarisolTouraine,RT @ebothorel: réunion publique ce soir Lannion 19.30 (les ursulines) avec @MarisolTouraine #FH2012 @TousHollande le changement c'est ma ...,2012-03-27 08:01:37,184550728839335936
MarisolTouraine,Ma réaction après l'annonce d'une nouvelle augmentation du chômage en février : http://t.co/OH87MwvU #FH2012 #Sarkopipo,2012-03-26 17:56:57,184338164264079360
MarisolTouraine,RT @jpmignard: RDV Mercredi 17h30 au Radisson Blu avec Marisol TOURAINE pour un grand débat sur la politique de la santé http://t.co/thK ...,2012-03-26 17:51:35,184336811559104513
MarisolTouraine,Augmentation du chômage : la stratégie du travestissement permanent doit cesser ! http://t.co/OH87MwvU,2012-03-26 16:24:18,184314846374936577
MarisolTouraine,"RT @fhollande: «Ensemble, nous pouvons faire bouger les choses» : entretien croisé avec S. Gabriel, président fédéral du #SPD, http://t. ...",2012-03-26 09:09:12,184205351783104512
MarisolTouraine,Je me réjouis des 103M attribués à STMicro. Une nouvelle qui valide le soutien du CG 37 aux projets de recherche et d'innovation !,2012-03-23 21:51:42,183310076424110080
MarisolTouraine,Le sport c'est la santé ! Retrouvez les 30 engagements pour le sport de Francois Hollande http://t.co/wiV5k98l,2012-03-23 20:56:53,183296282633306112
MarisolTouraine,"Ce matin, les élus du Conseil général de l'Indre-et-Loire ont rendu hommage aux victimes de Toulouse et de Montauban : http://t.co/6hlH3PbN",2012-03-23 14:45:37,183202848660656128
MarisolTouraine,RT @fhollande: L'intégralité du discours que j'ai prononcé ce soir à #Aurillac est à retrouver par ici :  http://t.co/E3qzZOzh #FH2012,2012-03-23 14:14:34,183195036115144705
MarisolTouraine,"Horreur, revolte, incompréhension face à la barbarie de #Toulouse. Se rassembler pour refuser la haine et la violence.",2012-03-19 14:54:14,181755463556284416
MarisolTouraine,"De 18h à 18h30, je me rends chez un jeune Tourangeau qui m'interrogera en direct sur la radio @Le_Mouv. Plus d'infos : http://t.co/VF5lNyHJ",2012-03-19 10:49:34,181693892503146496
MarisolTouraine,Nominations au CESE : la « République irréprochable » aux oubliettes ! http://t.co/qEzBVWp2 #Sarkopipo #Hollande2012,2012-03-18 18:05:44,181441270630199299
MarisolTouraine,"""""Le programme de @fhollande en matière de santé et de soin de proximité"""" : interview au Panorama du médecin et egora.fr http://t.co/D51tZu5k",2012-03-18 13:18:06,181368884224458752
MarisolTouraine,"Retrouvez sur ce lien la vidéo de l'émission """"Face aux chrétiens"""" dont j'étais l'invitée jeudi http://t.co/FWEbpUwF",2012-03-17 13:38:38,181011663267442688
MarisolTouraine,"Mon communiqué de presse avec @delphinebatho : """"Une invraisemblable attaque contre le congé maternité"""" http://t.co/Osd0mZTu #Hollande2012",2012-03-16 10:28:06,180601326902849536
MarisolTouraine,"@bribenkemoun merci, à bientôt !",2012-03-15 18:40:21,180362820154699776
MarisolTouraine,Je suis en route pour les studios de @France2tv où j'accompagne @fhollande pour #DPDA,2012-03-15 18:29:03,180359973178589184
MarisolTouraine,RT @partisocialiste: .@MarisolTouraine est l'invitée de @radiorcf à partir de 17h #FH2012,2012-03-15 15:52:36,180320604560433152
MarisolTouraine,"Je suis l'invitée de l’émission """"Face aux Chrétiens"""" diffusée sur RCF à 17h, Radio Notre-Dame à 19h et à 20h40 sur la chaine KTO TV. #FH2012",2012-03-15 15:51:58,180320442270220290
MarisolTouraine,J'étais hier en Seine-et-Marne pour visiter un centre municipal de santé et tenir une réunion publique #FH2012 : http://t.co/vPqhVQNZ,2012-03-15 10:04:47,180233069540818947
MarisolTouraine,"Je suis route pour Bagneaux-sur-Loing (Seine-et-Marne) : visite de deux structures médicales, puis j'anime une réunion publique pour #FH2012",2012-03-14 16:26:34,179966760827617280
MarisolTouraine,RT @fhollande: Un quinquennat n'est pas un stage d'apprentissage! #Valence #FH2012,2012-03-13 12:38:29,179546976021516288
MarisolTouraine,"Vidéo de mon interview à TV Tours le 8 mars, à propos des femmes en politique http://t.co/RN6Vj7AJ",2012-03-11 17:59:29,178902983814291456
MarisolTouraine,"Tout ça pour ça ! Le seul projet de Nicolas Sarkozy est son bilan. Pour redresser la France, il faut changer ! #Sarkothon",2012-03-11 14:50:02,178855306145693696
MarisolTouraine,"RT @fhollande: Je serai ce soir l'invité de l'émission """"Capital"""", à partir de 20h50 en direct sur M6. #FH2012",2012-03-11 14:35:36,178851673580638210
MarisolTouraine,Discours vide ! Seule annonce : sortir de Schengen pour en finir avec l'immigration. La volonté de hold up sur le FN continue... #Sarkothon,2012-03-11 14:20:59,178847993884180481
MarisolTouraine,"#Contraception - Avec #NKM, la droite incarne des valeurs dépassées. http://t.co/uUWg0sCF #Sarkocasuffit",2012-03-10 13:29:02,178472533715202049
MarisolTouraine,"Mon CP : """"Pour masquer son échec social, le Président sortant refait le coup de la chasse aux fraudeurs !"""" http://t.co/0ikQ8cmb #FH2012",2012-03-09 13:14:21,178106452165136384
MarisolTouraine,"Derrière la confusion, le dernier tour de passe-passe de Nicolas Sarkozy : http://t.co/dCXmgCig . #PPE #salaires #FH2012",2012-03-08 10:15:19,177699005881528320
MarisolTouraine,"Je me rends ce matin avec F Hollande dans un planning familial, puis à la maternité des Lilas #journeedelafemme #FH2012",2012-03-08 08:23:13,177670795156398080
MarisolTouraine,En route vers Mâcon (Saône et Loire) pour y animer une réunion publique #FH2012,2012-03-07 17:51:37,177451449461121024
MarisolTouraine,"#ADMD : l'essentiel c'est la clarté des choix. L'aide active à mourir, strictement encadrée: une liberté affirmée pour une dignité préservée",2012-03-07 16:54:42,177437125845843968
MarisolTouraine,#ADMD : campagne que je trouve personnellement inappropriée. Mais le PS n'est pas engagé par le choix d'une association !,2012-03-07 16:43:05,177434205607821312
MarisolTouraine,Mon point de vue sur la campagne présidentielle : http://t.co/ktLPnlVZ #FH2012 #LCCM,2012-03-07 07:24:24,177293607651389441
MarisolTouraine,"""""Un droit sur la fin de vie comme il y a un droit sur l'IVG"""" mon interview publiée samedi dans Libération est en ligne: http://t.co/TXlRs8NE",2012-03-05 10:18:22,176612610278555648
MarisolTouraine,#Contraception - Les déclarations et prises de positions de Nora Berra sont irresponsables et conservatrices : http://t.co/ErmXinnZ #FH2012,2012-03-02 13:47:46,175578145838206976
MarisolTouraine,"Santé mentale, un plan qui sonne comme un aveu d’échec et d’impuissance : http://t.co/I7mij6Zu #FH2012",2012-03-02 13:46:09,175577736977448960
MarisolTouraine,#FF @PKOMITES @ch_brun @LucBroussy @Dhoffmanrispal @jm_leguen @HamouBOUAKKAZ @deputepinville du Pôle Social que je coordonne pour #FH2012 !,2012-03-02 10:17:40,175525271494070272
MarisolTouraine,J'ai répondu à 3 questions d'actualité posées par la rédaction du journal @20minutes. La vidéo ici : http://t.co/kjZkkAX1 #FH2012 #LCCM #PS,2012-03-01 14:40:39,175229066738278400
MarisolTouraine,Retrouvez sur ce lien http://t.co/acnZvhDs le compte rendu du chat organisé par le journal @20minutes. Echange très intéressant. #FH2012 #PS,2012-02-29 13:19:38,174846287496228864
MarisolTouraine,"Retrouvez ma tribune """"Bien vieillir, un défi à relever"""" : http://t.co/FAdBtZQQ cc @fhollande #FH2012 #LCCP",2012-02-28 18:14:08,174558015914119168
MarisolTouraine,"RT @fhollande: J'ai annoncé hier qu'au-delà d'1 million d'euros, l'argent gagné sera imposé à 75% : http://t.co/GpL01YXZ #FH2012",2012-02-28 15:16:16,174513254268280833
MarisolTouraine,Mon débat avec Jean Leonetti sur le droit à une fin de vie digne publié dans l'Express : http://t.co/wApzntVG #FH2012,2012-02-23 16:06:24,172713930513321984
MarisolTouraine,Il faut redonner un élan à la recherche sur les sciences du vivant : http://t.co/U8syWhHU #FH2012 #LCCM,2012-02-23 09:29:09,172613959843708928
MarisolTouraine,.@fhollande rappelle ses engagements en faveur des personnes en situation de handicap à l’APF : http://t.co/OrdpSjYX #FH2012,2012-02-23 08:51:02,172604367453683712
MarisolTouraine,Ce qu'il dit sur la recherche est la preuve même que F Hollande est le candidat de l'avenir http://t.co/KJ0vhGmc #FH2012 cc @ThomasWieder,2012-02-22 17:22:01,172370570271408128
MarisolTouraine,En route pour le Génopôle d'Evry avec François Hollande #FH2012 #LCCM,2012-02-22 13:15:02,172308418533662721
MarisolTouraine,J'étais l'invitée de la matinale de RFI ce matin. J'ai abordé les questions européennes et la campagne : http://t.co/xq4sO2et #FH2012,2012-02-22 10:03:03,172260101896417284
MarisolTouraine,"Mon entretien avec La Croix, publié demain, à propos de la fin de vie et de l'égalité des droits pour tous http://t.co/wTJH6xfh #FH2012",2012-02-21 18:56:06,172031862989008897
MarisolTouraine,"Je serai, demain matin, l'invitée de la matinale de RFI à partir de 8h20. #FH2012 #LCCM",2012-02-21 13:28:16,171949360978984960
MarisolTouraine,"Ce soir, je suis l'invitée du """"téléphone sonne"""" à 19h20 sur France Inter pour parler des déserts médicaux http://t.co/vrAdKCxy #FH2012",2012-02-20 08:00:32,171504493375143936
MarisolTouraine,Retraites : un bilan en forme de reniement permanent  #sarkocasuffit ! @fhollande dit la vérité et s'engage #FH2012 ! http://t.co/ast6aJYW,2012-02-18 11:34:48,170833640564076544
MarisolTouraine,"Devant MG France, Philippe Juvin (UMP) propose d'instaurer des franchises a l'entrée des urgences à l'hopital ! #FH2012 #LCCM",2012-02-16 15:56:40,170174765229817856
MarisolTouraine,"Je suis actuellement au colloque """"les soins de premier recours en questions"""" organisé par le Syndicat des Médecins Généralistes",2012-02-16 15:55:46,170174539186180097
MarisolTouraine,En route pour le meeting de François Hollande à Rouen. #FH2012 #LCCM,2012-02-15 17:11:13,169831137319985152
MarisolTouraine,Nicolas Sarkozy n’a pas d’autre conviction que la conquête du pouvoir. Mon interview sur LCI : http://t.co/a1vBeG6s #FH2012,2012-02-14 18:15:47,169484998980808704
MarisolTouraine,Retrouvez-moi dans 15 minutes sur LCI pour le oui/non de Michel Field. #FH2012 #LCCM,2012-02-14 17:16:40,169470120803053568
MarisolTouraine,"Je serai l'invitée du Oui/Non de Michel Field, aujourd'hui à 18h30 sur LCI. #FH2012 #LCCM",2012-02-14 09:25:43,169351603437051904
MarisolTouraine,"Mon interview au journal La Nouvelle République - """"François Hollande : exigeant, accessible, drôle"""". http://t.co/Qrtgk47W #FH2012 #PS",2012-02-13 16:07:27,169090316832489473
MarisolTouraine,"Je débats demain avec Hervé Novelli à 11h30 sur France 3 Région Centre. Social, éducation et politique énergétique. #FH2012 #regioncentre",2012-02-10 17:41:34,168026835739885568
MarisolTouraine,RT @mutualite_fr: Vidéo : @MarisolTouraine présente les priorités santé du candidat @fhollande cc @partisocialiste @anthoaly http://t.co ...,2012-02-10 07:27:43,167872355488636931
MarisolTouraine,Quand Nicolas Sarkozy mène une politique du dédain... http://t.co/P3FygtQP #FH2012 #dépendance #inaction,2012-02-09 20:57:10,167713674012790785
MarisolTouraine,Les contours et les précisions sur le projet politique de santé porté par @fhollande http://t.co/zNUFbd4f #FH2012,2012-02-09 17:42:11,167664605567528960
MarisolTouraine,RT @Dhoffmanrispal: La politique du dédain #FH2012 communiqué avec @MarisolTouraine http://t.co/ToygeEsj via @fhollande,2012-02-09 14:37:22,167618096071323649
MarisolTouraine,Mon interview à la Gazette Santé-social sur les orientations des politiques sociales voulues par @fhollande. http://t.co/Wlnw8YXW #FH2012,2012-02-09 11:31:42,167571369192726528
MarisolTouraine,"Arrivée à la Maison de la chimie. Débat  avec UMP, EELV et Modem """"Votre santé en 2012"""" organisé par @mutualite_fr. #FH2012 #PS",2012-02-08 17:09:31,167293995721031681
MarisolTouraine,N.Sarkozy a dégradé la médecine scolaire. @fhollande propose une réforme ambitieuse : http://t.co/JqBpXKXl #FH2012,2012-02-08 15:31:44,167269386971914240
MarisolTouraine,Les familles françaises n’ont rien gagné avec la droite. @fhollande propose une politique ambitieuse et volontariste http://t.co/uAYaITr6,2012-02-08 10:55:21,167199835903102976
MarisolTouraine,RT @fhollande Les différents extraits http://t.co/U9eKibgh de mon intervention ce soir au journal de 20 heures de France 2. #FH2012,2012-02-08 08:41:33,167166162336088064
MarisolTouraine,"Je serai, de 17h à 18h, en direct sur Radio Orient pour répondre aux questions des journalistes et des auditeurs. #FH2012 #PS",2012-02-07 14:26:41,166890628804915200
MarisolTouraine,"Après avoir fustigé les acquis de la gauche, N Sarkozy se réfère aujourd'hui au Front Populaire. Une vraie constance dans l'inconstance.",2012-02-07 13:49:56,166881379462819841
MarisolTouraine,"N Sarkozy se veut Président protecteur des familles. On l'a vu protéger la sienne (EPAD pour Jean), mais pour les autres on attend toujours!",2012-02-07 13:06:34,166870467288899586
MarisolTouraine,"Face au froid, Nora Berra recommande aux sans abri de ne pas sortir : humour noir ? Atterrant. #FH2012",2012-02-07 08:07:57,166795319194034176
MarisolTouraine,RT @mutualite_fr: Marisol Touraine débat avec la Mutualité le 8 février à Paris cc @anthoaly @MarisolTouraine @fhollande @partisocialist ...,2012-02-06 22:36:31,166651510736949248
MarisolTouraine,Le logement social est une priorité du CG. Je regrette la ponction de 1.150.000 euros opérée par l'Etat sur VTH : http://t.co/lvuVHTSU,2012-02-06 16:34:08,166560317751566337
MarisolTouraine,Le projet de @fhollande pour la santé : http://t.co/M5DUSTr9 #FH2012 #PS,2012-02-03 13:53:08,165432633839464448
MarisolTouraine,"#FF @ch_brun @Dhoffmanrispal @jm_leguen @LucBroussy @HamouBOUAKKAZ @deputepinville, membres du Pôle Social que je coordonne pour #FH2012 !",2012-02-03 10:04:35,165375118242099200
MarisolTouraine,Les temps forts de mon déplacement d'hier avec @fhollande sur la thématique de la Santé sont à retrouver ici : http://t.co/wp6f6oQP #FH2012,2012-02-03 09:01:18,165359193354805249
MarisolTouraine,"RT @fhollande: J'arrive à l'hôpital Robert Debré, aux urgences pédiatriques, pour dialoguer avec les personnels de #santé. #FH2012 http: ...",2012-02-02 13:59:39,165071886512959488
MarisolTouraine,Je visite actuellement l'hôpital Robert Debré avec F Hollande. Nous nous rendrons ensuite à l'Institut de la vision. #FH2012 #PS,2012-02-02 13:35:12,165065736379830272
MarisolTouraine,Le quotient familial avantage les familles très aisées. Il faut le corriger sans le remettre en cause. http://t.co/cb9NNytf #FH2012,2012-02-01 09:53:54,164647656466026496
MarisolTouraine,Campagne de François Hollande : forte affluence au Forum Santé organisé a la Maison de l'Amérique latine ! #FH2012 #PS,2012-02-01 08:59:18,164633913074003968
MarisolTouraine,Je serai demain l'invitée du journal de 12h30 de @france_culture. #FH2012 #PS,2012-01-31 22:01:23,164468344446132224
MarisolTouraine,"F Hollande et moi recevons maintenant, toujours au QG, les représentants de la Confédération des Syndicats Médicaux Français. #FH2012 #PS",2012-01-31 15:08:12,164364364785270784
MarisolTouraine,"F Hollande et moi recevons dans quelques minutes, au QG, les initiateurs du """"Manifeste pour une santé égalitaire et solidaire"""" #FH2012",2012-01-31 09:24:28,164277858720677888
MarisolTouraine,J'interviendrai demain matin à 7h30 dans la matinale de Sud Radio,2012-01-30 18:16:01,164049239612194816
MarisolTouraine,L'ump doit frissonner : le magicien ne fait plus illusion !  #sarkoshow,2012-01-29 20:25:43,163719493019897856
MarisolTouraine,Tout ça pour ça ! Le teasing continue... #sakoshow,2012-01-29 20:24:42,163719235309281280
MarisolTouraine,« Xavier Bertrand veut publier dans la presse le nom des fraudeurs aux allocations » http://t.co/EKXREHHd via @francetvinfo,2012-01-28 12:46:27,163241526170890242
MarisolTouraine,"Mon communiqué suite aux propos de X. Bertrand http://t.co/m2aMUEWS
#FH2012 #PS #changement",2012-01-28 11:29:59,163222284667072512
MarisolTouraine,"X. Bertrand obsédé par la fraude aux allocations, veut publier les noms des fraudeurs dans les journaux. A quand une prime a la délation ?",2012-01-27 18:03:53,162959022113296384
MarisolTouraine,"François Hollande à son meilleur, le match du soir tient toutes ses promesses.  #FH2012 #DPDA #changement",2012-01-26 21:26:15,162647562397032450
MarisolTouraine,"François Hollande implacable face à  Juppe, qui fait tout pour ne pas le laisser parler ! #FH2012 #DPDA #changement",2012-01-26 21:25:02,162647255881494528
MarisolTouraine,"Dans le train, en route pour rejoindre @fhollande aux studios de @France2tv. #DPDA #FH2012 #changement",2012-01-26 17:41:40,162591045778026496
MarisolTouraine,En route pour la présentation du Projet présidentiel de François Hollande à la Maison des Métallos ! #FH2012 #2012 #PS #changement,2012-01-26 10:08:22,162476966862274560
MarisolTouraine,"Je serai l'invitée de Danièle Sportiello à 14h50, en introduction des Questions au Gouvernement, sur France 3 aujourd'hui. #FH2012 #PS #QAG",2012-01-25 11:00:00,162127575773224962
MarisolTouraine,"Fillon ne recule devant rien : le discours de F Hollande """"est criminel"""" ! C'est panique à bord... #FH2012 #UMPanique",2012-01-24 13:48:37,161807621156913152
MarisolTouraine,Signature de la charte qualité départementale pour que les personnes âgées ou handicapées soient mieux accompagnées : http://t.co/INDFIiB3,2012-01-24 11:16:00,161769211054653440
MarisolTouraine,Je viens d'arriver à Toulon avec @fhollande pour une visite d'une journée. #FH2012 #PS,2012-01-24 10:54:19,161763755275988992
MarisolTouraine,Retrouvez sur mon blog les principales mesures annoncées par @fhollande au #Bourget : http://t.co/0NZfg3nu #FH2012,2012-01-23 12:22:55,161423664733102080
MarisolTouraine,"Après Gandrange,Yssingeaux. Symboles des mensonges d'une
droite responsable de la suppression de 400000 emplois industriels en
5 ans #Lejaby",2012-01-19 15:13:37,160017070317244416
MarisolTouraine,"désolée, @vpecresse , les syndicats ne semblent pas emballés par le sommet auquel ils ont été convoqués !",2012-01-19 11:55:49,159967295391793152
MarisolTouraine,Sommet social : une gesticulation de campagne et une opération de communication - http://t.co/fwhcFjts #FH2012 #PS,2012-01-19 10:12:40,159941335653171200
MarisolTouraine,Je serai l’invitée ce soir à 19h30 de l'émission « Pile et Face » sur @LCPan au sujet des résultats du sommet social. #FH2012 #PS,2012-01-19 10:02:24,159938750510665728
MarisolTouraine,"""""L'enterrement de la politique de Sarkozy"""" : mon interview au Journal du Dimanche sur le sommet social http://t.co/pG9aTnXa #FH2012 #PS",2012-01-18 17:42:36,159692176601792512
MarisolTouraine,"Je tiens un point presse sur le sommet social avec M. Aubry au siège du Parti Socialiste, à suivre en direct sur le site du PS. #FH2012 #PS",2012-01-18 16:08:01,159668372685066240
MarisolTouraine,J'interviendrai sur Itélé à propos du #sommetcrise en direct depuis l'Assemblée nationale à 14h30. #FH2012 #PS,2012-01-18 11:32:28,159599028894576640
MarisolTouraine,Je débattrai avec Philippe Marini sur Europe 1 à 12h30. #sommetcrise #FH2012 #PS,2012-01-18 11:02:49,159591568335052800
MarisolTouraine,Sur mon blog - Ce sommet a été conçu comme une gesticulation de campagne : http://t.co/ZX0h0VBr #FH2012,2012-01-17 17:15:58,159323087068864512
MarisolTouraine,"«Ce sommet est une gesticulation de campagne», mon interview à 20 minutes à propos du sommet social de demain http://t.co/rRfAWpNA #FH2012",2012-01-17 12:47:39,159255563379802113
MarisolTouraine,"Je serai l'invitée du journal de 19h de Public Sénat ce soir, et débattrai avec Marc-Philippe Daubresse. #FH2012 #PS",2012-01-17 10:16:50,159217609680764929
MarisolTouraine,"A droite, c'est le concours Lépine de la régression sociale : congés payés en moins, heures de travail en plus, qui dit mieux ? #FH2012",2012-01-16 13:00:51,158896496287289344
