screenName,text,created,id
MarisolTouraine,Lutte contre les #violencesfemmes : du concret et de premiers résultats https://t.co/hwC4NLWTeg #25novembre,2015-11-25 10:53:21,669468911147044864
MarisolTouraine,"Je dis aux femmes victimes qu’elles peuvent en parler : appelez le 3919, numéro dispo 7/7 ! Pas de tabou, pas de fatalité ! #25novembre",2015-11-25 10:52:35,669468718905368576
MarisolTouraine,"Les #violencesfemmes ne sont pas des faits divers, ni des faits isolés. Le gouvernement est déterminé à les faire disparaître. #25novembre",2015-11-25 10:51:53,669468544510394368
MarisolTouraine,"Harcèlement dans les transports : témoignez grâce au hashtag #HarcèlementAgissons sur les différentes façons de dire """"Stop, ça suffit"""" !",2015-11-09 14:34:27,663726349610299392
MarisolTouraine,Vous avez été victime de harcèlement dans les transports ? Quelques clés pour réagir : https://t.co/K77lre7YOl #HarcèlementAgissons,2015-11-09 14:34:10,663726277745106948
MarisolTouraine,Participez à la campagne #HarcèlementAgissons ! Tous les outils de sensibilisation à relayer sont ici --&gt; https://t.co/ZJt4OVWBE3,2015-11-09 14:33:46,663726175865446400
MarisolTouraine,"Être harcelée dans les transports n’est pas une fatalité ! Femmes et hommes, nous pouvons nous y opposer ! #HarcèlementAgissons",2015-11-09 14:32:03,663725745873776641
MarisolTouraine,"Pour la première fois, dans les grandes villes de France, une campagne brise le tabou du #harcèlement sexiste dans les transports en commun.",2015-11-09 14:31:42,663725658141511680
MarisolTouraine,Le @gouvernementFR a lancé ce matin la campagne #HarcèlementAgissons. RDV sur https://t.co/in85lQ94g0 ! cc @Pascaleboistard @AVidalies,2015-11-09 14:29:19,663725055801745408
MarisolTouraine,"#DonDuSang des homosexuels : """"Ne pas m'arrêter là"""" - Ma tribune sur @LeHuffPost à lire ici https://t.co/8v6Q0CVhH9",2015-11-06 09:09:41,662557452605476865
MarisolTouraine,RT @gouvernementFR: Un numéro à diffuser autour de vous pour dire #NonAuHarcelement scolaire &gt;&gt; 3020 https://t.co/V0NZXgpy7N https://t.co/Z…,2015-11-05 16:29:38,662305783477092353
MarisolTouraine,Dans quelques instants en direct dans @cavousf5 sur @France5tv. #DonDuSang,2015-11-04 17:53:12,661964425113530368
MarisolTouraine,"Sur mon blog : """"Don du sang des homosexuels : la fin d'une discrimination"""" https://t.co/qbp463lnHZ",2015-11-04 16:03:08,661936725753733120
MarisolTouraine,"Je serai l'invitée d'@aslapix dans l'émission @cavousf5, à partir de 19h sur @France5tv. #DonDuSang",2015-11-04 15:58:46,661935626263076864
MarisolTouraine,"Merci @assoAIDES, @InterLGBT, #CISS et aux autres associations qui soutiennent ce dispositif par étapes que j'ai annoncé pour le #DonDuSang",2015-11-04 10:34:36,661854049189371905
MarisolTouraine,"1/ Don de plasma aligné sur les hétéros dès 2016. 2/ Don de sang total : 2 étapes, avec études scientifiques pour aligner en 2017 #DonDuSang",2015-11-04 10:33:56,661853880817459201
MarisolTouraine,Fière et heureuse de lever enfin l'exclusion du don du sang des homosexuels. Fin d'une discrimination et d'un tabou. https://t.co/EHhkVEyxzO,2015-11-04 09:38:01,661839808411619328
MarisolTouraine,"À partir de 18h40, je serai l'invitée de @LaurenceFerrari dans l'émission #TirsCroisés sur @itele",2015-10-28 13:29:48,659361422137303040
MarisolTouraine,Immense tristesse face à ce terrible accident. Soutien aux familles qui ont perdu un proche. Solidarité avec les blessés. #Puisseguin,2015-10-23 08:22:33,657472162236866560
MarisolTouraine,"Ce matin sur #RTL, le Président @fhollande s’est montré à la fois offensif et rassembleur: le dialogue social pour faire avancer la France!",2015-10-19 09:55:33,656046016861503488
MarisolTouraine,#COP21 : aucune page nouvelle dans la lutte contre le changement climatique ne pourra s’écrire sans les femmes : http://t.co/U1qPNdo3MK,2015-10-16 17:11:45,655068623820750848
MarisolTouraine,Un immense merci à Julie Gayet pour son engagement à nos côtés. #IVGcestmondroit http://t.co/gX37whEUsZ,2015-10-16 16:03:05,655051343246303233
MarisolTouraine,"Une loi qui protège les prostituées et responsabilise les clients est nécessaire. Avec @Pascaleboistard, je reste déterminée.",2015-10-14 20:06:36,654387851287728128
MarisolTouraine,"RT @Minist_Sante: [Rapport @CNNum] """"Mon ambition : donner à la révolution numérique tous les moyens de s’exprimer"""" @MarisolTouraine http://…",2015-10-13 16:42:52,653974191138586624
MarisolTouraine,".@FrancoisFillon, la France """"à prendre"""" et les femmes : énième épisode de la série """"La droite sexiste se lâche"""". Consternant.",2015-10-12 13:55:11,653569605202481152
MarisolTouraine,RT @LesEchos: Marisol Touraine débloque 40 millions d'euros pour les soins palliatifs http://t.co/2lCpO7WKB6 http://t.co/WgEyyKovVJ,2015-10-11 15:13:38,653226960542416896
MarisolTouraine,"Réunion avec les ministres de la Santé du G7, à Berlin. Au menu notamment : les conséquences de l'antibiorésistance. http://t.co/5qDnUhULcy",2015-10-08 13:40:03,652116244682940417
MarisolTouraine,Une nouvelle aide pour que les #chibanis puissent choisir librement leur lieu de résidence. http://t.co/3kHiRcMMbx #duprogrès cc @ABachelay,2015-10-08 09:53:25,652059210226794496
MarisolTouraine,Je soutiens le #PasteurDon: mobilisons-nous au 3620 &amp; sur http://t.co/WtTzCOsGpI pour la recherche contre les virus! http://t.co/nbf0tK0NTu,2015-10-07 15:20:12,651779062365573120
MarisolTouraine,"RT @LCPan: - @MarisolTouraine """"Pour la première fois depuis 2004, la branche retraite de la Sécu sera excédentaire""""#Parlementair http://t.c…",2015-10-07 15:16:02,651778012539715584
MarisolTouraine,Retrouvez mon discours à l'occasion des #70ansSécu ici http://t.co/83iGVcPcZc http://t.co/dgCLCV4MS5,2015-10-06 15:05:56,651413082086969344
MarisolTouraine,Mon message aux startupers qui ont des projets d'innovation en santé : lancez vous ! https://t.co/cBOPjAIAJE,2015-10-05 16:05:47,651065755937710081
MarisolTouraine,"A vos agendas: les 23/24 janvier à la @citedessciences je lance les """"journées de l'innovation en santé"""". #innovation #startups #madeinfrance",2015-10-05 11:02:43,650989490522169344
MarisolTouraine,"Je vais lancer, avec L Schweitzer, un fonds de 100M€ pour soutenir les jeunes start ups innovantes de la santé. #innovation #madeinfrance",2015-10-05 10:45:51,650985245714587648
MarisolTouraine,"Dès 2016, toutes les femmes avec un risque élevé de cancer du sein seront dépistées gratuitement #OctobreRose",2015-09-29 09:21:52,648789782181580800
MarisolTouraine,RT @manuelvalls: Ne l'oublions jamais : les femmes sont libres de disposer de leur corps. #IVGcestmondroit http://t.co/khP2vhmB7b,2015-09-28 18:41:38,648568263031525376
MarisolTouraine,Nous lançons une campagne pour informer les femmes et lutter contre les idées reçues sur l'IVG #IVGcestmondroit http://t.co/KwBeewFb1A,2015-09-28 09:45:12,648433264647143424
MarisolTouraine,"Nous créons le 0800 08 11 11, un n° national anonyme &amp; gratuit pour informer les femmes sur sexualité, contraception et IVG #IVGcestmondroit",2015-09-28 09:41:10,648432250799923200
MarisolTouraine,"Journée mondiale droit à l'avortement. Mon message aux femmes : votre corps vous appartient, l'IVG c'est votre droit! http://t.co/ZgO0hwp0BF",2015-09-28 09:39:51,648431920280436736
MarisolTouraine,"En 2016, tout parent isolé aura droit à une pension alimentaire de 100€/enfant garantie par l'Etat. Là encore, un nouveau progrès concret.",2015-09-24 17:11:31,647096034313814020
MarisolTouraine,La gratuité de la contraception pour les mineures sera étendue aux consultations et analyses qui lui sont liées. Encore un progrès concret !,2015-09-24 17:11:16,647095971676094464
MarisolTouraine,"En 2016, un dispositif nouveau permettra aux +65 ans et aux salariés précaires d'avoir une complémentaire santé moins chère. Progrès concret",2015-09-24 17:10:50,647095860443090945
MarisolTouraine,"Des économies, oui, mais pas sur le dos des Français : + de droits, + de protection, + de prise en charge ! #PLFSS2016",2015-09-24 17:10:31,647095782693281792
MarisolTouraine,"Par nos réformes, nous avons rétabli les comptes du régime des retraites : nous le devions aux Français, nous l'avons fait ! #PLFSS2016",2015-09-24 17:10:19,647095730163814400
MarisolTouraine,Fière de ramener le déficit de la Sécu sous la barre des 10 Mds € en 2016 : c'est moitié moins qu'en 2011 ! #PLFSS2016,2015-09-24 17:10:00,647095650321104897
MarisolTouraine,Je serai l’invitée de @JP_Elkabbach demain matin à 8h18 sur @Europe1 #E1matin,2015-09-23 18:46:31,646757554601771009
MarisolTouraine,"#Diesel : scandale de la tricherie face à l'exigence de santé publique. Il faut une enquête, large et transparente.",2015-09-22 11:00:29,646277884378787840
MarisolTouraine,Droit opposable à la retraite / RSI : @BrunoLeMaire propose une mesure...déjà adoptée !,2015-09-21 09:42:16,645895814372528128
MarisolTouraine,Mon bureau vous est ouvert demain pour les #JEP2015 ! Rendez-vous au 14 avenue Duquesne :-) #journeesdupatrimoine http://t.co/y10T1yyz7C,2015-09-18 19:34:24,644957665949560832
MarisolTouraine,"Après l'AN, le Sénat supprime le délai de réflexion #IVG. Un pas immense pr la liberté des femmes. Fière de l'avoir fait voter en #LoiSanté!",2015-09-18 15:28:46,644895847352827904
MarisolTouraine,Heureuse que le Sénat ait finalement accepté de réintroduire dans la #LoiSanté la fin de la discrimination au don du sang des homosexuels.,2015-09-17 09:31:05,644443445126426624
MarisolTouraine,Je serai l’invitée d’Olivier Mazerolle sur @RTLFrance demain matin à partir de 7h50,2015-09-16 17:01:02,644194292735606784
MarisolTouraine,La part des dépenses de #santé supportée par les Français en baisse depuis 2012 : des progrès pour l'accès aux soins http://t.co/en7ngLQTDH,2015-09-15 11:08:44,643743246183739392
MarisolTouraine,Je serai l'invitée de @Roland_Sicard sur @France2tv dans #les4vérités demain matin à partir de 7h38,2015-09-14 16:20:52,643459406617780224
MarisolTouraine,Les autotests de dépistage du #Sida disponibles dès demain en pharmacie : restons mobilisés ! http://t.co/wCOkNn19aa,2015-09-14 14:19:11,643428785870737408
MarisolTouraine,J'introduis de nouvelles mesures dans la #LoiSanté pour obtenir un rdv plus rapidement chez l'ophtalmo ! http://t.co/Lfy0NCWwaR,2015-09-11 15:41:28,642362327858327552
MarisolTouraine,Je serai l'invitée de #GuillaumeDurand demain matin à 8h15 en direct sur @radioclassique et @LCI .,2015-09-07 15:48:49,640914625786159105
MarisolTouraine,"RT @Madamefigaro: """"Une femme sur trois victime de violence dans le monde"""", selon @MarisolTouraine
http://t.co/w8JE0PT0P5 #femmes http://t.c…",2015-09-07 12:21:44,640862512431398912
MarisolTouraine,"RT @afpfr: Une femme sur trois victime de violence dans le monde, déplore @MarisolTouraine http://t.co/KAQM6W4sfO #AFP",2015-09-04 19:37:38,639885045742891008
MarisolTouraine,"35% de femmes dans les conseils d'administration des entreprises du CAC 40, contre 30% en 2014 : l'égalité est en marche !",2015-09-04 10:28:55,639746960027729920
MarisolTouraine,Félicitations chère @MyriamElKhomri ! :-),2015-09-02 11:19:32,639034920401244160
MarisolTouraine,Photo de groupe avec des militants du Mouvement des jeunes socialistes qui m'ont invitée à échanger sur le réformisme http://t.co/M9888HdftD,2015-08-29 19:11:39,637704182422728704
MarisolTouraine,"Intervention aux #UEPS La Rochelle sur la République et l'Egalité. Les résultats sont là, notre détermination totale http://t.co/FeDTlMBOnb",2015-08-29 17:45:19,637682454237724672
MarisolTouraine,Passage au déjeuner @ps37_fr à La Rochelle. Sympa de se retrouver entre militants tourangeaux aux #UEPS ! :-) http://t.co/Vn5LCxCXEf,2015-08-29 13:07:08,637612447222865920
MarisolTouraine,#Loidu4août pour l'#égaliteFH : 1 an de réalisations qui facilitent la vie des Françaises et renforcent leurs droits http://t.co/nI6wyoMueS,2015-08-04 08:03:24,628476315893673984
MarisolTouraine,"A Brasilia, avec le Min de la Santé A Chioro. Échanges constructifs sur le tabac, l'innovation, la sécurité sanitaire http://t.co/KggRP5EPMJ",2015-07-24 13:22:18,624570301305757696
MarisolTouraine,A la maison des femmes de Brasilia : une prise en charge complète pour les femmes victimes de violence. Un modèle ! http://t.co/odJ7dQeRj3,2015-07-24 12:53:28,624563046275543040
MarisolTouraine,"RT @MDSComunicacao: Ministra Tereza Campello encontra com ministra de Assuntos Sociais da França, @MarisolTouraine. http://t.co/b4kTY4qSDH",2015-07-23 13:25:32,624208727260942336
MarisolTouraine,"À Rio, visite passionnante du centre de santé de la favela de la Rocinha, avec la Secrétaire à la Santé de la ville. http://t.co/bUZEx1tEer",2015-07-23 10:41:47,624167517280411648
MarisolTouraine,RT @JaneEllison: Our host @MarisolTouraine leads the press conference on tobacco control w @BentHHoyre @DrJamesReilly @AgnetaKarlsson https…,2015-07-21 09:54:45,623430904757780480
MarisolTouraine,J'ai réuni ce matin des Ministres de la Santé du monde entier pour soutenir le paquet neutre. #GenerationSansTabac http://t.co/giJTuZycMA,2015-07-20 13:37:12,623124498192146432
MarisolTouraine,Splendide ! Hommage à nos soldats et forces de l'ordre ! http://t.co/DblIPXiXFC,2015-07-14 10:01:25,620895869345337344
MarisolTouraine,Magnifique défilé. Fierté en ce jour de fête nationale. Beau 14 juillet à tous !  http://t.co/OSWg8Ig8a6,2015-07-14 09:57:40,620894923135537152
MarisolTouraine,"Il y a 50 ans, l'émancipation économique des femmes faisait un grand pas. Aujourd'hui, ces droits continuent de progresser !",2015-07-13 15:13:42,620612070770393089
MarisolTouraine,"Le vaccin DTP est obligatoire. Se vacciner, c'est se protéger et protéger les autres. #DirectSenat",2015-07-07 10:53:48,618372337273061376
MarisolTouraine,RT @franceculture: A quels personnages se réfère Marisol Touraine quand elle doit prendre une décision politique?http://t.co/xYw2Nu8OAu htt…,2015-07-03 13:59:59,616969639755694081
MarisolTouraine,RT @S_Mazetier: @MarisolTouraine et @s_neuville partent en maraude avec le SAMU social http://t.co/6LTUAWlxil,2015-07-03 13:44:58,616965861866401792
MarisolTouraine,RT @ANEMF: J'ai décidé de doubler la rémunération de vos gardes #50ansANEMF #JEA2015 @MarisolTouraine http://t.co/68VnIRVW6z,2015-07-02 14:32:59,616615557354377216
MarisolTouraine,RT @Clemence_Mrl: Marisol Touraine annonce le doublement de la rémunération des gardes qui passeront à 39€ au 01/09/2015 puis 52€ en 2016 @…,2015-07-02 14:25:33,616613687340740608
MarisolTouraine,RT @GroupeLaPoste: [CP] Épisode caniculaire : #LaPoste propose des visites de prévention de personnes isolées par les facteurs http://t.co/…,2015-07-01 20:51:07,616348330084433925
MarisolTouraine,"Il faut s'hydrater, protéger nos ainés, ne pas exposer les enfants à la chaleur. J'appelle aussi les entreprises à s’adapter. #canicule",2015-06-29 14:30:14,615527701269581824
MarisolTouraine,Vigilance orange #canicule. Un numéro pour s'informer : 0800 06 66 66. Pouvoirs publics mobilisés. La solidarité de chacun doit être au rdv.,2015-06-29 14:30:00,615527640469012480
MarisolTouraine,Un sternum en céramique posé sur une femme souffrant d'un cancer. Encore une 1ère mondiale qui voit le jour en France ! Bravo à tte l'équipe,2015-06-24 17:14:25,613757080219045888
MarisolTouraine,"Satisfaction que la ppl fin de vie dénaturée ait été rejetée, confiante qu'un consensus soit retrouvé à l'AN pour répondre aux attentes.",2015-06-23 14:02:44,613346451704401920
MarisolTouraine,"Prévention cancers : le test, 3 minutes pour faire le point #jefaisletest cc @Institut_cancer",2015-06-23 10:45:24,613296791224741888
MarisolTouraine,5-0 !! Félicitations aux bleues pour ce superbe match ! En route pour les 8eme de finale ! ⚽️ #AllezLesBleues #ObjectifCanada,2015-06-17 21:55:47,611291172603080704
MarisolTouraine,Journée mondiale des donneurs de sang : mobilisation pour un geste qui contribue à soigner 1 million de malades chaque année #JMDS,2015-06-14 10:12:39,610027058660573184
MarisolTouraine,"La victoire échappe aux Bleues ce soir.  Dommage, mais rien n'est perdu ! On croise les doigts pour mercredi ! #FRACOL #ObjectifCanada",2015-06-13 21:06:36,609829243762155520
MarisolTouraine,"Avec @meuniermichelle et les acteurs de terrain, à la veille de l'examen de la ppl #prostitution par @AssembleeNat http://t.co/IiAT5vnbC3",2015-06-11 16:49:19,609039719121453056
MarisolTouraine,Bravo aux Bleues qui remportent leur premier match ! On lache rien pour le suivant !! ⚽️,2015-06-09 19:39:20,608357729690877952
MarisolTouraine,"Les footballeuses françaises débutent ce jour leur parcours en Coupe du monde. #AllezLesBleues, faites-nous rêver ! #FRAENG #ObjectifCanada",2015-06-09 08:10:26,608184364724318208
MarisolTouraine,J'ai accueilli ce matin la Présidente @PrensaMichelle aux Invalides dans le cadre de sa visite officielle en France http://t.co/XByXJLngR7,2015-06-08 10:58:37,607864300229824512
MarisolTouraine,"Avec les jeunes résidents du Centre thérapeutique """"Prelude"""" à Lille, qui lutte contre les addictions des 14-23 ans. http://t.co/nCqFizRfye",2015-06-04 13:52:15,606458444783206401
MarisolTouraine,"Ce matin avec le Professeur Jean-Jacques Muyembe, aux avant-postes de la lutte contre Ebola depuis 40 ans. http://t.co/3tfq6CC2WG",2015-06-04 08:16:45,606374013972135936
MarisolTouraine,"La télémédecine comme moyen de
lutter contre les déserts médicaux, exemple dans la nouvelle MSP de Ligueil http://t.co/6AhfwD8xUY",2015-05-29 16:32:35,604324467653885952
MarisolTouraine,"Hommage à la Résistance, à celles et ceux qui ont lutté. Reconnaître la place des femmes dans notre Histoire. Immense fierté. #Panthéon",2015-05-27 18:27:53,603628706532347904
MarisolTouraine,Bon courage à tous les étudiants en médecine pour les #ECN2015 ! :-),2015-05-27 13:27:13,603553043251130368
MarisolTouraine,"La prime d'activité, ce sera du concret pour des millions de travailleurs. Plus de 1 500€ en + par an pour un salarié au SMIC. #Progrès",2015-05-26 17:54:15,603257857975439362
MarisolTouraine,Aujourd'hui seuls 5 000 jeunes bénéficient du RSA activité. Demain ils seront 1 million à pouvoir bénéficier de la prime d'activité #Progrès,2015-05-26 17:50:03,603256800234893312
MarisolTouraine,RT @agarcialopezl: AMISTAD Y TRABAJO Secretarias @_MJuan_ @SSalud_mx y @MarisolTouraine @Minist_Sante @SRE_mx @francediplo_ES http://t.co/m…,2015-05-21 11:41:59,601352231447896064
MarisolTouraine,"Je crée un droit opposable à la retraite : si dossier pas traité dans les temps, une estimation de la pension est versée. Mesure de justice",2015-05-19 17:23:41,600713449350529024
MarisolTouraine,RT @RPauvros: Marisol @MarisolTouraine annonce un droit opposable à la retraite du régime général : une protection précieuse pour les retra…,2015-05-19 17:23:38,600713435970691072
MarisolTouraine,".@afpfr Oui, dans le cinéma aussi le sexisme doit reculer. Bravo à N Portman et à celles qui prennent la parole pour dénoncer ce tabou ! ",2015-05-19 06:09:30,600543783206420480
MarisolTouraine,"RT @FranceONUGeneve: @MarisolTouraine : """"an ambitious #climate agreement will be a major deal for #globalhealth """" @francediplo_EN #WHA68 ht…",2015-05-18 15:03:23,600315752785321984
MarisolTouraine,RT @FranceONUGeneve: La Ministre @MarisolTouraine à #Geneve ce jour pour l'Assemblée Mondiale de la Santé --&gt; http://t.co/osBIvVWGOQ http:/…,2015-05-18 08:45:22,600220622204096513
MarisolTouraine,"Tristesse pour les joueuses du @PSG_inside ce soir, mais aussi fierté et reconnaissance. Quel beau parcours ! RDV l'an prochain :-) #FRAPSG",2015-05-14 18:04:09,598911692895035392
MarisolTouraine,"Avec l'équipe féminine du @PSG_inside, pour la Finale de la Ligue des champions ! ⚽️ #AllezParis #FRAPSG #TousParisiennes",2015-05-14 16:50:27,598893146802671617
MarisolTouraine,"""""Journée internationale de l'infirmière"""". Soins, écoute, proximité : hommage à une profession plébiscitée par les Français !",2015-05-12 09:57:39,598064485685993472
MarisolTouraine,Egalité pro femme/homme: le gouvernement amendera la loi dialogue social. Les infos que doivent fournir les entreprises ne disparaîtront pas,2015-05-11 15:57:32,597792665514680320
MarisolTouraine,"Avant visite de @fhollande, signature d'un accord sanitaire. La santé publique au coeur de la relation franco-cubaine http://t.co/xMT4gOVZhU",2015-05-10 08:48:39,597322343850074112
MarisolTouraine,Rencontre avec les chefs de service de l'hopital Hermanos Ameijeiras de La Havane http://t.co/WgGMqZn46N,2015-05-09 19:40:08,597123910447046657
MarisolTouraine,"A Cuba, polyclinique Vedado, en présence du Vice-ministre, de la directrice des soins primaires, et du DG de l'AP-HP http://t.co/IbEDYjwhgT",2015-05-09 19:28:28,597120972005777409
MarisolTouraine,"Bravo à @MEMalouines, 1ère femme PDG de @LCPan !",2015-05-06 18:04:31,596012684249817088
MarisolTouraine,Pour tout savoir sur l'action du @gouvernementFR : http://t.co/iDRdwB03YT - à consulter et à partager ! http://t.co/2pGjK7sTy4,2015-05-06 11:22:55,595911617029746688
MarisolTouraine,"Olympe de Gouges était humaniste, féministe, moderne, tolérante. L'exact inverse de Marine Le Pen. Insupportable tentative de récupération.",2015-05-01 12:21:53,594114518340509696
MarisolTouraine,RT @manuelvalls: Il y a 70 ans les femmes votaient pour la 1ère fois. Aujourd'hui le combat pour l'égalité et la parité se poursuit ! http:…,2015-04-29 10:27:49,593361033386979330
MarisolTouraine,70ème anniversaire du 1er vote des femmes : ma tribune sur @LeHuffPost est à lire ici http://t.co/K3vwVLh0Gf,2015-04-29 10:26:33,593360716352086016
MarisolTouraine,Au stade Charléty pour soutenir l'équipe féminine du @PSG_inside en 1/2 finale de la Ligue des Champions ! #PSGWOL http://t.co/7bRsrcuzSu,2015-04-26 16:20:33,592362638585307139
MarisolTouraine,.@HeleneDarroze meilleure femme cheffe du monde ! Bravo et merci d'être un modèle pour les jeunes femmes qui rêvent d'exercer ce métier.,2015-04-23 10:13:26,591183089784725504
MarisolTouraine,Street lab de l'institut de la vision : la rétine artificielle permet à des patients aveugles de retrouver la vue. http://t.co/pqkvXnKZSr,2015-04-22 13:59:56,590877702627991552
MarisolTouraine,"A l'hôpital des 15-20, j'inaugure la nouvelle IRM, unique en Europe,  pour le traitement des maladies de la vision. http://t.co/y0w0mr41Ez",2015-04-22 13:58:46,590877405327323137
MarisolTouraine,"Merci pour vos messages après @BFMPolitique, et merci à @laurossignol pour sa présence à mes côtés durant l'émission ! :-)",2015-04-19 18:49:54,589863509799886848
MarisolTouraine,"A partir de 18h, je serai l'invitée de  @BFMTV pour #BFMPolitique avec @apollineWakeUp.",2015-04-19 15:00:33,589805792418734080
MarisolTouraine,"""""Ce que la #LoiSanté va changer pour les femmes"""" : mon interview à @aufeminin est en ligne http://t.co/23KfhWjADZ",2015-04-15 08:45:43,588261911562706944
MarisolTouraine,RT @VMassonneau: Fière d'avoir voté le projet de #LoiSanté de @MarisolTouraine : des avancées concrètes pour ts les Français #DirectAN http…,2015-04-14 16:13:04,588012104025841664
MarisolTouraine,Le projet de loi de modernisation de notre système de santé adopté par une belle majorité de gauche à l'AN. Fière et heureuse de ce vote !,2015-04-14 15:07:35,587995621384151040
MarisolTouraine,.@laurentwauquiez Valoriser le travail ce n'est pas mépriser ceux qui n'en ont pas.C'est soutenir les petits salaires ac la prime d'activité,2015-04-13 09:44:51,587552016265846784
MarisolTouraine,".@laurentwauquiez Imaginer qu'on peut choisir de vivre avec 514€/mois, plus que du déni, c'est du mépris. Mais dans quel monde vivez-vous ?!",2015-04-13 09:44:31,587551931226292224
MarisolTouraine,Go Hillary ! ,2015-04-12 20:12:19,587347536735817729
MarisolTouraine,"RT @1213Dimanche: Dans une heure ne manquez pas notre émission politique @1213Dimanche avec @MarisolTouraine, Ministre de la Santé. Rdv à 1…",2015-04-12 08:57:36,587177737468665856
MarisolTouraine,"RT @gerardsebaoun: Fin examen #LoiSante @MarisolTouraine, un txt riche de transformations et de décisions concrètes, un txt de Gauche qui m…",2015-04-11 08:33:40,586809327853383680
MarisolTouraine,"RT @RichardFerrand: Après plus de 60heures de débats, les articles du projet de #LoiSanté porté par @MarisolTouraine ont été adoptés #Direc…",2015-04-11 08:33:29,586809281749643264
MarisolTouraine,RT @manuelvalls: Trop de Français renoncent à se soigner faute de moyens. L'adoption du #TiersPayant chez le médecin est une belle mesure d…,2015-04-09 12:57:42,586150998047088640
MarisolTouraine,Le Tiers Payant pour tous les Français adopté par l'Assemblée nationale. Fière d'avoir porté cette grande mesure de progrès ! #LoiSanté,2015-04-09 11:03:50,586122343426215936
MarisolTouraine,Fière d'avoir donné mon avis favorable à l'amendement visant à lever l'interdiction de donner son sang en raison de son orientation sexuelle,2015-04-03 20:25:19,584089314335797248
MarisolTouraine,"L'UMP rétablit le délit de racolage. Grave régression. Pénaliser les prostituées, c'est les enfermer dans la violence de la #prostitution.",2015-03-30 19:54:00,582631882812207105
MarisolTouraine,Il faut mieux protéger les personnes prostituées et aider celles qui le souhaitent à en sortir. C'est l'enjeu de la loi #prostitution.,2015-03-30 13:15:43,582531652972388352
MarisolTouraine,La prostitution est une violence. L'objectif de la loi #prostitution est de lutter contre les réseaux et l'exploitation du corps des femmes.,2015-03-30 13:15:32,582531605853396992
