screenName,text,created,id
MarisolTouraine,Retrouvez mon interview sur @RTLFrance dans #RTLSoir ce lundi sur mon blog : https://t.co/wzOkjfBKjs #tierspayant,2017-10-23 19:49:56,922550679369023489
MarisolTouraine,"Edmond Maire a été une figure majeure de notre pays, homme chaleureux, dirigeant syndicaliste modernisateur.",2017-10-01 18:27:38,914557433774854145
MarisolTouraine,"Tiens, tiens, prévisions de déficit de la sécu proches de celles du précédent gouvernement. L'été passé, on retombe sur nos jambes  !",2017-09-28 10:04:53,913343748221874176
MarisolTouraine,"Hommage à P. Bergé,grande figure de liberté,de création et d'engagement,notamment contre le sida. Ses combats ont marqué,ils lui survivront.",2017-09-08 09:09:42,906082103112200192
MarisolTouraine,"Grande émotion au décès de Gonzague Saint-Bris,véritable passionné de la Touraine,de la littérature,de la vie. La Forêt des livres en deuil.",2017-08-08 09:19:16,894850486410629121
MarisolTouraine,"Infinie tristesse pour Nicole Bricq, personnalité entière, généreuse, engagée.Souvenirs émus des combats partagés.",2017-08-06 17:06:00,894243168333553664
MarisolTouraine,"Bravo à @agnesbuzyn de reprendre le slogan du sommet de Paris du 20 juillet 2015 !
#generationsanstabac !! https://t.co/HSYzAkESSQ",2017-07-07 15:32:53,883348098420011009
MarisolTouraine,https://t.co/cmv1aUb8fY,2017-07-07 15:31:36,883347777719349249
MarisolTouraine,TPG : souhait que les acteurs participent à l'évaluation positivement pour garantir le système efficace que j'ai tjs porté #justicesociale,2017-07-07 14:20:00,883329756384702466
MarisolTouraine,"Vaccination obligatoire, le travail lancé avec la commission Fischer se poursuit : tenir bon, pour la santé des Français.",2017-07-04 16:31:25,882275668486172672
MarisolTouraine,"Après le paquet neutre, le paquet a 10€ : heureuse que la lutte contre le tabagisme se poursuive. Avancer, vite, pour la santé des Français",2017-07-04 16:31:11,882275608054681600
MarisolTouraine,"IVG, loi Veil devenue loi iconique : une femme s'est battue pour toutes les femmes dans une France et une Assemblée dominées par les hommes",2017-06-30 09:05:48,880713970193137664
MarisolTouraine,"Hommage à Simone Veil, femme de courage et d'engagement pour les droits et libertés des femmes.",2017-06-30 08:57:30,880711883950620675
MarisolTouraine,"Hommage au Professeur Cabrol : grand médecin, grand chercheur et grand humaniste.",2017-06-16 13:23:54,875705495499264000
MarisolTouraine,Solidarité complète avec @nk_m victime d'une agression qui abaisse le débat démocratique. Amicales pensées et prompt rétablissement.,2017-06-15 11:02:24,875307496386310144
MarisolTouraine,"""""L'abstention, une épée de bois"""", article de @NR_Tours sur l'inauguration de mon local de campagne de #montbazon https://t.co/1zqk1AnBtX",2017-05-05 13:53:09,860492566093074432
MarisolTouraine,"""""Notre main ne doit pas trembler, dimanche, et glisser le bulletin @EmmanuelMacron dans l’urne"""". A lire sur mon blog https://t.co/D2akupWBNw",2017-05-02 20:43:08,859508578616520704
MarisolTouraine,C'est une étape majeure en matière de prévention : chacun pourra choisir facilement des aliments bons pour sa santé! https://t.co/GyGvAaRgey,2017-04-27 15:27:50,857617288731742213
MarisolTouraine,"Les industriels s’engagent ajd à mettre en place le NUTRI-SCORE : pour la 1ère fois, un système d’étiquetage simple… https://t.co/tBMhdNMg83",2017-04-27 15:25:01,857616581488246784
MarisolTouraine,"Le 7 mai, sans hésitation, je vote @EmmanuelMacron ! https://t.co/tx8d4UE4JR",2017-04-25 17:18:31,856920367876759552
MarisolTouraine,"Pour nos valeurs démocratiques, l'avenir de la France, le vote pour @EmmanuelMacron doit être le plus élevé possible #Presidentielle2017",2017-04-23 20:07:57,856238232425680896
MarisolTouraine,J'appelle les Français à voter massivement en faveur d'@EmmanuelMacron le 7 mai prochain #Presidentielle2017,2017-04-23 20:06:39,856237906054328320
MarisolTouraine,Ce nveau programme de dépistage organisé du cancer du sein renforce l’info des femmes dès 25 ans et améliore le sui… https://t.co/agaPCgXNv1,2017-04-06 16:08:13,850017308445728770
MarisolTouraine,J’ai signé aujourd’hui la charte d’engagement #LGBT : mon Ministère est pleinement investi ds la lutte contre les d… https://t.co/CFUwmftOHx,2017-04-06 11:32:16,849947863681552386
MarisolTouraine,Je rends hommage à Evelyne Sullerot qui s’est battue toute sa vie pour améliorer l'accès à la contraception et la planification familiale,2017-04-04 14:12:19,849263365017022465
MarisolTouraine,Cette baisse de prix est une nvelle étape importante pour garantir l’accès de ts les malades à des traitements inno… https://t.co/ZRf6uV1Zu1,2017-03-31 09:37:30,847744653600317442
MarisolTouraine,#Endométriose : j'ai signé aujourd’hui une convention de partenariat avec l’association @InformationEndo ⏩… https://t.co/A15E628nle,2017-03-22 16:21:32,844584840905347075
MarisolTouraine,"Échange passionnant avec Andrew Conrad, CEO de Verily, qui révolutionne le monde des objets connectés et dispositif… https://t.co/xZ2dOclpGD",2017-03-17 18:56:06,842811798533357568
MarisolTouraine,"Aujourd'hui, pour la 1ère fois, l’intérêt d’un logo nutritionnel &amp; l’efficacité du logo Nutri-score sont démontrés ! https://t.co/SvLwQwZ823",2017-03-15 09:27:06,841943832770039809
MarisolTouraine,"Nous inaugurons aujourd'hui le Centre de création contemporaine Olivier Debré de Tours, en présence de Sa Majesté l… https://t.co/vWBU0C98dh",2017-03-10 16:39:00,840240583893499904
MarisolTouraine,"2/2 Depuis 2012, des mesures concrètes ont été mises en place pour lutter contre les déserts médicaux.
➕d’infos : https://t.co/UVJQGmX1K0",2017-03-10 13:55:02,840199318434959364
MarisolTouraine,1/2 Déserts médicaux : les dispositifs d’aide à l’installation des médecins couvriront désormais ➕ de territoires ! https://t.co/mdN3r8pPDQ,2017-03-10 13:54:01,840199065107386368
MarisolTouraine,"Le tabac est la 1ère cause de mortalité évitable ds notre pays! Cette mesure vise à protéger les Français, à éviter… https://t.co/HgFtAyfTfY",2017-03-10 11:24:36,840161459640360961
MarisolTouraine,"3/3 Des mesures fortes ont été prises ▶https://t.co/QilgXl0nJr. Ces transformations, nous devons les poursuivre ! #JourneeDesDroitsDesFemmes",2017-03-08 12:15:04,839449387453546496
MarisolTouraine,"2/3 Depuis 5 ans, nous portons haut les valeurs de la gauche #égalité #laïcité #respect ▶https://t.co/QilgXl0nJr #JourneeDesDroitsDesFemmes",2017-03-08 12:14:07,839449146880901121
MarisolTouraine,1/3 Améliorer la protection sociale et la santé des femmes est une priorité pour ce Gouvernement #JourneeDesDroitsDesFemmes,2017-03-08 12:10:35,839448256971177985
MarisolTouraine,"Un médecin, installé en libéral, doit pouvoir accomplir son projet de famille sans préoccupations financières. C’es… https://t.co/REiya2Bnhh",2017-03-02 17:34:35,837355468674707456
MarisolTouraine,"A Paris, avec les sociaux-démocrates européens, nous sommes à l’offensive pour mettre la solidarité sociale au cœur… https://t.co/fYtgiz2iT1",2017-03-02 17:33:40,837355235819532291
MarisolTouraine,Les médecins peuvent désormais prescrire une activité physique aux patients atteints d'une ALD ➡️https://t.co/58bdhbKs51 #sportsurordonnance,2017-03-01 15:16:20,836958287895617536
MarisolTouraine,"Dans @le_Parisien, #Fillon dit que les hospitaliers doivent travailler ➕ en étant payés ➖. Les soignants engagés pour l'hôpital apprécieront",2017-02-21 10:13:01,833982853121789952
MarisolTouraine,"Avec Fillon, pour continuer à se soigner, il faudra donc se payer une grosse assurance et avoir une grosse voiture pour trouver un hôpital.",2017-02-21 09:23:13,833970318704312321
MarisolTouraine,"3/ le mot """"suppression d'hôpitaux"""" remplacé par """"rationalisation de l'offre de soins"""". C'est plus joli, mais c'est pareil : moins d'hôpitaux",2017-02-21 09:22:22,833970107386847232
MarisolTouraine,2/ C'est à travers ce transfert de la sécu au privé que #Fillon entend faire 20Mds€ d'économies. Une taxe en milliers d'€ sur les malades.,2017-02-21 09:21:44,833969948095631364
MarisolTouraine,"1/ le mot """"déremboursement"""" remplacé par une """"agence"""" des assurances, chargée de transférer des soins de la sécu au privé. AXA appréciera.",2017-02-21 09:20:56,833969747024818179
MarisolTouraine,Programme Santé de Fillon : le flou jeté sur la peinture ne masque en rien le tableau d'ensemble. L'objectif reste le même : dérembourser.,2017-02-21 09:19:43,833969439657881600
MarisolTouraine,"2/2 Avec cette campagne, je veux renforcer l’information des Français et leur permettre de s’emparer de leurs droit… https://t.co/8eB3VQh6lJ",2017-02-20 11:27:06,833639106894761986
MarisolTouraine,1/2 Je lance aujourd'hui la campagne nationale d'information #ParlonsFinDeVie ➡️https://t.co/zYVSHu7fvM https://t.co/XyfqI4HH43,2017-02-20 11:25:19,833638660243337217
MarisolTouraine,"Visite également, à Villeloin-Coulangé, de la maison de santé en présence des élus locaux https://t.co/TlnhVmJLUf",2017-02-17 18:53:27,832664274354872320
MarisolTouraine,"A Villeloin-Coulangé, j'ai rencontré cet après-midi les responsables et les résidents de l'Ehpad Les Baraquins. Un… https://t.co/sPJaWytcev",2017-02-17 18:51:34,832663798528016384
MarisolTouraine,J'annonce aujourd'hui aux compagnons d’Emmaüs Touraine un budget complémentaire pr les 24 places de la pension de f… https://t.co/bcmKjqAqEh,2017-02-17 13:42:53,832586116821872640
MarisolTouraine,Droit à l'oubli : l'accès au crédit sera désormais facilité pr les Français ayant été atteints d’une maladie grave➡https://t.co/vLIaztyaFt,2017-02-14 13:31:06,831495988971978752
MarisolTouraine,Heureuse de rendre hommage à Lucien Neuwirth à l'occasion du 50e anniversaire de la loi qui porte son nom #pillule… https://t.co/AoQQbwE6Y3,2017-02-08 18:13:05,829392622280126464
MarisolTouraine,J'inaugure ce matin la journée nationale #InnovationSante ! Venez nombreux @citedessciences ce week-end pour découv… https://t.co/4xmqCjojup,2017-01-28 11:16:36,825301546707648512
MarisolTouraine,#InnovationSanté : ma tribune ce matin dans le Huffington Post. Bienvenue dans la médecine du futur ! https://t.co/9ZtRCTYkTl,2017-01-28 09:24:47,825273405092028416
MarisolTouraine,Ils manifestent contre l'IVG ? Nous avons permis sa prise en charge à 100% et renforcé l'accès partout sur le territoire. Fierté de ce bilan,2017-01-22 16:14:52,823202279952158723
MarisolTouraine,"Une manifestation contre l'IVG, en France,en 2017. Restons vigilants et combatifs pour garantir le droit des femmes à disposer de leur corps",2017-01-22 16:13:11,823201854272241665
MarisolTouraine,Belle visite présidentielle au Chili. Émotion au musée de la mémoire et des droits de l'homme. https://t.co/BQdujcDQ4L,2017-01-22 13:33:32,823161679638892544
MarisolTouraine,"A Paris, à Washington, et  partout dans le monde, les femmes défendent leurs droits. Nous ne céderons jamais.… https://t.co/RzswEFSQ95",2017-01-21 12:33:36,822784207340662785
MarisolTouraine,"L'hôpital public, c'est avant tout des valeurs, des femmes et des hommes qui s'engagent. #DirectAN https://t.co/h0NwNWJuUb via @Dailymotion",2017-01-18 17:15:04,821767876923289600
MarisolTouraine,#Grippe : je remercie les équipes des urgences et de tout le CHU de Tours pour leur mobilisation exemplaire https://t.co/HTSAooYMqd,2017-01-12 17:48:23,819601933744898049
MarisolTouraine,"Remboursements : je dis """"halte à la droite mytho"""" ! https://t.co/trj8QCmnTA",2017-01-09 19:41:07,818543141645127682
MarisolTouraine,"Pour la 1ère fois, les futurs #retraités du régime général peuvent effectuer 100% de leurs démarches en ligne !… https://t.co/txlklapBUU",2017-01-09 12:09:12,818429412387459073
MarisolTouraine,"Donc, cher @EmmanuelMacron, tu proposes x2 en 5 ans ? On vient de faire x10 en 5 ans. Pourquoi ralentir la dynamiqu… https://t.co/Fbu96ZgJ6B",2017-01-06 20:41:44,817471232106962945
MarisolTouraine,"Pour info, cher @EmmanuelMacron, les Français, eux, ont déjà évalué : 73% sont hostiles à sa suppression...! https://t.co/FpK8ybnLyi",2017-01-06 20:13:19,817464082588725252
MarisolTouraine,".@EmmanuelMacron L'objectif est déjà fixé, cher Emmanuel ! Mais tu es le bienvenu. Je n'ai demandé aucun copyright… https://t.co/cWYxe75anx",2017-01-06 19:46:29,817457329805344768
MarisolTouraine,"Profondément émue par la disparition de François Chérèque, un grand syndicaliste, un homme généreux et bienveillant.",2017-01-02 12:09:15,815892713002377222
MarisolTouraine,"3/3 Une avancée sociale majeure pour tous, notamt ceux qui renoncent à se soigner pour raisons financières #égalité #accèsauxsoins #loisanté",2016-12-29 11:46:24,814437407680561152
MarisolTouraine,"2/3 Et à partir du 1er janvier 2017, le #tierspayant peut aussi être proposé à tous les patients : c’est simple, ra… https://t.co/q77bIMhhqu",2016-12-29 11:45:38,814437215115902976
MarisolTouraine,"1/3 À partir du 1er janvier 2017, le #tierspayant devient un droit pour les 11 millions de Français couverts à 100%… https://t.co/3bU0GxoOBf",2016-12-29 11:44:56,814437039802372096
MarisolTouraine,Incendie de Boulogne-Billancourt : pas de mot face à l'horreur. Tout mon soutien aux victimes.,2016-12-16 12:37:48,809739304020873216
MarisolTouraine,"Un ex PM, candidat à la présidentielle, marque sa défiance à la @Courdescomptes et aux organismes indépendants de l… https://t.co/YSIvbFK39b",2016-12-14 10:54:34,808988547529248768
MarisolTouraine,"Souvent Fillon varie, bien fol qui s'y fie. Et quand c'est flou, c'est qu'il y a un... https://t.co/JSpbrXZE7U",2016-12-13 16:56:07,808717146553454593
MarisolTouraine,"dans quel but, sinon leur confier des remboursements que vous retirez à l'assurance maladie ? Les Français peuvent être inquiets. 3/3",2016-12-12 18:34:49,808379598035623936
MarisolTouraine,"mais pire encore, à travers une pseudo """"agence de régulation"""", vous faites entrer les assureurs privés dans le pilotage de la sécu 2/3",2016-12-12 18:34:07,808379419605762048
MarisolTouraine,".@FrancoisFillon Je viens de lire votre texte. Non seulement vous ne renoncez pas à votre projet de déremboursement du """"petit risque"""" 1/3",2016-12-12 18:33:55,808379371694260227
MarisolTouraine,"J Chartier annonce qu'avec #Fillon, seuls certains rhumes seront remboursés. Il veut indexer le remboursement sur le degré d'éternuement ?",2016-12-12 07:48:33,808216957698842624
MarisolTouraine,Si la gauche veut gagner... https://t.co/4aum0iDzFE,2016-12-09 16:53:05,807266832386260993
MarisolTouraine,"""""Le sida est bien une maladie d’aujourd’hui"""" : retrouvez mon interview @TETUmag ici #JournéeMondialeSIDA https://t.co/HdDBKFWpvd",2016-12-01 11:14:58,804282638286684160
MarisolTouraine,"""""Combien vous coûtera le programme de santé publique de François Fillon"""" : ma tribune sur @LeHuffPost est à lire ici https://t.co/116PGoqC1j",2016-11-30 08:07:15,803873011317276673
MarisolTouraine,3/3 Je remercie @StephanTroussel pour son soutien et salue les équipes de l’hôpital Delafontaine pour leur mobilisation sans faille !,2016-11-25 15:50:33,802177663884468225
MarisolTouraine,"2/3 Ce lieu sécurisé offre aux #femmes vulnérables ou victimes de #violences un accueil, un accompagnement &amp; une orientation uniques",2016-11-25 15:48:36,802177172626608128
MarisolTouraine,1/3 J’ai décidé d’attribuer 160 000 € par an pour garantir le fonctionnement de la Maison des Femmes de Saint-Denis,2016-11-25 15:45:28,802176382671450112
MarisolTouraine,"Les #femmes victimes de #violences peuvent en parler : via le 3919, numéro dispo 7/7 ! #25novembre",2016-11-25 14:44:01,802160921963622400
MarisolTouraine,Lutte contre les #violencesfaitesauxfemmes : nous avons désigné 558 référents aux urgences pour améliorer le repérage et la prise en charge,2016-11-25 14:39:10,802159699554693120
MarisolTouraine,"Les #violencesfaitesauxfemmes sont économiques, physiques, morales, sexuelles. Il s’agit de ttes les nommer et de les combattre avec force !",2016-11-25 14:31:22,802157735831883776
MarisolTouraine,J'ai fait chiffrer le programme santé de #Fillon : chaque foyer paiera en moyenne 3200€ de + par an pour se soigner. #Danger #LeGrandDebat,2016-11-24 20:47:05,801889903168602116
MarisolTouraine,"Tiers payant : 15 millions de Français en bénéficient déjà. En 2017, ce sera un droit pour tous. #Juppé veut le supprimer. #antisocial",2016-11-24 20:45:20,801889461894336517
MarisolTouraine,Il y avait 150 maisons de santé en 2012 en France. Il y en aura 1 200 fin 2017. Quelqu'un n'a pas bien lu sa note... #Fillon #LeGrandDebat,2016-11-24 20:42:20,801888707695509504
MarisolTouraine,"François Fillon, les mutuelles sont des organismes privés ! Vous proposez la privatisation de la santé. Assumez le ! #LeGrandDebat",2016-11-24 20:39:36,801888019800268800
MarisolTouraine,"Médecins généralistes au cœur du système, maisons de Santé partout sur le territoire...C'est ce qui est fait depuis 4 ans. #MerciFillon.",2016-11-24 20:31:37,801886008149209088
MarisolTouraine,"Pour la santé publique et contre l'homophobie, je saisis la justice après la censure par certains maires de la campagne de prévention du VIH",2016-11-22 13:22:42,801053293518684160
MarisolTouraine,"Quelques uns refusent de voir 2 hommes ensemble, veulent censurer cette campagne ? Partagez la ! Vos RT sont la + b… https://t.co/ota5olKdVf",2016-11-18 15:08:35,799630385772539904
MarisolTouraine,"Le Sida n'est ni raciste ni homophobe, lui. @assoAIDES https://t.co/Xi9NgLPPwA",2016-11-18 15:06:36,799629889179566080
MarisolTouraine,C'est dit : @NicolasSarkozy veut diminuer les allocations des personnes handicapées #PrimaireLeDebat https://t.co/txM7QnIowg,2016-11-17 21:30:37,799364142616428544
MarisolTouraine,"2/2 J'ai accompagné ce projet de modernisation : 40M€ pour un  hôpital neuf, mieux organisé pour les patients et le… https://t.co/XQjvsAmVDp",2016-11-10 11:15:00,796672503049580548
MarisolTouraine,1/2 Je visite aujourd'hui le chantier du nouveau pavillon de l'hôpital Edouard Herriot à Lyon : ouverture en mars 2… https://t.co/H9Wv0VBA8I,2016-11-10 11:13:09,796672037347622912
MarisolTouraine,2/2 Fière de l'engagement des jeunes médecins libéraux qui s'installent dans la maison de santé de Trélon (Nord). https://t.co/EaVh6syTPu,2016-11-07 15:22:37,795647652427927552
MarisolTouraine,1/2 Trois maisons de santé ouvriront dans le sud Avesnois le 1er déc : près de 50 pros de santé pour le territoire ! https://t.co/odvRLE7xSa,2016-11-07 15:22:03,795647511453204481
MarisolTouraine,"En visite ce matin au CH de Maubeuge, j'annonce 40M€ pour la reconstruction de l'hopital : ouverture en 2020 ! https://t.co/e1qiCcpDK4",2016-11-07 11:51:49,795594604980662272
MarisolTouraine,Je serai l'invitée de @audrey_crespo demain à 8h15 dans la matinale de @LCI #LCImatin,2016-11-01 18:02:17,793513505936797697
MarisolTouraine,Vous ne fumez pas ? Participez quand même à #MoisSansTabac en soutenant vos proches ! https://t.co/S2m1N9rPjT,2016-11-01 13:20:25,793442575034290177
MarisolTouraine,Plus d’un fumeur sur deux souhaite arrêter de fumer : avec #MoisSansTabac on vous aide à arrêter ! https://t.co/Vuj8DIUqhj,2016-11-01 13:19:04,793442232820961280
MarisolTouraine,"Aujourd'hui, c'est le top départ du #MoisSansTabac : rejoignez le mouvement sur https://t.co/UaGdoCGYY9 ! https://t.co/4aUajrTILi",2016-11-01 13:17:42,793441891060768768
MarisolTouraine,"A partir du 1er nov, pour aider à l'arrêt, nous triplons le remboursement des substituts nicotiniques pour tous les fumeurs, de 50 à 150€",2016-10-31 11:30:54,793052625696657408
MarisolTouraine,Déjà 110 000 participants inscrits pour relever le défi #MoisSansTabac. Et vous ? Prêts à vous arrêter ? RDV sur… https://t.co/9E8AxDWypW,2016-10-31 11:25:19,793051220424417282
MarisolTouraine,"Le #MoisSansTabac commence demain : à partir du 1er novembre, on arrête ensemble de fumer pendant 30 jours ! https://t.co/AV69fNLYCR",2016-10-31 11:22:37,793050539156201476
MarisolTouraine,"J'ai lancé hier la plateforme https://t.co/ZnrSdROdfA. Essayez, vous verrez, c’est très simple...et utile !
https://t.co/UAWa5K1Ry4",2016-10-14 10:51:16,786882055204376576
MarisolTouraine,J’encourage chaque Français à créer son compte #retraite sur https://t.co/ZnrSdS5O78 pour bien préparer sa #retraite https://t.co/q510CVhDsK,2016-10-13 12:40:23,786547128017391617
MarisolTouraine,Un outil simple : https://t.co/ZnrSdS5O78 pour que chaque Français puisse estimer le montant de sa #retraite et con… https://t.co/Tb84qeZHuA,2016-10-13 12:38:07,786546558183481344
MarisolTouraine,"3/3 Merci à l'association Gaïa, qui gère cette salle, à la Mairie de @Paris et à tous les partenaires qui se sont mobilisés pour ce projet",2016-10-11 09:21:19,785772254571401216
MarisolTouraine,"2/3 Une avancée de la #loisanté pour les usagers de drogues : moins d'infections, moins d'overdoses et des rues sans seringues",2016-10-11 09:17:29,785771290028367873
MarisolTouraine,1/3 J'ai visité ce matin avec @Anne_Hidalgo la 1ère salle de consommation à moindre risque à Paris https://t.co/c97TF7Rr4e,2016-10-11 09:17:00,785771168900980736
MarisolTouraine,"Pour découvrir l’opération #MoisSansTabac, c’est par ici ► https://t.co/LxFhBatDH2 Cc @MinSocialSante",2016-10-06 13:36:37,784024564665815040
MarisolTouraine,"Pour participer à #MoisSansTabac, il suffit de s’inscrire à partir du 10 octobre sur https://t.co/abnvJXDUbG",2016-10-06 13:34:57,784024147328438272
MarisolTouraine,"Avec #MoisSansTabac, on arrête ensemble de fumer pendant 30 jours à partir du 1er novembre prochain ! https://t.co/uQvk0EwFWm",2016-10-06 13:31:19,784023232244514817
MarisolTouraine,"J’ai lancé ce matin la mobilisation pour #MoisSansTabac, le premier défi de santé publique jamais organisé en France https://t.co/b8eEuZV4Ge",2016-10-06 13:29:01,784022654353305600
MarisolTouraine,"Oui, les comptes de la #Sécu seront bientôt à l’équilibre et c’est grâce à ce gouvernement ! https://t.co/t15LRHi3gu #désintox",2016-10-05 11:03:56,783623754370932736
MarisolTouraine,"Depuis 2012, nous soutenons ceux qui en ont le plus besoin, corrigeons les injustices, créons des droits nouveaux https://t.co/tBtRby8VAR",2016-10-05 11:02:12,783623319316795394
MarisolTouraine,"Sous ce quinquennat, nous aurons sauvé la #Sécu https://t.co/szFWeaofFx",2016-10-05 10:59:53,783622732177113088
MarisolTouraine,"""""Devenir générique, ça se mérite"""" : découvrez le spot TV de la campagne nationale d'information sur les… https://t.co/97wfmYM5IY",2016-09-27 09:20:41,780698665895747584
MarisolTouraine,1/2 Je lance ce matin une campagne d'information nationale sur les #médicamentsgénériques https://t.co/3TSZI59w9w,2016-09-27 09:17:36,780697891702800384
MarisolTouraine,Je serai demain l’invitée de @letellier_ftv dans l'émission @DimPolitique à partir de 12h10 sur @France3tv #DimPol,2016-09-24 15:19:16,779701743378653184
MarisolTouraine,"Sous la droite, le reste à charge des Français n'a cessé d'exploser. Depuis 2012, il ne cesse de baisser...et on ré… https://t.co/8D0y68qouZ",2016-09-23 09:44:41,779255155153928192
MarisolTouraine,"✅ Donc on a rétabli les comptes de la sécu. Mais les comptes ne font pas tout. L'enjeu, c'est la justice. Notre bil… https://t.co/2lWMrKrWTn",2016-09-23 07:42:35,779224427393409024
MarisolTouraine,"« En 2017, il n'y aura plus de trou de la sécu. La gauche fait le job. » Ma tribune est à lire ici :… https://t.co/NyRfahGf3O",2016-09-22 19:21:24,779037904383410176
MarisolTouraine,« Nous avons sauvé la sécurité sociale ». Mon interview aux @LesEchos est à lire ici : https://t.co/jqPty3Uijr https://t.co/58VH8xUgyK,2016-09-22 19:17:55,779037026385526784
MarisolTouraine,[Sur mon blog] Retour sur ma participation au G7 des Ministres de la Santé à Kobé. https://t.co/tZjSLM0HBh https://t.co/xnGGjv5Lmj,2016-09-14 15:21:08,776078336762208256
MarisolTouraine,"En marge du G7 de #Kobe, j'échange avec @janephilpott. Après la France, le Canada s'engage vers le paquet neutre. https://t.co/XJsaZQS6Nw",2016-09-11 14:45:01,774982081046679552
MarisolTouraine,"Début de la réunion des Ministres de la Santé du G7 à Kobé. Innovation, recherche, antibiorésistance. https://t.co/NgsyFcr7CQ",2016-09-11 08:59:52,774895223876956160
MarisolTouraine,"RT @ambafrancejp: Mme @MarisolTouraine s’est entretenue avec M. Satoshi Omura, #NobelPrize de médecine, ce matin à la Résidence https://t.c…",2016-09-09 08:09:33,774157782421413888
MarisolTouraine,"Avant le G7 Santé de Kobé, je rencontre à Tokyo la communauté française qui fait rayonner la France au Japon. https://t.co/RT0ASwt7JX",2016-09-08 12:01:57,773853880916381698
MarisolTouraine,"« Lutte contre la pauvreté : aux fatalistes, je dis que oui, la donne est en train de changer ». Ma tribune : https://t.co/JLzPGnayhJ",2016-09-07 08:37:49,773440122201210880
MarisolTouraine,Depuis 2012 : baisse ininterrompue du reste à charge des Français. Des résultats  concrets.  https://t.co/VLAISz69PU,2016-09-05 16:45:43,772838131741655040
MarisolTouraine,"Ce matin en Saône-et-Loire pour parler accès aux soins avec mon ami @chsirugue, Secrétaire d'Etat à l'industrie ! https://t.co/iJVDXsmBir",2016-09-02 16:59:04,771754325311950848
MarisolTouraine,"Restons mobilisés face à la #canicule. En ce week-end de retours de vacances, adoptons les bons gestes ! https://t.co/D0Hizw7qqq",2016-08-27 16:55:31,769579105415229440
MarisolTouraine,RT @manuelvalls: Canicule : entier soutien aux personnels de santé et pompiers mobilisés depuis plusieurs jours. Soyons attentifs ces proch…,2016-08-27 16:51:59,769578214628986880
