screenName,text,created,id
MarisolTouraine,"J'installe aujourd’hui le comité d’orientation sur la généralisation du tiers payant, qui sera généralisé pour tous les patients d'ici 2017",2014-02-18 10:45:02,435726647149346816
MarisolTouraine,"[8/8] La transformation profonde de notre système est engagée. Sur le terrain, des moyens ont été mobilisés et les résultats sont là.",2014-02-10 15:21:06,432897019724574720
MarisolTouraine,"[7/8] J’ai voulu déployer massivement les médecins correspondants de SAMU : ils étaient 150 en 2012, ils seront 650 à la fin de l’année !",2014-02-10 15:20:50,432896950313050112
MarisolTouraine,"[6/8] Accès aux urgences : en 2012, 2M de Français étaient à + de 30mn de soins urgents. Fin 2014, grâce à nos actions, ce sera moitié moins",2014-02-10 15:20:37,432896897481592834
MarisolTouraine,[5/8] Je veux multiplier les maisons de santé sur le territoire. En 2012 il y en avait - de 200. En 2013 : 370. Fin 2014 : il y en aura 600!,2014-02-10 15:20:25,432896845874880513
MarisolTouraine,"[4/8] J'ai créé le dispositif PTMG : 200 """"assurances-installation"""" pour les médecins. Face à son succès, il y en aura 200 nouveaux pour 2014",2014-02-10 15:20:13,432896796067508224
MarisolTouraine,"[3/8] J'ai voulu que + d'étudiants accèdent aux CESP (bourses pour s'installer dans les déserts médicaux) : en 1 an, augmentation de 65% !",2014-02-10 15:20:02,432896747979800577
MarisolTouraine,"[2/8] Je veux favoriser les stages en médecine générale des étudiants : 50% d'entre eux y avaient accès en 2012, ils sont aujourd'hui 60% !",2014-02-10 15:19:43,432896669357580289
MarisolTouraine,"[1/8] Fin 2012 je lançais le Pacte Territoire-Santé pour lutter contre les déserts médicaux. 1 an plus tard, les résultats concrets sont là",2014-02-10 15:19:31,432896618954649600
MarisolTouraine,Cet hélicoptère va permettre à 70 000 personnes d'accéder aux urgences en moins de 30min. Engagement tenu ! http://t.co/Qm5zPJRPOy,2014-02-10 13:43:07,432872358123405312
MarisolTouraine,"Avec les élus de Saône-et-Loire, j'inaugure le nouvel hélicoptère pour garantir l'accès aux soins urgents http://t.co/d2cNZHNptP",2014-02-10 13:29:10,432868847155425280
MarisolTouraine,"RT @JFAchilli: @MarisolTouraine, la ministre de la #santé, sera demain mon invitée à 8h15 sur @franceinfo, après l'édito politique de 7h40.…",2014-02-09 17:10:52,432562252487860224
MarisolTouraine,"Avec Huguette Bello, je pose la 1e pierre d'un nouvel hôpital de 310 lits pour les habitants de l'Ouest de la Réunion http://t.co/ELTRh1oxN6",2014-02-07 13:17:49,431778829523505152
MarisolTouraine,"Avec Huguette Bello, je m'apprête à poser la 1è pierre du nouvel hôpital """"Pôle sanitaire de l'Ouest"""" de La Réunion ! http://t.co/ixOfDGGHCC",2014-02-07 12:24:25,431765388607885312
MarisolTouraine,"Auprès des professionnels et des élus de La Réunion, je rappelle mon soutien à la fac de médecine et au CHU http://t.co/mXyfrQQ0UP",2014-02-07 10:34:00,431737603810131968
MarisolTouraine,"Au CHU de La Réunion, j'annonce l'arrivée d'un hélicoptère pour l'accès aux soins urgents en moins de 30min http://t.co/SYQPgMKraE",2014-02-07 10:23:42,431735010933346304
MarisolTouraine,"Avec Patrick Lebreton, je signe un contrat local de santé pour la ville de Saint-Joseph. Axe majeur : la prévention ! http://t.co/P14ZQ7BhYm",2014-02-07 09:45:40,431725438793445376
MarisolTouraine,"Avec les acteurs de la lutte anti-vectorielle à La Réunion, je rends visite à un particulier confronté aux moustiques http://t.co/NZrnAq7Ig5",2014-02-07 08:50:36,431711580108374017
MarisolTouraine,"Avec les élus de Saint-Denis, je visite un chantier de nettoyage d'une ravine, pour lutter contre les moustiques http://t.co/714P9SDYXo",2014-02-07 08:48:24,431711027692978177
MarisolTouraine,"Dans une école de St Denis, présentation d'une action pédagogique de lutte contre les moustiques à une classe de CM2 http://t.co/cwLfsiXyVt",2014-02-07 08:45:46,431710364678750209
MarisolTouraine,"A la maison de santé de Bras-Panon, présentation du parcours de soins du patient diabétique.Enjeu majeur à La Réunion http://t.co/RLDIF12FiH",2014-02-06 13:26:50,431418710356926464
MarisolTouraine,"Je viens d'annoncer à @jvlody que j'ai décidé de débloquer les crédits pour reconstruire l'EHPAD du Tampon, dossier bloqué depuis des années",2014-02-06 12:27:38,431403811450941440
MarisolTouraine,"A La Réunion, le diabète est 2x plus élevé qu'en métropole. Il s'agit d'une cause régionale qui doit nous mobiliser ! http://t.co/6cycKuBzKT",2014-02-06 12:22:26,431402501158756352
MarisolTouraine,"A La Réunion, je rappelle que si l'engagement pr l'avenir de la santé est le même partout en France, les défis à relever,eux, ne le sont pas",2014-02-06 12:17:14,431401194565959680
MarisolTouraine,"Débat sur la stratégie nationale de Santé à La Réunion. Échanges très riches avec patients, professionnels, et élus ! http://t.co/67cwrzJhx4",2014-02-06 12:11:51,431399839893831680
MarisolTouraine,Réunion de travail à la CAF Sainte-Marie sur le schéma départemental de services aux familles de La Réunion http://t.co/atnwNfBly1,2014-02-06 11:44:42,431393009167773696
MarisolTouraine,J'ai visité la crèche de Sainte-Marie en compagnie des élus de La Réunion. Un très bel établissement. http://t.co/lY8VfwYtrg,2014-02-06 11:38:25,431391425042083840
MarisolTouraine,"Je me suis entretenue avec la députée @ebareigts sur la coordination pluri-professionnelle autour des grossesses précoces, sujet majeur ici",2014-02-06 09:44:14,431362689156521984
MarisolTouraine,Je viens d'arriver à La Réunion pour un déplacement dans le cadre du Forum régional sur la stratégie nationale de santé,2014-02-06 09:35:02,431360377558159360
MarisolTouraine,"RT @Direct_Matin: À la une de #DirectMatin demain, itv de M. Touraine sur le #plancancer : """"TROP D'INÉGALITÉS FACE À LA MALADIE"""" http://t.c…",2014-02-04 22:22:21,430828701606248448
MarisolTouraine,"#PlanCancer : mieux guérir, lutter contre les inégalités, améliorer la recherche. Le cancer est la première cause de mortalité évitable.",2014-02-04 09:57:26,430641237612572672
MarisolTouraine,"Avec @fhollande qui annonce ce matin le #PlanCancer. Selon le milieu social, le risque de décéder d'un cancer peut être multiplié par 2,5",2014-02-04 09:57:05,430641147133034496
MarisolTouraine,Conclusion du Forum Stratégie nationale de santé en Alsace. + de 400 pers venues parler de l'avenir de notre système http://t.co/SW4OtOCDqE,2014-01-30 18:31:04,428958559129587712
MarisolTouraine,"Avec @Roland_Ries, je signe à Strasbourg la Charte """"Villes actives"""" du Programme National Nutrition Santé http://t.co/LByOh0HUYD",2014-01-30 15:34:57,428914238229200897
MarisolTouraine,"J'inaugure le dispositif de prise en charge coordonnée des enfants obèses et en surpoids à Strasbourg, Cité de l'Ill http://t.co/7uYmHiryZN",2014-01-30 15:11:54,428908434189455360
MarisolTouraine,".@Allodocteurs effectivement révolutionnaire ! A d'autres équipes, maintenant, de confirmer cette belle avancée !",2014-01-30 13:33:40,428883712965902336
MarisolTouraine,"A Strasbourg avec @fhollande, nous visitons l'IRCAD. Là où se préparent les méthodes chirurgicales de demain ! http://t.co/7RW44F3k8V",2014-01-30 12:08:12,428862208291110912
MarisolTouraine,.@christineboutin et on ne vous a pas entendue qd nous avons annoncé 1650 solutions d'hébergement pr femmes victimes de violences @leLab_E1,2014-01-27 11:50:16,427770528150355968
MarisolTouraine,.@christineboutin vous défendez une vision Pierrafeu de la famille et de la société. Je persiste : l'IVG est un droit ! cc @leLab_E1,2014-01-27 11:48:07,427769990482501632
MarisolTouraine,"La France à nouveau championne d'Europe de handball, félicitations aux Experts ! Jour de bonheur ! #FRADAN #JourDeBonheur",2014-01-26 19:27:35,427523230342344704
MarisolTouraine,Une mesure de justice pour les travailleurs pauvres : la fin de la double-peine pour ceux qui ne touchaient rien quand ils étaient malades,2014-01-24 16:08:38,426748387627917312
MarisolTouraine,Grande avancée suite au plan pauvreté : il faudra désormais avoir travaillé 150h (et non 200h) pour avoir droit aux indemnités journalières,2014-01-24 16:08:20,426748309580292096
MarisolTouraine,"Toujours à Lille, échanges avec la salle sur la Stratégie nationale de Santé, pour préparer la grande loi de santé http://t.co/fYWUyR957Q",2014-01-23 15:53:57,426382302110035968
MarisolTouraine,"A Lille, débat sur la Stratégie nationale de Santé. Plus de 450 personnes venues échanger sur la Santé en NPDC ! http://t.co/kP1ZjL5Kj6",2014-01-23 14:58:29,426368342929444864
MarisolTouraine,"Aux côtés de @Guy_Delcourt et @S_Robert2014 j'ai réaffirmé mon soutien au projet de reconstruction du CH de Lens, examiné avant la fin 2014",2014-01-23 14:17:42,426358080423866368
MarisolTouraine,"Échange sur l'avenir du CH de Lens avec la direction, les professionnels, ainsi que @Guy_Delcourt et @S_Robert2014 http://t.co/Fe85tLM5sn",2014-01-23 13:43:36,426349499003731969
MarisolTouraine,Cette plateforme permet de dialoguer à distance avec des neurologues spécialisés dans la prise en charge des AVC http://t.co/1fZ46qabGw,2014-01-23 13:19:59,426343556161482752
MarisolTouraine,Plateforme télé-AVC à Lens. Formidable opportunité pour la prise en charge à distance des urgences neurovasculaires! http://t.co/tlEsHRKDb8,2014-01-23 13:03:02,426339289438646272
MarisolTouraine,Déplacement dans le Pas-de-Calais. Je visite le Centre hospitalier de Lens aux côtés de @Guy_Delcourt http://t.co/BOKmi9YIEq,2014-01-23 12:58:50,426338234134958080
MarisolTouraine,"RT @Michel_MENARD: .@MarisolTouraine""""Je trouve incroyable que l'#UMP ne dise pas haut et fort qu'elle condamne le projet de loi en Espagne""""…",2014-01-21 15:13:55,425647451048271873
MarisolTouraine,Toujours pas de réponse de @jf_cope à ma demande de clarification de l'UMP hier sur l'IVG. Vous êtes mal à l'aise sur le sujet..?,2014-01-21 14:01:29,425629224515682304
MarisolTouraine,"Alors que des députés UMP veulent dérembourser l'IVG, je demande solennellement à @jf_cope de clarifier la position de l'UMP sur ce sujet",2014-01-20 19:05:59,425343465212612609
MarisolTouraine,"RT @canalplus: Ce soir au @GrdJournal : Marc Trévidic, Dounia Bouzar, Bernard Kouchner, @MarisolTouraine, Marina Carrère d’Encausse. #LGJ",2014-01-20 16:59:30,425311636560560128
MarisolTouraine,"2/2 Je me réjouis de cette décision. La réforme des retraites est une grande réforme de progrès social : juste, efficace, et structurelle !",2014-01-16 17:01:26,423862571255730176
MarisolTouraine,1/2 Le Conseil Constitutionnel vient de déclarer conforme à la Constitution la loi garantissant l'avenir et la justice de nos retraites,2014-01-16 17:00:17,423862281924247552
MarisolTouraine,Je suis avec @jm_leguen et Martin Hirsch à l'Hôpital Robert Debré pour lancer le fonds d'investissement de l'AP-HP http://t.co/1caE5PbWwV,2014-01-13 16:06:18,422761532368633856
MarisolTouraine,RT @JeanMallot: À Clermont Fd avec Marisol Touraine au Forum régional sur la Stratégie nationale se santé. http://t.co/MFtuy9WrTQ,2014-01-10 15:20:49,421662921157279744
MarisolTouraine,Je participe au débat régional Auvergne de la Stratégie nationale de Santé. Plus de 600 personnes sont présentes ! http://t.co/e4Xb9eN5wn,2014-01-10 15:19:49,421662670828613633
MarisolTouraine,Accueil très chaleureux de JP Bacquet à Coudes où je signe un contrat local de santé pour le bassin d'Issoire http://t.co/L63ZSAX8jx,2014-01-10 15:10:14,421660258684379136
MarisolTouraine,"La mobilisation des élus est essentielle. Ils sont autour de moi ce matin : ici @cpiresbeaune, J-B Magner et M André http://t.co/ku33h4iCUw",2014-01-10 10:37:01,421591503317008384
MarisolTouraine,Les Dr Vigneresse et Senegas s'engagent comme médecins correspondants de SAMU. L'accès aux soins urgents progresse ! http://t.co/mII6vXPUPA,2014-01-10 10:34:25,421590846363168768
MarisolTouraine,"A Pontaumur, debat sur les déserts médicaux. Nos territoires sont créatifs! Les bonnes solutions viennent du terrain http://t.co/vv9liqtnIM",2014-01-10 10:32:28,421590358183530497
MarisolTouraine,"Grande joie d'être en déplacement à Pionsat, avec le personnel de l'EHPAD, @cpiresbeaune et Jacques-Bernard Magner http://t.co/eqQ9Z3vCfr",2014-01-10 09:10:50,421569813526638592
MarisolTouraine,Signature de contrats d'engagements de service public avec jeunes médecins et dentistes étudiants à Clermont Ferrand http://t.co/vQrV25bKc8,2014-01-10 09:07:20,421568932181712896
MarisolTouraine,"En déplacement dans le Puy-de-Dôme, on me remet les clés de la maison de santé pluridisciplinaire de Pionsat http://t.co/PrCXO33f3Y",2014-01-10 08:50:40,421564738691424256
MarisolTouraine,"Je salue à Auxerre le dévouement de l'ensemble du personnel hospitalier, qui comme chaque jour sera totalement mobilisé en ce #31décembre",2013-12-31 14:03:22,418019552673677312
MarisolTouraine,"L'hélicoptère des secours du CH d'Auxerre, qui réalise 580 interventions/an, est prêt pour ce #31decembre http://t.co/fWKfcSEafu",2013-12-31 13:53:22,418017034710945792
MarisolTouraine,Visite du CH d'Auxerre. Je suis venue rendre hommage aux professionnels de santé mobilisés ce #31décembre http://t.co/YIzzITbwwU,2013-12-31 13:45:56,418015164143661056
MarisolTouraine,Je suis venue féliciter les médecins et infirmières de l'HEGP qui ont réalisé cette 1ère mondiale. http://t.co/ErTNohTSUk,2013-12-21 13:13:44,414383181811679232
MarisolTouraine,"Avec Alain Carpentier, qui m'explique le fonctionnement du cœur artificiel qu'il a inventé #CARMAT #géniefrançais http://t.co/bzTKLKizd0",2013-12-21 13:02:48,414380432516718593
MarisolTouraine,"RT @Minist_Sante: Implantation du cœur artificiel CARMAT : Une grande fierté pour la France, selon Marisol Touraine http://t.co/UZoILv1WiW …",2013-12-20 17:58:53,414092556717551617
MarisolTouraine,"Comme un coeur normal, la prothèse accélère son rythme avec l’effort, le ralentit avec le repos.Elle offre un espoir nouveau. #géniefrançais",2013-12-20 17:30:21,414085373866680320
MarisolTouraine,"Bravo à l'inventeur A Carpentier, aux chirurgiens JN Fabiani, C Latrémouille, D Duveau et à toute l'équipe de l'HEGP ! #excellencefrançaise",2013-12-20 17:19:06,414082542367932416
MarisolTouraine,Fière d'une grande 1ère mondiale : 1 cœur artificiel fonctionnant comme 1 cœur normal. Conception développement implantation 100% français!,2013-12-20 17:18:49,414082473912700928
MarisolTouraine,"Nous, on a décidé de le rembourser à 100%, et de favoriser son développement dans + d'hôpitaux. #ProgrèsVsRégression http://t.co/MTLkH06HyO",2013-12-20 16:17:30,414067042078031873
MarisolTouraine,Vous pouvez consulter la timeline @Minist_Social où les experts de http://t.co/zpVEuBYJsr ont ce matin répondu aux questions des internautes,2013-12-19 13:29:12,413662300231303168
MarisolTouraine,"J'ai passé au total 298h au Parlement cet automne ! Débats constructifs, parfois vifs, mais toujours à gauche cette belle volonté de progrès",2013-12-18 19:16:35,413387333363572736
MarisolTouraine,"Notre réforme sauve le système par répartition. Preuve qu'une réforme des #retraites de justice,de progrès et de responsabilité est possible",2013-12-18 17:08:48,413355178407256064
MarisolTouraine,"Progrès pour les agriculteurs, qui auront une une pension minimale garantie à 75% du SMIC, l'amélioration des retraites de leurs conjoints",2013-12-18 17:06:46,413354663854223361
MarisolTouraine,"Progrès pour les assurés handicapés et leurs aidants, avec un accès plus facile à la retraite anticipée et à taux plein sans condition",2013-12-18 17:05:47,413354417304633344
MarisolTouraine,"Progrès pour les chômeurs et les carrières heurtées, avec deux trimestres supplémentaires de chômage comptabilisés pour valider les droits",2013-12-18 17:04:37,413354121669140481
MarisolTouraine,"Progrès pour les retraités modestes avec la double revalorisation de l'ASPA en 2014, la revalorisation de 10% de l'ACS",2013-12-18 17:03:36,413353868022779905
MarisolTouraine,Progrès pour les femmes avec la prise en compte de TOUS les trimestres de maternité sans exception,2013-12-18 17:02:50,413353672920530944
MarisolTouraine,"Progrès pour les jeunes avec une meilleure prise en compte des périodes d'apprentissage, de stage, d'études",2013-12-18 17:02:09,413353502183018496
MarisolTouraine,Progrès pour les salariés ayant travaillé à temps partiel avec la validation d'un trimestre dès 150h de travail au lieu de 200h,2013-12-18 17:01:40,413353383257710592
MarisolTouraine,"Progrès pour les salariés exposés à la pénibilité, avec la création du compte pénibilité pour tenir compte des conditions de travail",2013-12-18 17:00:54,413353189883523075
MarisolTouraine,Le projet de loi #retraites définitivement adopté. Présence massive des députés de la majorité pour soutenir cette réforme de progrès !,2013-12-18 16:58:31,413352588449681408
MarisolTouraine,Una magnifica victoria de allégria y espéranaa. Congratulaciones afectuosas ¡ Presidenta Michelle Bachelet !,2013-12-16 08:12:38,412495468909064192
MarisolTouraine,"De retour de Londres, où je participais aujourd'hui au sommet du G8 Santé. Échanges passionnants. http://t.co/YHFSnOfGx5",2013-12-11 15:36:22,410795197497241600
MarisolTouraine,RT @benoithamon: L'action de groupe santé vient d'être inscrite dans le 3ème pilier de la stratégie nationale de santé par @MarisolTouraine,2013-12-10 10:25:03,410354466404442112
MarisolTouraine,Cela rappelle que nous devons être fiers de notre système de santé. Pour renforcer sa justice nous généraliserons le tiers payant d'ici 2017,2013-12-09 20:32:14,410144879919239168
MarisolTouraine,"Tous les ans, 100 millions de personnes tombent dans la pauvreté à cause de frais de santé qu'elles ne peuvent assumer (Banque mondiale)",2013-12-09 20:32:01,410144827259768832
MarisolTouraine,"Vidéo très sympa, par le personnel du CH d'Argenteuil, sur l'hygiène des mains ! Équipe soudée, bonne humeur au rdv ! http://t.co/yznjmrMX7x",2013-12-07 10:52:04,409274103875764224
MarisolTouraine,Je suis intervenue aux 13èmes rencontres de la Fédération de l’hospitalisation privée (FHP) à Marseille http://t.co/RsgFXYbldH,2013-12-03 13:41:45,407867253518897152
MarisolTouraine,"Avec @pierremoscovici et @trepentin, nous avons signé ce matin le protocole Hôpital Avenir avec la #BEI http://t.co/SIL57vDwZX",2013-12-03 11:10:07,407829092633829376
MarisolTouraine,RT @LaurentFabius: Signature d'un Accord-cadre entre la #France et #OMS avec Margaret Chan et @MarisolTouraine http://t.co/QlPnNvGJOD,2013-12-02 14:44:06,407520556125544448
MarisolTouraine,"Le combat contre le #sida est une de mes grandes priorités. En 2014, la France sera le 1er pays européen à commercialiser des autotests.",2013-12-01 10:16:39,407090862909554688
MarisolTouraine,"Journée mondiale de lutte contre le #sida : fière d'annoncer que la TVA sur les préservatifs va diminuer le 1er janvier, et non augmenter !",2013-12-01 10:12:02,407089700051361792
MarisolTouraine,.@MimicaEU Likewise ! It was nice meeting you. Thank you for that very  productive meeting,2013-11-28 16:08:42,406092292882464768
MarisolTouraine,Une étape décisive est franchie. Cette réforme de progrès préserve notre système par répartition et crée des droits nouveaux #retraites,2013-11-26 17:10:28,405383060897939456
MarisolTouraine,"La réforme des #retraites vient d'être adoptée par l'Assemblée nationale, avec une majorité encore plus large qu'en 1ère lecture ! #DirectAN",2013-11-26 17:03:27,405381298090696704
MarisolTouraine,"L’aide à la complémentaire santé pour les personnes âgées sera majorée de 10%. Cela fait 50€ en + pour 1,1 million de pensionnés modestes !",2013-11-26 11:22:38,405295526544805888
MarisolTouraine,"L’allocation de solidarité aux personnes âgées sera revalorisée deux fois en 2014, un véritable coup de pouce pour les 550 000 bénéficiaires",2013-11-26 11:22:22,405295462074167296
MarisolTouraine,"Cette nuit à l'Assemblée nationale, j'ai annoncé deux mesures fortes pour les retraités modestes. Elles entreront en vigueur dès 2014.",2013-11-26 11:22:12,405295417849434112
MarisolTouraine,"En tant que femme, en tant que ministre, je salue avec émotion la mémoire de Lucien Neuwirth,artisan du droit fondamental à la contraception",2013-11-26 09:26:44,405266361422581760
MarisolTouraine,"Lucien Neuwirth était un homme épris de liberté, prêt à se battre contre les conservatismes pour faire avancer le droit des femmes.",2013-11-26 09:24:47,405265871758573569
MarisolTouraine,RT @Ch_Gonesse: Discussion entre @MarisolTouraine et #sages-femmes du #chgonesse @France3Paris @lagazette95 @LeParisien_95 @laFHF http://t.…,2013-11-22 14:50:31,403898292385640448
MarisolTouraine,"Dans l'hémicycle pour les #retraites, on apprend la qualification des bleus. Courte suspension de séance pour un moment d'union nationale !",2013-11-19 22:06:44,402920906634567680
MarisolTouraine,"Sans surprise, le #PLFSS2014 ne sera pas adopté au Sénat, mais chacun aura pu exprimer clairement ses convictions sur le texte du gvt",2013-11-14 12:02:42,400956955365101568
MarisolTouraine,Nouvelle délib sur le #PLFSS2014 : les sénateurs socialistes sont satisfaits de pouvoir voter pour le texte du gouvernement non détricoté,2013-11-14 12:00:54,400956503697281026
MarisolTouraine,"Une abjecte de """"Minute"""", le journal de ceux qui n'aiment pas la France et incitent à la haine raciale",2013-11-12 11:32:42,400224629853147137
MarisolTouraine,"Sans surprise, les sénateurs socialistes ont voté contre un texte dans lequel il ne restait rien : ni justice, ni financement. Merci à eux !",2013-11-05 18:27:20,397792259955245056
MarisolTouraine,"Dans l'hémicycle au Sénat, nous nous sommes réjouis de l'annonce de la libération des otages d'#Arlit. Heureuse et émue par cette nouvelle !",2013-10-29 17:59:33,395248553918222336
MarisolTouraine,Le projet de loi garantissant l'avenir et la justice de nos #retraites adopté par l'Assemblée. Fière de porter cette réforme de progrès !,2013-10-15 16:13:02,390148317004316672
MarisolTouraine,«L'accompagnement du vieillissement est un défi pour l'avenir ». Une belle loi en préparation avec @micheledelaunay ! http://t.co/wKQDpt1RO1,2013-10-15 08:46:17,390035888547192832
MarisolTouraine,Pourquoi choisir d'être dépendant quand on peut être libre ? Partagez le nouveau spot INPES contre le tabac http://t.co/FA7BC0JRqk,2013-10-14 10:17:16,389696401359114240
MarisolTouraine,"RT @gerardsebaoun: 4eme nuit PL Retraites @MarisolTouraine, création compte personnel pénibilité @Juanico @christianpaul58 @chantalguittet …",2013-10-10 23:33:49,388447305529307136
MarisolTouraine,"RT @Juanico: Travail de nuit dans l'hémicycle #AN pour la bonne cause, concrétiser notre engagement sur la #pénibilité #travail #progrès @M…",2013-10-10 23:19:34,388443718996721664
MarisolTouraine,"Dans l'hémicycle pour les retraites, j'apprends avec tristesse la mort de Patrice Chéreau. Merci à lui d'avoir nourri mon imaginaire...",2013-10-07 21:37:21,387330833943912448
MarisolTouraine,RT @Bruce_Toussaint Quand @MarisolTouraine joue les critiques télés pour la nouvelle saison de #Borgen ! http://t.co/DYHK7faDLb,2013-10-03 13:28:20,385758216933482496
MarisolTouraine,"Lancement du site : http://t.co/Dv2omgCICC. Information fiable pour les femmes, garantie du libre choix et du droit à disposer de son corps",2013-09-27 19:29:42,383674830676955136
MarisolTouraine,RT @Byayaba: . @MarisolTouraine : «Mon plan pour redresser les comptes de la Sécurité sociale» http://t.co/sSLYCO0snb,2013-09-25 19:25:51,382949084761706496
MarisolTouraine,"Je veux lutter contre les inégalités de santé : aujourd'hui, d'un bout à l'autre de la ligne B du RER, on perd 2 ans d'espérance de vie #SNS",2013-09-23 09:22:32,382072481882075136
MarisolTouraine,"Retrouvez toutes les annonces de la #SNS via le LT réalisé ce matin par @CabTouraine, et dans quelques instants sur http://t.co/8IBiusGVMc",2013-09-23 09:19:12,382071639904886784
MarisolTouraine,"Les """"class actions"""" à la française marqueront une étape décisive pour les droits des patients #SNS",2013-09-23 09:17:08,382071123258908672
MarisolTouraine,J'ai aussi annoncé une nouvelle étape pour les droits des patients : j'ouvre la voie aux actions collectives en justice dans la Santé #SNS,2013-09-23 09:16:36,382070988403671040
MarisolTouraine,"Concrètement, dans 4 ans au plus tard, les Français n'auront plus à avancer les frais lorsqu'ils iront consulter un médecin. #SNS",2013-09-23 09:15:45,382070774791942144
MarisolTouraine,Je lance dès aujourd'hui le chantier de la généralisation du tiers payant pour l'ensemble des soins de ville. Ce sera réalisé avant 2017,2013-09-23 09:15:12,382070635851423744
MarisolTouraine,J'ai présenté ce matin la stratégie nationale de santé pour les dix prochaines années #SNS,2013-09-23 09:14:08,382070366610681856
MarisolTouraine,Je serai à 11h55 l'invitée de Maïtena Biraben dans l'émission @LeSupplement politique sur Canal+. #LeSupplement,2013-09-22 09:02:15,381704985962364929
MarisolTouraine,RT @Elysee: François Hollande répondra aux questions de Claire CHAZAL dans le journal télévisé de 20H de TF1 #JTPR http://t.co/BiBwMezVms,2013-09-15 14:43:54,379254252390342656
MarisolTouraine,Avec les 6 jeunes parrainés emplois d'avenir dans le secteur sanitaire et médico-social privé à but non lucratif ! http://t.co/At26GiZnMT,2013-09-09 10:16:59,377012754843844608
MarisolTouraine,"A La Verrière (78) avec @benoithamon et @micheledelaunay, nous parrainons 6 emplois d'avenir ! http://t.co/8g403TX7Uw",2013-09-09 09:57:46,377007917519491072
